"Celsius Sparkling Cosmic Vibe, Energy Drink",,$3.59, https://www.instacart.com/image-server/272x272/www.instacart.com/assets/domains/product-image/file/large_98050ff7-5cc9-4e42-823e-47895560f3ab.jpeg 4x,"CELSIUS® is functional, Essential Energy, a better-for-you, premium alternative to traditional energy drinks. As a global, lifestyle fitness drink, CELSIUS® was created to help people LIVE FIT, exceed their goals and elevate their everyday lives. Our CELSIUS® VIBE Essential Energy Drinks feature bold flavor combinations that transport you beyond the can to amazing global destinations that inspire us all. From sunny, tropical beaches, to snowy mountainscapes. What’s your vibe? Made with proven, premium ingredients, 7 Essential Vitamins and zero sugar, no artificial colors, no aspartame, no high fructose corn syrup and non-GMO. CELSIUS® is vegan, gluten-free and Kosher. Our proprietary MetaPlus blend contains green tea extract with EGCG. It also includes guarana seed extract, ginger root for flavor and digestion, vitamin C to help support your immune system, vitamin B for energy production, and chromium to help control hunger, making it an ideal pre-workout drink. Every sip of this flavor feels like a new infinite & refreshing sensory experience with exotic and sweet notes of strawberry, lemon, orange, mandarin & blueberry; the unexpected cosmic mystery of our new flavor is inspired by a mystic galaxy! Made with clinically proven ingredients, this carbonated flavor of CELSIUS® has the perfect balance of flavor and energy that serves as an awesome pick-me-up for active lifestyles. Make CELSIUS® your go to choice for Essential Energy!","Carbonated Filtered Water, Citric Acid, Taurine, Fruit Juice,(color), Guarana Seed Extract, Vegetable Juice (color), Caffeine, Green Tea,,Calcium Carbonate, Ascorbic Acid, Glucuronolactone, Sucralose, Ginger Root,Extract, Calcium Pantothenate, Niacinamide, Natural Flavor, Pyridoxine,Hydrochloride, Riboflavin, Chromium Chelate, Biotin, Cyanocobalamin.",Ready to Drink,"Do not exceed more than (2) servings per day. Not Recommended for people who are caffeine sensitive, children under 18, and women pregnant or nursing.",Gluten Free,,,,,
V8 V Fusion + Energy Pomegranate Blueberry Vegetable & Fruit Juice,,$7.89," https://www.instacart.com/image-server/272x272/www.instacart.com/assets/domains/product-image/file/large_408c0e91-dc75-4b01-9617-937a2c0323c2.jpg 4x, https://www.instacart.com/image-server/272x272/www.instacart.com/assets/domains/product-image/file/large_7385ca51-351d-461c-bc32-74857408ed16.jpg 4x, https://www.instacart.com/image-server/272x272/www.instacart.com/assets/domains/product-image/file/large_8d80bf12-6cc1-44bb-b5f3-b1382abcb38a.jpg 4x, https://www.instacart.com/image-server/272x272/www.instacart.com/assets/domains/product-image/file/large_023b347b-91d5-47af-9209-b548f42b1992.jpg 4x","Experience a delicious plant-powered energy boost with V8 +Energy® Pomegranate Blueberry Juice Energy Drink. Combining the flavors of sweet pomegranate and juicy blueberry, this concentrated fruit and vegetable juice blend is infused with natural energy from black and green tea. Each 8 fl oz can contains 1 combined serving of veggies and fruit along with 80 milligrams of caffeine – as much as leading energy drink brands. A healthy energy drink alternative, V8 +Energy® blueberry pomegranate juice contains 50 calories and 12 grams of carbs per can. It’s also an excellent source of B Vitamins. V8 +Energy® caffeinated juice drinks are non-GMO and gluten-free with no sugar added* and no artificial colors. Enjoy V8 +Energy® as a coffee substitute in the morning, in place of soda during the afternoon, or as a mocktail or cocktail mixer in the evening. It’s great anytime you need a plant based boost of natural caffeine. (*Not a low calorie food; see nutrition panel for sugar and calorie content)","Water, Vegetable Juice (water And Concentrated Juices Of Sweet Potatoes, Purple Carrots, Carrots), Fruit Juice (water And Concentrated Juices Of Apples, Blueberries, Pomegranates), Natural Flavoring, Malic Acid, Citric Acid, Caffeine From Black And Green Tea, Vitamin C (ascorbic Acid), Sucralose, Niacinamide (vitamin B3), Pyridoxine Hydrochloride (vitamin B6), Cyanocobalamin (vitamin B12)",Shake Well Before Opening.,"Caution: not recommended for children, pregnant or nursing women or people sensitive to caffeine.",Gluten Free,,,,,
"GHOST Energy Drink, Zero Sugar, Cherry Limeade",$2.89,$3.89, https://www.instacart.com/image-server/272x272/www.instacart.com/assets/domains/product-image/file/large_6e07121b-03d9-4708-a31d-21c01d19768f.jpeg 4x,Carnipure carnitine. Legendary energy. Epic focus. No artificial colors. Transparent label. Natural caffeine. Legends recycle.,"Carbonated Water, Natural And Artificial Flavor, Citric Acid, Carnipure® L-carnitine L-tartrate, Taurine, Malic Acid, Sucralose, Natural Caffeine (from Coffee Bean), Sodium Benzoate (preservative), Potassium Sorbate (preservative), Alpha-gpc (alpha-glyceryl Phosphoryl Choline 50%), Ascorbic Acid, Neurofactorth Coffee (coffea Arabica) Fruit Extract, Astragin® (10:1 Astragalus Membranaceus And 50:1 Panax Notoginseng) Root Extracts, Niacinamide, Pyridoxal-5-phosphate, Methylcobalamin",{},"Only intended for persons 18 years or older. Caution: This product is only intended for healthy adults, 18 years of age or older. Do not consume if you are sensitive to caffeine or in combination with caffeine or stimulants from other sources too much caffeine may cause nervousness, irritability sleeplessness, and occasionally rapid heart rate, not for use by women who are pregnant nursing, or trying to become pregnant. Consult a licensed, qualified healthcare professional before consuming this product do not use if you are taking any prescription drug and or have any medical condition.","Gluten Free,Soy Free",,,,,
Celsius Grape Energy Drink,$1.67,$2.99, https://www.instacart.com/image-server/272x272/www.instacart.com/assets/domains/product-image/file/large_2f8e2ad6-ba2e-47d3-b47d-7dd22c5fa9f2.png 4x,"CELSIUS® is functional, Essential Energy, a better-for-you, premium alternative to traditional energy drinks. As a global, lifestyle fitness drink, CELSIUS® was created to help people LIVE FIT, exceed their goals and elevate their everyday lives. Made with proven, premium ingredients, 7 Essential Vitamins and zero sugar, no artificial colors, no aspartame, no high fructose corn syrup and non-GMO. CELSIUS® is vegan, gluten-free and Kosher. Our proprietary MetaPlus blend contains green tea extract with EGCG. It also includes guarana seed extract, ginger root for flavor and digestion, vitamin C to help support your immune system, vitamin B for energy production, and chromium to help control hunger, making it an ideal pre-workout drink. Juicy, sweet, refreshing and a little nostalgic. Enjoy the flavor packed taste of CELSIUS® Sparkling Grape Rush! Made with clinically proven ingredients, this carbonated flavor of CELSIUS® has the perfect balance of flavor and energy that serves as an awesome pick-me-up for active lifestyles.","Carbonated Filtered Water, Taurine, Citric Acid, Fruit Juice (color),,Vegetable Juice (color), Guarana Seed Extract, Green Tea Extract, Caffeine,,Natural Flavor, Calcium Carbonate, Sucralose, Ascorbic Acid, Glucuronolactone,,Ginger Root Extract, Calcium Pantothenate, Niacinamide, Pyridoxine,Hydrochloride, Riboflavin, Chromium Chelate, Biotin, Cyanocobalamin.",Ready to Drink,"Do not exceed more than (2) servings per day. Not Recommended for people who are caffeine sensitive, children under 18, and women pregnant or nursing.",Gluten Free,,,,,
"Celsius ESSENTIALS Sparkling Cherry Limeade, Energy Drink",,$4.19, https://www.instacart.com/image-server/272x272/www.instacart.com/assets/domains/product-image/file/large_3ea7c175-34ae-4e8c-bbe6-89b365445988.jpeg 4x,"CELSIUS ESSENTIALS™ is the ultimate energy drink line by CELSIUS®, formulated for the fitness enthusiasts looking to elevate their performance. Made with our proprietary MetaPlus® formula and three essential aminos, CELSIUS ESSENTIALS™ provides you with an unbeatable combination of ingredients that support your physical and cognitive performance. With a specially formulated lineup of bold flavors, CELSIUS ESSENTIALS™ is a game changer for those wanting to unlock their full potential and take their fitness journey to the next level. With a refreshing flavor that is both balanced and invigorating, Sparkling Cherry Limeade delivers a bold burst of citrus notes and sweet cherries! Feel the surge of performance energy and experience the difference with CELSIUS ESSENTIALS™","Carbonated Filtered Water, Citric Acid, Taurine, Guarana Seed,Extract, Potassium Sorbate (preservative), Green Tea Extract, Caffeine,,Sucralose, Calcium Carbonate, Ascorbic Acid, Glucuronolactone, Natural,Flavor, Ginger Root Extract, Calcium Pantothenate, Acesulfame,Potassium, Niacinamide, L-Theanine, L-Isoleucine, L-Leucine, Pyridoxine,Hydrochloride, Riboflavin, Chromium Chelate, Biotin, Cyanocobalamin.",Ready to Drink,"Do not exceed more than (1) servings per day. Not Recommended for people who are caffeine sensitive, children under 18, and women pregnant or nursing.",Gluten Free,,,,,
"Celsius Original Variety Pack, Energy Drink",,$28.99," https://www.instacart.com/image-server/272x272/www.instacart.com/assets/domains/product-image/file/large_5f658398-e769-4cdb-8e8b-0347ae8047c1.png 4x, https://www.instacart.com/image-server/272x272/www.instacart.com/assets/domains/product-image/file/large_55b41855-ccba-4ca9-99a7-3d7441be58de.png 4x, https://www.instacart.com/image-server/272x272/www.instacart.com/assets/domains/product-image/file/large_fc48f8c8-86f5-4cdc-939c-022aa6ca63b4.png 4x, https://www.instacart.com/image-server/272x272/www.instacart.com/assets/domains/product-image/file/large_6b5ce0e3-471a-4cb4-b2e0-4c85534b9526.png 4x","CELSIUS® is functional, Essential Energy, a better-for-you, premium alternative to traditional energy drinks. As a global, lifestyle fitness drink, CELSIUS® was created to help people LIVE FIT, exceed their goals and elevate their everyday lives. Made with proven, premium ingredients, 7 Essential Vitamins and zero sugar, no artificial colors, no aspartame, no high fructose corn syrup and non-GMO. CELSIUS® is vegan, gluten-free and Kosher. Our proprietary MetaPlus blend contains green tea extract with EGCG. It also includes guarana seed extract, ginger root for flavor and digestion, vitamin C to help support your immune system, vitamin B for energy production, and chromium to help control hunger, making it an ideal pre-workout drink. CELSIUS® Original Variety Pack includes four cans of Kiwi Guava, Sparkling Orange, and Wild Berry. Made with clinically proven ingredients, this carbonated flavor of CELSIUS® has the perfect balance of flavor and energy that serves as an awesome pick-me-up for active lifestyles. Make CELSIUS® your go to choice for Essential Energy! CELSIUS® is available in 12 Fl Oz slim cans and sold in a 12-pack for convenience.","Carbonated Filtered Water, Citric Acid, Taurine, Guarana Seed Extract, Green Tea Extract, Caffeine, Vegetable Juice (color), Calcium Carbonate, Ascorbic Acid, Glucuronolactone, Sucralose, Ginger Root Extract, Calcium Pantothenate, Niacinamide, Natural Flavor, Pyridoxine Hydrochloride, Riboflavin, Chromium Chelate, Biotin, Fruit Juice (color), Beta-Carotene (color), Cyanocobalamin.",Ready to Drink,"Do not exceed (2) servings per day. Not Recommended for people who are caffeine sensitive, children under 18, and women pregnant or nursing.",Gluten Free,,,,,
V8 V-Fusion + Energy Peach Mango Vegetable & Fruit Juice,,$8.09," https://www.instacart.com/image-server/272x272/www.instacart.com/assets/domains/product-image/file/large_98ed0d9c-110e-4c78-8412-c980a46ee076.jpg 4x, https://www.instacart.com/image-server/272x272/www.instacart.com/assets/domains/product-image/file/large_4b3b87cd-c787-4d58-86c5-057857eebc0d.jpg 4x, https://www.instacart.com/image-server/272x272/www.instacart.com/assets/domains/product-image/file/large_f9d283c7-0936-4028-898f-c7461964167f.jpg 4x, https://www.instacart.com/image-server/272x272/www.instacart.com/assets/domains/product-image/file/large_9f37a133-803a-4cac-8f54-ef7e18c32e02.jpg 4x","Experience a delicious plant-powered energy boost with V8 +Energy® Peach Mango Juice Energy Drink. Combining the flavors of sweet peach and tropical mango, this concentrated fruit and vegetable juice blend is infused with natural energy from black and green tea. Each 8 fl oz can contains 1 combined serving of veggies and fruit along with 80 milligrams of caffeine – as much as leading energy drink brands. A healthy energy drink alternative, V8 +Energy® mango peach juice contains 50 calories and 12 grams of carbs per can. It’s also an excellent source of B Vitamins. V8 +Energy® caffeinated juice drinks are non-GMO and gluten-free with no sugar added* and no artificial colors. Enjoy V8 +Energy® as a coffee substitute in the morning, in place of soda during the afternoon, or as a mocktail or cocktail mixer in the evening. It’s great anytime you need a plant based boost of natural caffeine. (*Not a low calorie food; see nutrition panel for sugar and calorie content)","Water, Vegetable Juice (water And Concentrated Juices Of Sweet Potatoes, Carrots, Yellow Carrots), Fruit Juice (water And Concentrated Juices Of Apples, Peaches, Oranges), Natural Flavoring, Citric Acid, Mango Puree, Caffeine From Black And Green Tea, Vitamin C (ascorbic Acid), Sucralose, Niacinamide (vitamin B3), Pyridoxine Hydrochloride (vitamin B6), Cyanocobalamin (vitamin B12)",Shake Well Before Opening.,"Caution: not recommended for children, pregnant or nursing women or people sensitive to caffeine.",Gluten Free,,,,,
Bang Energy Black Cherry Vanilla,,"$3.49Buy 2, get 1 free"," https://www.instacart.com/image-server/272x272/www.instacart.com/assets/domains/product-image/file/large_a9f3337f-0f43-4345-b6e9-4669b47f553e.jpg 4x, https://www.instacart.com/image-server/272x272/www.instacart.com/assets/domains/product-image/file/large_6086440b-1142-4b8b-9aaa-a85758b02e76.jpg 4x, https://www.instacart.com/image-server/272x272/www.instacart.com/assets/domains/product-image/file/large_433f2e83-826d-4367-925d-cae73e896c9e.jpg 4x","Bang® is not your typical sugar-filled, crash-inducing energy drink. Every 16-ounce can contains 300 milligrams of caffeine which has been shown to increase endurance as well as strength in some cases. Yet every one of our 40+ flavors has ZERO sugars, carbs, or calories with a taste like no other!  Amazing flavor and a blast of energy are just the beginning though – Bang Energy drinks also contain other ingredients designed to help you get more out of your workout, your day, and your life! Get a dose of EAAs and CoQ10 that not only fuel your body but your mind as well!","Carbonated Water, Citric Acid Anhydrous, Natural And Artificial Flavors, Caffeine Anhydrous, Sodium Benzoate, (preserves Freshness), Potassium Citrate Monohydrate, Sucralose, L-leucine, Potassium Phosphate Dibasic, Vitamin C (ascorbic Acid), Acesulfame Potassium, Potassium Sorbate (preserves Freshness), Magnesium Chloride, Super Creatine (creatyl-l-leucine [creatine Bonded To L-leucine]), L-isoleucine, L-valine, Calcium Chloride, Calcium Disodium Edta, Vitamin B3 (niacinamide), Coq10 (coenzyme Q10), Vitamin B6 (pyridoxine Hydrochloride), And Vitamin B12 (methylcobalamin).",Best by date at bottom.,"Do not use this product if you are pregnant or nursing. Do not consume this product if you are taking any prescription drug and/or have any medical condition. The user of this product assumes all liability if this product is used in a manner not consistent with label guidelines. This product contains caffeine and should not be used with any other caffeine-containing products. This product is intended for use by healthy individuals only. Too much caffeine may cause nervousness, irritability, sleeplessness, and, occasionally, rapid heartbeat. Not recommended for use by children under 18 years of age. One can of Bang® provides 300 mg of caffeine, which is more than two cups of coffee. DISCLOSURE: These statements have not been evaluated by the Food and Drug Administration. This product is not intended to diagnose, treat, cure, or prevent any disease.",Gluten Free,,,,,
"Monster Energy Drink, Ultra Peachy Keen/Zero Ultra/Ultra Strawberry Dreams, Zero Sugar",,$28.09, https://www.instacart.com/image-server/272x272/www.instacart.com/assets/domains/product-image/file/large_d21b1616-c82c-40ff-81cc-81165563f631.png 4x,,"Ultra Peachy Keen® - Carbonated Water, Citric Acid, Taurine, Sodium Citrate, Panax Ginseng Flavor, Potassium Sorbate (preservative), Caffeine, Sucralose, Modified Corn Starch, Medium Chain Triglycerides, Sodium Benzoate (preservative), Niacinamide (vit. B3), Acesulfame Potassium, Natural Flavors, Salt, D-calcium Pantothenate (vit. B5), L-carnitine L-tartrate, Inositol, Pyridoxine Hydrochloride (vit. B6), Yellow 5, Yellow 6, Cyanocobalamin (vit. B12),zero Ultra - Carbonated Water, Citric Acid, Erythritol, Taurine, Sodium Citrate, Natural & Artificial Flavors, Panax Ginseng Flavor, L-carmitine L-tartrate, Caffeine, Sucralose, Sorbic Acid (preservative), Benzoic Acid (preservative), Niacinamide (vit. B3), D-calcium Pantothenate (vit. B5), Acesulfame Potassium, Inositol, Pyridoxine Hydrochloride (vit. B6), Cyanocobalamin (vit. B12),ultra Strawberry Dreams® - Carbonated Water, Erythritol, Citric Acid, Taurine, Sodium Citrate, Natural Flavors, Panax Ginseng Flavor, L-carnitine L-tartrate, Potassium Sorbate (preservative), Caffeine, Sucralose, Sodium Benzoate (preservative), Niacinamide (vit. B3), D-calcium Pantothenate (vit. B5), Beta Carotene (color), Inositol, Vegetable Juice Color, Pyridoxine Hydrochloride (vit. B6), Cyanocobalamin (vit. B12)",,"Consume responsibly: not recommended for children, people sensitive to caffeine, pregnant women or women who are nursing.",,,,,,
V8 V-Fusion + Energy Orange Pineapple Vegetable & Fruit Juice,$5.99,$6.69," https://www.instacart.com/image-server/272x272/www.instacart.com/assets/domains/product-image/file/large_4f8de2ac-42d0-421d-8cfe-84379e6eaf66.jpg 4x, https://www.instacart.com/image-server/272x272/www.instacart.com/assets/domains/product-image/file/large_eb0312c1-ebf6-4b5c-a7ac-d0baa60ee6c7.jpg 4x, https://www.instacart.com/image-server/272x272/www.instacart.com/assets/domains/product-image/file/large_ba432cc7-b9b5-467a-9d85-9536f56790c7.jpg 4x, https://www.instacart.com/image-server/272x272/www.instacart.com/assets/domains/product-image/file/large_a2bf8c2c-66fd-41f6-b530-b0ba2bc783c6.jpg 4x","Experience a delicious plant-powered energy boost with V8 +Energy® Orange Pineapple Juice Energy Drink. Combining the flavors of tangy orange and tropical pineapple, this concentrated fruit and vegetable juice blend is infused with natural energy from black and green tea. Each 8 fl oz can contains 1 combined serving of veggies and fruit along with 80 milligrams of caffeine – as much as leading energy drink brands. A healthy energy drink alternative, V8 +Energy® pineapple orange juice contains 50 calories and 12 grams of carbs per can. It’s also an excellent source of B Vitamins. V8 +Energy® caffeinated juice drinks are non-GMO and gluten-free with no sugar added* and no artificial colors. Enjoy V8 +Energy® as a coffee substitute in the morning, in place of soda during the afternoon, or as a mocktail or cocktail mixer in the evening. It’s great anytime you need a plant based boost of natural caffeine. (*Not a low calorie food; see nutrition panel for sugar and calorie content)","Water, Vegetable Juice (water And Concentrated Juices Of Sweet Potatoes, Carrots), Fruit Juice (water And Concentrated Juices Of Apples, Oranges, Pineapples), Natural Flavoring, Citric Acid, Caffeine From Black And Green Tea, Vitamin C (ascorbic Acid), Sucralose, Niacinamide (vitamin B3), Pyridoxine Hydrochloride (vitamin B6), Cyanocobalamin (vitamin B12)",Shake Well Before Opening.,"Caution: not recommended for children, pregnant or nursing women or people sensitive to caffeine.",Gluten Free,,,,,
"Celsius Sparkling Lemon Lime, Energy Drink",$2.29,$3.39," https://www.instacart.com/image-server/272x272/www.instacart.com/assets/domains/product-image/file/large_7556d6ee-94d9-4134-aef6-f99d20361b86.png 4x, https://www.instacart.com/image-server/272x272/www.instacart.com/assets/domains/product-image/file/large_a3b7a7ca-0a93-48da-8087-885cc40c81b4.png 4x, https://www.instacart.com/image-server/272x272/www.instacart.com/assets/domains/product-image/file/large_fefc0024-53f6-46fc-b390-b557069b46bd.png 4x","CELSIUS® is functional, Essential Energy, a better-for-you, premium alternative to traditional energy drinks. As a global, lifestyle fitness drink, CELSIUS® was created to help people LIVE FIT, exceed their goals and elevate their everyday lives. Made with proven, premium ingredients, 7 Essential Vitamins and zero sugar, no artificial colors, no aspartame, no high fructose corn syrup and non-GMO. CELSIUS® is vegan, gluten-free and Kosher. Our proprietary MetaPlus blend contains green tea extract with EGCG. It also includes guarana seed extract, ginger root for flavor and digestion, vitamin C to help support your immune system, vitamin B for energy production, and chromium to help control hunger, making it an ideal pre-workout drink. This crisp and refreshing flavor combines the perfect balance of citrusy sweet lemons and juicy, zesty limes. With just the right blend of tart and sweet, Lemon Lime has the perfect balance of flavor and energy to quench your tastebuds! Made with clinically proven ingredients, this carbonated flavor of CELSIUS® has the perfect balance of flavor and energy that serves as an awesome pick-me-up for active lifestyles. Make CELSIUS® your go to choice for Essential Energy!","Carbonated Filtered Water, Citric Acid, Taurine, Guarana,Seed Extract, Green Tea Extract, Caffeine, Ascorbic Acid, Sucralose,,Glucuronolactone, Ginger Root Extract, Calcium Pantothenate,,Niacinamide, Natural Flavor, Pyridoxine Hydrochloride, Riboflavin,,Chromium Chelate, Biotin, Cyanocobalamin.",Ready to Drink,"Do not exceed more than (2) servings per day. Not Recommended for people who are caffeine sensitive, children under 18, and women pregnant or nursing.",Gluten Free,,,,,
Red Bull Yellow Edition Tropical Energy Drink,$9.59,$11.09," https://www.instacart.com/image-server/272x272/www.instacart.com/assets/domains/product-image/file/large_4f321bb2-e7db-42de-a91c-59486220aabd.jpg 4x, https://www.instacart.com/image-server/272x272/www.instacart.com/assets/domains/product-image/file/large_e410cf36-257e-41cd-972e-91d7054ba56b.jpg 4x, https://www.instacart.com/image-server/272x272/www.instacart.com/assets/domains/product-image/file/large_87103e7e-7a24-43a2-b208-c6fabed2824d.jpg 4x, https://www.instacart.com/image-server/272x272/www.instacart.com/assets/domains/product-image/file/large_1410031b-5a7e-4b95-9a7a-3b52cd38daf1.jpg 4x","Red Bull Yellow Edition Tropical Energy Drink Gives You Wiiings Whenever You Need Them. Red Bull Yellow Edition Is A Lightly Carbonated Energy Drink With A Blend Of Caffeine, Taurine, B Vitamins, Real Sugar And Water, Along With A Perfect Blend Of Tropical Fruit Flavors.* With 110 Calories Per 8.4 Fl Oz Can, Red Bull Is Great For Any Occasion. While Aiming For Great Heights During Your Workday, In Your Workouts Or When Gaming, Why Not Crack Open A Refreshing Can Of Red Bull? Drink Red Bull Straight From The Can Or Enjoy In A Glass Over Ice. This 4-Pack Of Red Bull Will Keep You Stocked For Any Occasion, Whether It’S Hanging With Friends, Watching The Game Or Going On A Road Trip. Be Ready For The Big Moments With A Can Of Red Bull. Store These Cans Of Red Bull At Room Temperature Or Toss Them In The Fridge. Red Bull Gives You Wiiings. Always Check Can Labels For Most Updated Product Nutritional And Ingredient Information. Calcium And Sugars Values Declared On Labels May Vary Slightly Depending On Production Locations.","Carbonated Water, Sugar, Glucose, Citric Acid, Taurine, Sodium Citrate, Natural And Artificial Flavors, Caffeine, Colors, Niacinamide, Glycerol Ester Of Wood Rosin, Sucrose Acetate Isobutyrate, Pyridoxine Hcl (vitamin B6), Calcium Pantothenate, Vitamin B12.",Best before: See base of can.,"Not recommended for children, pregnant or nursing women and persons sensitive to caffeine.",,,,,,
