Red Bull Green Edition Dragon Fruit Energy Drink,,$2.77," https://www.instacart.com/image-server/272x272/www.instacart.com/assets/domains/product-image/file/large_30bd5b2f-8447-437c-a949-c577a40c2df4.jpg 4x, https://www.instacart.com/image-server/272x272/www.instacart.com/assets/domains/product-image/file/large_5fd900cb-3867-4c15-8b3a-c672e7393bf6.jpg 4x, https://www.instacart.com/image-server/272x272/www.instacart.com/assets/domains/product-image/file/large_dc78bd8e-caf4-46db-8ed3-25ee21a178e8.jpg 4x, https://www.instacart.com/image-server/272x272/www.instacart.com/assets/domains/product-image/file/large_6c96d25e-e8fa-458f-8f5c-585ca6b20004.jpg 4x","Red Bull Green Edition Dragon Fruit Energy Drink Gives You Wiiings Whenever You Need Them. Red Bull Green Edition Is A Lightly Carbonated Energy Drink With A Blend Of Caffeine, Taurine, B Vitamins, Real Sugar And Water With The Exotic Taste Of Dragon Fruit.* With 110 Calories Per 8.4 Fl Oz Can, Red Bull Is Great For Any Occasion. While Aiming For Great Heights During Your Workday, In Your Workouts Or When Gaming, Why Not Crack Open A Refreshing Can Of Red Bull? Drink Red Bull Straight From The Can Or Enjoy In A Glass Over Ice. This Can Of Red Bull Will Keep You Ready For Any Occasion, Whether It’S Hanging With Friends, Watching The Game Or Going On A Road Trip. Be Ready For The Big Moments With A Can Of Red Bull. Store This Can Of Red Bull At Room Temperature Or Toss It In The Fridge. Red Bull Gives You Wiiings. Always Check Can Labels For Most Updated Product Nutritional And Ingredient Information. Calcium And Sugars Values Declared On Labels May Vary Slightly Depending On Production Locations.","Carbonated Water, Sugar, Glucose, Citric Acid, Taurine, Sodium Citrate, Natural And Artificial Flavors, Caffeine, Color, Niacinamide, Pyridoxine Hci (vitamin B6), Calcium Pantothenate, Blue 1, Vitamin B12.",{},"Not recommended for children, pregnant or nursing women and persons sensitive to caffeine.",,,,,,
Monster Energy Monster Rehab Wild Berry Tea,,$3.59, https://www.instacart.com/image-server/272x272/www.instacart.com/assets/domains/product-image/file/large_38312dc4-e406-4883-ae8a-d6fe5ab602c9.jpg 4x,"It’s 2 P.M. Still sleeping, but who’s banging on the door? “Housekeeping!” Your eyes open to see a mermaid scoot her ass across the floor. The housekeeper screams and mutters a prayer. This can’t be right. Your eyes close. It’s after 4 now. Your head’s pounding. So many questions. You’ve got to meet everyone downstairs in an hour to do it all again. Not a problem. You’re a professional. You crack open a Rehab Monster Wild Berry Tea and let the wild berry tea-infused electrolytes, vitamins, and botanicals work their life-giving, hydration magic. Congrats, You’re back from the dead.","Brewed Tea (filtered Water, Black Tea Solids), Glucose, Apple Juice Concentrate, Taurine, Citric Acid, Panax Ginseng Flavor, Natural Flavors, Magnesium Lactate, Sodium Citrate, Calcium Lactate, Monopotassium Phosphate, Caffeine, Sucralose, Concentrated Coconut Water, Niacinamide (vit. B3), Salt, D-calcium Pantothenate (vit.b5), L-carnitinel-tartrate, Inositol, Milk Thistle Extract, Quercetin Dihydrate, Acai Puree, Mangosteen Concentrate, Goji Berry Puree, Pyridoxine Hydrochloride (vit, B6), Cyanocobalamin (vit. B12).",{},Allergen info: contains coconut,,,,,,
"C4 Energy Energy Drink, Orange Slice",,$3.29," https://www.instacart.com/image-server/272x272/www.instacart.com/assets/domains/product-image/file/large_fc2d75f3-5c1e-48b9-9859-aa6f918ef54f.jpg 4x, https://www.instacart.com/image-server/272x272/www.instacart.com/assets/domains/product-image/file/large_829a55cd-6215-4d1a-9926-b52a65d576df.png 4x, https://www.instacart.com/image-server/272x272/www.instacart.com/assets/domains/product-image/file/large_24a295aa-ff85-4769-9cf7-0228f2e2f1e3.png 4x, https://www.instacart.com/image-server/272x272/www.instacart.com/assets/domains/product-image/file/large_96bc3979-6a2d-430b-9580-d51bce9238f0.png 4x","There’s energy drinks…and then there’s C4 Energy. C4 Energy's incredible flavor is made with no sugar, zero calories, no artificial flavors, and no compromise on taste. Featuring 200 MG of caffeine and proven ingredients like CarnoSyn Beta-Alanine and BetaPower Betaine, you are about to experience explosive energy, hydration, and endurance.","Carbonated Water, Carnosyn® Beta-alanine, L-citrulline, Betapower® Betaine Anhydrous, Malic Acid, Citric Acid, Natural Flavors, Potassium Sorbate (preservative), Caffeine Anhydrous, Sucralose, Acesulfame Potassium, Niacinamide, N-acetyl-l-tyrosine, Cyanocobalamin (vitamin B12)","Store in a cool, dry place. Do not freeze.",Caution: Do not consume this product if you are pregnant or nursing. Not intended for children. Recommended for adults.,,,,,,
Monster Energy Java Monster Café Latte,$3.69,$4.19, https://www.instacart.com/image-server/272x272/www.instacart.com/assets/domains/product-image/file/large_42a16ba6-7b29-4431-8e08-c6469dd18469.jpeg 4x,"COFFEE DONE THE MONSTER WAY: Gingerbread, cinnamon dolce, peppermint white mocha...your mobile app would even laugh at you for ordering that! It’s time to get out of the line and step up to what’s next. Coffee done the Monster way, wide open, with a take no prisoners attitude and the experience and know-how to back it up. KILLER FLAVOR: For those of us who love their coffee the classic way comes Java Monster Café Latte. Coffee forward with the right amount of cream and sugar, supercharged with the Monster Energy blend and 200mg of caffeine per can. STOCK UP WITH A 12 PACK: Get your coffee fix in a convenient pack of 12.","Brewed Coffee (filtered Water, Coffee), Sugar, Skim Milk, Cream, Natural Flavors, Glucose, Taurine, Sodium Citrate, Panax Ginseng Flavor, Ascorbic Acid (vit. C), Tricalcium Phosphate, Carrageenan, Caffeine, Niacinamide (vit. B3), D-glucuronolactone, Guarana Extract, Inositol, L-carnitine L-tartrate, Sucralose, Color Added, Pyridoxine Hydrochloride (vit. B6), Riboflavin (vit. B2), Maltodextrin",Shake gently.,Contains milk,,,,,,
"GHOST Energy Drink, Zero Sugar, Sour Green Apple, Warheads",,$4.09,,"Legendary energy. Epic focus. No artificial colors. Transparent label. Legends recycle. Ghost Sour Green Apple Energy Drink, 16 fl. oz. 1 Can.,• Enjoy Responsibly,• Vegan,• Gluten Free,• Soy Free,• Sugar Free/No Sugar","Carbonated Water, Malic Acid, Natural And Artificial Flavor, Citric Acid, Carnipure, L-carnitine L-tartrate, Taurine, Tartaric Acid, Sucralose, Natural Caffeine (from Coffee Bean), Sodium Benzoate (preservative), Potassium Sorbate (preservative), Alpha-gpc (alpha-glyceryl Phosphoryl Choline 50%), Ascorbic Acid, Neurofactor Coffee (coffee Arabica) Fruit Extract, Astragin (10:1 Astragalus Membranaceus And 50:1 Panax Notoginseng) Root Extracts, Niacinamide, Pyridoxal-5-phosphate, Methylcobalamin",{},"Caution: This product is only intended for healthy adults, 18 years of age or older. Do not consume if you are sensitive to caffeine, or in combination with caffeine or stimulants from other sources. Too much caffeine may cause nervousness, irritability, sleeplessness, and occasionally, rapid heart rate. Not for use by women who are pregnant, nursing, or trying to become pregnant. Consult a licensed, qualified healthcare professional before consuming this product. Do not use if you are taking any prescription drug and/or have any medical condition.","Gluten Free,Soy Free",,,,,
"C4 Energy Energy Drink, Strawberry Guava",,$3.19," https://www.instacart.com/image-server/272x272/www.instacart.com/assets/domains/product-image/file/large_7343df69-3878-4f1c-ac18-fb4b5ba1544f.jpg 4x, https://www.instacart.com/image-server/272x272/www.instacart.com/assets/domains/product-image/file/large_79d30a09-fe9a-49da-95e1-6cdbf54351e9.jpg 4x, https://www.instacart.com/image-server/272x272/www.instacart.com/assets/domains/product-image/file/large_2f8534ff-7e30-48f9-9e37-f4686ef347b7.png 4x, https://www.instacart.com/image-server/272x272/www.instacart.com/assets/domains/product-image/file/large_b93649c9-7e15-4e7f-9463-3d53f8ad4971.jpg 4x","Combining unparalleled focus ingredients with a naturally derived source of caffeine, C4 Smart Energy® helps power your brain so greatness can follow. Proudly made with zero sugar, zero artificial colors in eight delicious flavors.","Carbonated Water, Citric Acid, Potassium Citrate, Natural Flavors, Cognizin® Citicoline, Natural Caffeine (from Green Coffee Bean Extract), Potassium Benzoate (preservative), Sucralose, Acesulfame Potassium, Niacinamide, N-acetyl-l-tyrosine, Cyanocobalamin (vitamin B12)","Store in a cool, dry place. Do not freeze.",Caution: Do not consume this product if you are pregnant or nursing. Not intended for children. Recommended for adults only.,,,,,,
V8 +Energy Black Cherry Juice Energy Drink,,$7.49," https://www.instacart.com/image-server/272x272/www.instacart.com/assets/domains/product-image/file/large_d57ba8ea-8f32-46cb-8bd7-7eea1b19c49c.jpg 4x, https://www.instacart.com/image-server/272x272/www.instacart.com/assets/domains/product-image/file/large_a71d06e0-5461-4a17-9171-5a116eb7376d.jpg 4x, https://www.instacart.com/image-server/272x272/www.instacart.com/assets/domains/product-image/file/large_a5e00be5-50fe-4c35-b6b2-e4db99d3bb6c.jpg 4x, https://www.instacart.com/image-server/272x272/www.instacart.com/assets/domains/product-image/file/large_17725cc2-da2c-41ff-8bc7-c4dcac739f5c.jpg 4x","Experience a delicious plant-powered energy boost with V8 +Energy® Black Cherry Juice Energy Drink. Featuring the sweet flavor of black cherries, this concentrated vegetable and fruit juice blend is infused with natural energy from black and green tea. Each 8 fl oz can contains 1 combined serving of veggies and fruit along with 80 milligrams of caffeine – as much as leading energy drink brands. A healthy energy drink alternative, V8 +Energy® Black Cherry Juice contains 45 calories and 11 grams of carbs per can. It’s also an excellent source of B Vitamins. V8 +Energy® caffeinated juice drinks are non-GMO and gluten-free with no sugar added* and no artificial colors. Enjoy V8 +Energy® as a coffee substitute in the morning, in place of soda during the afternoon, or as a mocktail or cocktail mixer in the evening. It’s great anytime you need a plant based boost of natural caffeine. (*Not a low calorie food; see nutrition panel for sugar and calorie content)","Water, Vegetable Juice (water And Concentrated Juices Of Sweet Potatoes, Purple Carrots, Carrots), Fruit Juice (water And Concentrated Juices Of Apples, Cherries, Pomegranates), Malic Acid, Natural Flavoring, Caffeine From Black And Green Tea, Vitamin C (ascorbic Acid), Sucralose, Niacinamide (vitamin B3), Pyridoxine Hydrochloride (vitamin B6), Cyanocobalamin (vitamin B12)",Shake Well Before Opening.,"Caution: not recommended for children, pregnant or nursing women or people sensitive to caffeine.",Gluten Free,,,,,
"GHOST Energy Drink, Zero Sugar, Swedish Fish",,$4.09,,"Legendary energy. Epic focus. Legends recycle.,• Vegan,• Gluten Free,• Soy Free,• Sugar Free/No Sugar,• Low Calorie,• No Artificial Colors","Carbonated Water, Citric Acid, Natural and Artificial Flavor, Carnipure L-Carnitine L-Tartrate, Taurine, Sucralose, Natural Caffeine (from Coffee Bean), Sodium Benzoate (Preservative), Potassium Sorbate (Preservative), Tartaric Acid, Alpha-Gpc (Alpha-Glyceryl Phosphoryl Choline 50%), Acesulfame Potassium, Ascorbic Acid, Neurofactorth Coffee (Coffea Arabica) Fruit Extract, Astragin (10:1 Astragalus Membranaceus and 50:1 Panax Notoginseng) Root Extracts, Niacinamide, Pyridoxal-5-Phosphate, Methylcobalamin.",{},,"Gluten Free,Soy Free",,,,,
"Alani Nu Juicy Peach, Mini Energy",,$7.99," https://www.instacart.com/image-server/272x272/www.instacart.com/assets/domains/product-image/file/large_0be07cb2-6376-4c44-853b-8a57f7719382.png 4x, https://www.instacart.com/image-server/272x272/www.instacart.com/assets/domains/product-image/file/large_c183169a-8eb5-409a-88af-c7cd1d6cf023.png 4x",,"Carbonated Water, Citric Acid, Natural Flavor, Taurine, Erythritol, Sodium Citrate, L-theanine, Caffeine, Sucralose, Panax Ginseng Root Extract, Sodium Benzoate (preservative), Potassium Sorbate (preservative), L-carnitine Tartrate, Acesulfame Potassium, Niacinamide (vitamin B-3), Inositol, Glucuronolactone, Salt, D-calcium Pantothenate (vitamin B-5), Guarana Seed Extract, Pyridoxine Hydrochloride (vitamin B-6), Biotin, Cyanocobalamin (vitamin B-12).",Peel.,"Not recommended for children, people sensitive to caffeine, pregnant women or women who are nursing.",,,,,,
Ghost Strawbango Margarita,$2.89,$3.89, https://www.instacart.com/image-server/272x272/www.instacart.com/assets/domains/product-image/file/large_b7074990-2218-4a8e-ae2e-bebd10850b93.jpeg 4x,"Legendary energy. Epic focus. No artificial colors. Transparent label. Legends recycle. Ghost Strawbango Margarita, Energy Drink, 16 fl. oz. 1 Aluminum Can.,• Enjoy Responsibly,• Vegan,• Gluten Free,• Soy Free,• Sugar Free/No Sugar,• Ghost Strawbango Margarita, Energy Drink, 16 fl. oz. 1 Aluminum Can","Carbonated Water, Citric Acid, Natural And Artificial Flavor, L Carnitine L-tartrate, Taurine, Caffeine, Sucralose, Sodium Benzoate (preservative, Potassium Sorbate (preservative), Alpha Glyceryl Phosphorylcholine, Acesulfame Potassium, Ascorbic Acid, Coffee (coff*a Arabica Fruit Extract, Niacinamide, Astragalus Membranaceus Root Extract, Panax Notoginseng Root Extract, Pyridoxal-5-phosphate, Methylce 3alamin.",{},"Only intended for persons 18 years or older. Caution: This product is only intended for healthy adults, 18 years of age or older. Do not consume if you are sensitive to caffeine, or in combination with caffeine or stimulants from other sources. Too much caffeine may cause nervousness, irritability, sleeplessness, and occasionally, rapid heart rate. Not for use by women who are pregnant, nursing, or trying to become pregnant. Consult a licensed, qualified healthcare professional before consuming this product. Do not use if you are taking any prescription drug and/or have any medical condition.",Gluten Free,,,,,
"Rockstar Recovery, Lemonade",$3.29,$4.09, https://www.instacart.com/image-server/272x272/www.instacart.com/assets/domains/product-image/file/large_39eb2c08-e3b2-449a-be19-99a7dca3404f.jpeg 4x,"Electrolytes for taste. B-vitamins. Please recycle.,• Hydration and energy Boost,• 160mg of caffeine,• Non-carbonated,• Please recycle","Water, Glucose Syrup, Lemon Juice Concentrate, Citric Acid, Taurine, Sodium Citrate, Natural Flavor, Sodium Hexametaphosphate (to Protect Flavor), Sodium Benzoate (preserves Freshness), Caffeine, Potassium Sorbate (preserves Freshness), Monopotassium Phosphate, Calcium Lactate Pentahydrate, Acesulfame Potassium, Magnesium Lactate, Sucralose, Milk Thistle Extract, Gum Arabic, Niacinamide (vitamin",,"Not recommended for children, pregnant woman or people sensitive to caffeine.",,,,,,
Red Bull Winter Edition Sugar Free Iced Vanilla Berry Energy Drink,,," https://www.instacart.com/image-server/272x272/www.instacart.com/assets/domains/product-image/file/large_174c6f73-e248-45b5-9dc9-d809beb3e172.jpg 4x, https://www.instacart.com/image-server/272x272/www.instacart.com/assets/domains/product-image/file/large_ce8d4f92-7385-4a9d-86a2-3cce8fbaca98.jpg 4x, https://www.instacart.com/image-server/272x272/www.instacart.com/assets/domains/product-image/file/large_12286332-8f92-4e60-a7bd-3cb3ebdc40de.jpg 4x, https://www.instacart.com/image-server/272x272/www.instacart.com/assets/domains/product-image/file/large_f432870e-b264-47ae-9ae0-70998c8f2491.jpg 4x","Red Bull Winter Edition Sugar Free Features Exceptional Taste Of Blueberry, Vanilla, And Icy-Fresh Notes Of Eucalyptus And No Sugar. This Lightly Carbonated Beverage Is Enjoyed Worldwide By Fitness Enthusiasts, Athletes, Gamers, Students And Travelers. A Refreshing Can Of Red Bull Makes An Excellent Partner For Busy, Active Lifestyles. Each 12 Fl Oz Can Contains 114Mg Of Caffeine Per Serving, 10 Calories And No Sugar. It Also Includes Taurine, An Amino Acid Naturally Occurring In The Human Body, And B-Group Vitamins B6, B12, Niacin (B3) And Pantothenic Acid (B5). Available In Single Can, 4-Packs, And 24-Packs. Comes In Aluminum Cans That Can Be Recycled Over And Over. Always Check Can Labels For The Most Updated Product Nutritional And Ingredient Information. Calcium And Sugars Values Declared On Labels May Vary Slightly Depending On Production Locations. Always Check Can Labels For Most Updated Product Nutritional And Ingredient Information. Calcium And Sugars Values Declared On Labels May Vary Slightly Depending On Production Locations.","Carbonated Water, Citric Acid, Taurine, Sodium Citrate, Natural And Artificial Flavors, Caffeine, Sucralose, Acesulfame K, Xanthan Gum, Niacinamide, Pyridoxine Hcl (vitamin B6), Calcium Pantothenate, Blue I, Vitamin B12",{},"Not recommended for children, pregnant or nursing women and persons sensitive to caffeine.",,,,,,
"C4 Energy Energy Drink, Cherry Berry Lime",,$3.19," https://www.instacart.com/image-server/272x272/www.instacart.com/assets/domains/product-image/file/large_64d149c5-33b4-4399-ba7c-972bf4f8d222.jpg 4x, https://www.instacart.com/image-server/272x272/www.instacart.com/assets/domains/product-image/file/large_105ad84d-c9fd-4955-85af-de4de619c3cd.jpg 4x, https://www.instacart.com/image-server/272x272/www.instacart.com/assets/domains/product-image/file/large_52ad24f3-87c3-4686-8234-eba0ef37985a.png 4x, https://www.instacart.com/image-server/272x272/www.instacart.com/assets/domains/product-image/file/large_b11202f8-78cf-4356-a985-d3bbab773785.jpg 4x","Combining unparalleled focus ingredients with a naturally derived source of caffeine, C4 Smart Energy® helps power your brain so greatness can follow. Proudly made with zero sugar, zero artificial colors in eight delicious flavors.","Carbonated Water, Malic Acid, Citric Acid, Cognizin Citicoline, Potassium Benzoate (preservative), Sucralose, Caffeine (from Innovatea Green Tea Leaf Extract), Acesulfame Potassium, Natural Flavors, N-acetyl-l-tyrosine, Niacinamide, Sodium Citrate, Cyanocobalamin (vitamin B12.)","Store in a cool, dry place. Do not freeze.",Contains 0% juice,,,,,,
V8 +Energy Strawberry Banana Juice Energy Drink,,$7.89," https://www.instacart.com/image-server/272x272/www.instacart.com/assets/domains/product-image/file/large_dda06521-bc8c-40a7-b4aa-47354d9c720b.jpg 4x, https://www.instacart.com/image-server/272x272/www.instacart.com/assets/domains/product-image/file/large_3ec0fcce-a12d-45ec-baca-fb265296bfc3.jpg 4x, https://www.instacart.com/image-server/272x272/www.instacart.com/assets/domains/product-image/file/large_36bd84c9-c196-484d-a7c6-1d1860e6cebf.jpg 4x, https://www.instacart.com/image-server/272x272/www.instacart.com/assets/domains/product-image/file/large_d7661430-3cc2-461d-9315-b6bc8c08fc19.jpg 4x","Experience a delicious plant-powered energy boost with V8 +Energy® Strawberry Banana Juice Energy Drink. Combining the flavors of sweet strawberry and creamy banana, this concentrated fruit and vegetable juice blend is infused with natural energy from black and green tea. Each 8 fl oz can contains 1 combined serving of veggies and fruit along with 80 milligrams of caffeine – as much as leading energy drink brands. A healthy energy drink alternative, V8 +Energy® banana strawberry juice contains 50 calories and 12 grams of carbs per can. It’s also an excellent source of B Vitamins. V8 +Energy® caffeinated juice drinks are non-GMO and gluten-free with no sugar added* and no colors from artificial sources. Enjoy V8 +Energy® as a coffee substitute in the morning, in place of soda during the afternoon, or as a mocktail or cocktail mixer in the evening. It’s great anytime you need a plant based boost of natural caffeine. (*Not a low calorie food; see nutrition panel for sugar and calorie content)","Water, Vegetable Juice (water And Concentrated Juices Of Sweet Potatoes, Carrots), Fruit Juice (water And Concentrated Juices Of Apples, Strawberries), Natural Flavoring, Citric Acid, Malic Acid, Caffeine (from Black And Green Tea), Lycopene (for Color), Vitamin C (ascorbic Acid), Banana Puree, Sucralose, Niacinamide (vitamin B3), Pyridoxine Hydrochloride (vitamin B6), Cyanocobalamin (vitamin B12).",Shake Well Before Opening.,"Caution: Not recommended for children, pregnant or nursing women or people sensitive to caffeine.",Gluten Free,,,,,
REIGN Peach Nectarine,,$2.78," https://www.instacart.com/image-server/272x272/www.instacart.com/assets/domains/product-image/file/large_c628d897-ee63-4186-81c5-b344a193c328.jpeg 4x, https://www.instacart.com/image-server/272x272/www.instacart.com/assets/domains/product-image/file/large_c5035717-47a2-4f45-86f5-99953a45b168.jpeg 4x, https://www.instacart.com/image-server/272x272/www.instacart.com/assets/domains/product-image/file/large_5b0d1eaf-1e6b-44d2-abe4-f139fab070c3.jpeg 4x, https://www.instacart.com/image-server/272x272/www.instacart.com/assets/domains/product-image/file/large_efa06ead-f676-4d54-afe7-737f3be55d5c.jpeg 4x","Introducing REIGN Storm, the perfect storm of flavor and functionality that enhances life’s experience. Available in four amazing flavors, each 12oz slim can contains 200mg of plant-based caffeine, Biotin which aids in healthy skin, hair & nails, loaded with B vitamins, and an immunity blend of Zinc, Vitamin A + Vitamin C – all with ZERO sugar. Get ready to take the world by STORM!","Carbonated Water, Citric Acid (ph Control), Sodium Citrate, Natural Flavors, Caffeine, Panax Ginseng Extract, Acesulfame Potassium, Sucralose, Ascorbic Acid (vit. C), Zinc Gluconate, Salt, Niacinamide (vit. B3), D-calcium Pantothenate (vit. B5), Pyridoxine Hydrochloride (vit. B6), Green Tea Extract (45% Egcg), Guarana Extract, Vitamin A Palmitate, Chromium Picolinate, Beta-carotene (color), Biotin (vit. B7), Guayusa Extract, Cyanocobalamin (vit. B12)",{},"Consume Responsibly: Not recommended for children, people sensitive to caffeine, pregnant women or women who are nursing.",,,,,,
"Red Bull Variety Pack, Red Edition, Amber Edition and Yellow Edition Energy Drinks",$28.79,$34.49, https://www.instacart.com/image-server/272x272/www.instacart.com/assets/domains/product-image/file/large_bde4c13b-f9cb-43c1-a7e0-0dd23444192a.jpeg 4x,The Aluminum Can Is One Of Very Few Food Packages That Can Be Almost Completely Recycled – It Can Be Continuously Melted Down And Reused To Make New Cans Without A Loss In Quality Always Check Can Labels For Most Updated Product Nutritional And Ingredient Information. Calcium And Sugars Values Declared On Labels May Vary Slightly Depending On Production Locations.,"Energy Drink - Carbonated Water, Sugar, Glucose, Citric Acid, Taurine, Natural And Artificial Flavors, Sodium Bicarbonate (baking Soda), Magnesium Carbonate, Colors, Caffeine, Niacinamide, Pyridoxine Hcl (vitamin B6), Calcium Pantothenate, Vitamin B12,watermelon - Carbonated Water, Sugar, Glucose, Citric Acid, Taurine, Sodium Citrate, Caffeine, Colors, Niacinamide, Natural And Artificial Flavors, Pyridoxine Hci (vitamin B6), Calcium Pantothenate, Vitamin B12,strawberry Apricot - Carbonated Water, Sugar, Glucose, Citric Acid, Taurine, Sodium Citrate, Natural And Artificial Flavors, Caffeine, Colors, Niacinamide, Pyridoxine Hci (vitamin B6), Calcium Pantothenate, Vitamin B12,tropical - Carbonated Water, Sugar, Glucose, Citric Acid, Taurine, Sodium Citrate, Natural And Artificial Flavors, Caffeine, Colors, Niacinamide, Glycerol Ester Of Wood Rosin, Sucrose Acetate Isobutyrate, Pyridoxine Hcl (vitamin B6), Calcium Pantothenate, Vitamin B12",{},"Not recommended for children, pregnant or nursing women and persons sensitive to caffeine.","Gluten Free,Milk Free",,,,,
"C4 Energy Energy Drink, Peach Mango",,$3.19," https://www.instacart.com/image-server/272x272/www.instacart.com/assets/domains/product-image/file/large_a64b4313-9de9-4efd-ac8c-5be988902ff6.jpg 4x, https://www.instacart.com/image-server/272x272/www.instacart.com/assets/domains/product-image/file/large_45abaa18-c18d-4215-aef4-cf21a3735d1a.png 4x, https://www.instacart.com/image-server/272x272/www.instacart.com/assets/domains/product-image/file/large_0c443f36-a591-40a1-8a1e-adf73a0b2aac.png 4x, https://www.instacart.com/image-server/272x272/www.instacart.com/assets/domains/product-image/file/large_110f3e95-d670-4923-b276-e89999c24123.jpg 4x","Combining unparalleled focus ingredients with a naturally derived source of caffeine, C4 Smart Energy® helps power your brain so greatness can follow. Proudly made with zero sugar, zero artificial colors in eight delicious flavors.","Carbonated Water, Malic Acid, Citric Acid, Cognizin® Cticoline, Potassium Benzoate (preservative), Sucralose, Innovatea® Green Lea Leaf Extract, Natural Fhavors, Acesulfame Potassium, N-acetyl-l-tyrosine, Niacinamide, Sodium Citrate, Cyanocobalamin (vitamin B12).","Store in a cool, dry place. Do not freeze.",,,,,,,
"Alani Nu Energy Drink, Pink Slush",,$3.39, https://www.instacart.com/image-server/272x272/www.instacart.com/assets/domains/product-image/file/large_d2531dad-710b-49fc-8ec8-50d8de6270a2.png 4x,,"Carbonated Water, Citric Acid, Taurine, Erythritol, Sodium Citrate, Natural Flavor, L-theanine, Caffeine, Sucralose, Acesulfame Potassium, Panax Ginseng Root Extract, Potassium Sorbate (preservative), Sodium Benzoate (preservative), L-carnitine L-tartrate, Niacinamide (vitamin B₃), Inositol, Glucuronolactone, Salt, D-calcium Pantothenate (vitamin B₅), Guarana Seed Extract, Pyridoxine Hydrochloride (vitamin B₆), Biotin, Cyanocobalamin (vitamin B₁₂)",{},"Not recommended for children, people sensitive to caffeine, pregnant women or women who are nursing.",Gluten Free,,,,,
