Name,Discounted Price,Original Price,Images,Details,Ingredients,Directions,Warnings,Highlights,Gluten Free,"Craving a refreshing energy boost without the guilt? Look no further than Alani Nu Mimosa Energy Drink. With zero sugar and only 10 calories, this gluten-free, fat-free, and vegan drink packs a punch with caffeine, taurine, and ginseng extract to jumpstart your day. The lively combination of citrus and champagne flavors will make you feel like you're sipping on a mimosa at Sunday brunch. Just remember: with warnings against consumption by children, pregnant women or those sensitive to caffeine, it's not for everyone. Instacart offers same-day delivery or pickup so you can enjoy this energizing drink in no time!",Soy Free,"Quench your thirst while fueling your body with REIGN Peach Nectarine. Each 12oz slim can is packed with 200mg of plant-based caffeine, B vitamins, Zinc, Vitamin A and Vitamin C—without any sugar. Plus, the immunity blend supports your overall health while Biotin helps promote healthy skin, hair and nails. With carbonated water and natural flavors, this gluten-free and kosher drink has only 10 calories per serving. Perfect for those who want to stay hydrated with a tasty beverage that won't compromise their health goals. Get REIGN Peach Nectarine delivered to your door through Instacart's same-day delivery or pickup.",Milk Free
Monster Energy Green,,$3.99," https://www.instacart.com/image-server/272x272/www.instacart.com/assets/domains/product-image/file/large_4a3cff05-5fca-4e90-be72-e81706aa1057.png 4x, https://www.instacart.com/image-server/272x272/www.instacart.com/assets/domains/product-image/file/large_c6a1283b-bac7-4879-b9e7-46dcaa40cf6f.png 4x","Tear into a can of the meanest energy drink on the planet, Monster Energy. It`s the ideal combo of the right ingredients in the right proportion to deliver the big bad buzz that only Monster can. Monster packs a powerful punch but has a smooth easy drinking flavor. Athletes, musicians, anarchists, road warriors, metal heads, geeks, hipsters, and bikers dig it- you will too... Unleash the Beast!","Carbonated Water, Sugar, Glucose, Citric Acid, Natural Flavors, Taurine, Sodium Citrate, Color Added, Panax Ginseng Extract, L-carnitine L-tartrate, Caffeine, Sorbic Acid (preservative), Benzoic Acid (preservative), Niacinamide (vit. B3), Sucralose, Salt, D-glucuronolactone, Inositol, Guarana Extract, Pyridoxine Hydrochloride (vit. B6), Riboflavin (vit. B2), Maltodextrin, Cyanocobalamin (vit. B12).",{},"Consume Responsibly: Not recommended for children, people sensitive to caffeine, pregnant women or women who are nursing.",,,,,,
Red Bull Energy Drink,$2.99,$3.69," https://www.instacart.com/image-server/272x272/www.instacart.com/assets/domains/product-image/file/large_36fa9d69-8ea3-4c68-baa8-6401d83c272c.jpg 4x, https://www.instacart.com/image-server/272x272/www.instacart.com/assets/domains/product-image/file/large_4bac13f3-1d14-4de6-baec-e17a19930dc2.jpg 4x, https://www.instacart.com/image-server/272x272/www.instacart.com/assets/domains/product-image/file/large_6f6061a0-053d-4676-9fa8-8b662cee3a6a.jpg 4x, https://www.instacart.com/image-server/272x272/www.instacart.com/assets/domains/product-image/file/large_0251e476-8c1e-4204-8712-0e1c814beae0.jpg 4x","Red Bull Energy Drink Gives You Wiiings Whenever You Need Them. Red Bull Is A Lightly Carbonated Energy Drink With An Impeccable Blend Of Caffeine, Taurine, B Vitamins, Real Sugar And Water. With 110 Calories Per 8.4 Fl Oz Can, Red Bull Is Great For Any Occasion. While Aiming For Great Heights During Your Workday, In Your Workouts Or When Gaming, Why Not Crack Open A Refreshing Can Of Red Bull? Drink Red Bull Straight From The Can Or Enjoy In A Glass Over Ice. This Can Of Red Bull Will Keep You Ready For Any Occasion, Whether It’S Hanging With Friends, Watching The Game Or Going On A Road Trip. Be Ready For The Big Moments With A Can Of Red Bull. Store This Can Of Red Bull At Room Temperature Or Toss It In The Fridge. Red Bull Gives You Wiiings. Always Check Can Labels For Most Updated Product Nutritional And Ingredient Information. Calcium And Sugars Values Declared On Labels May Vary Slightly Depending On Production Locations.","Carbonated Water, Sugar, Glucose, Citric Acid, Taurine, Natural And Artificial Flavors, Sodium Bicarbonate (baking Soda), Magnesium Carbonate, Colors, Caffeine, Niacinamide, Pyridoxine Hcl (vitamin B6), Calcium Pantothenate, Vitamin B12.",{},"Not recommended for children, pregnant or nursing women and persons sensitive to caffeine.",,,,,,
Red Bull Energy Drink,$3.59,$4.69," https://www.instacart.com/image-server/272x272/www.instacart.com/assets/domains/product-image/file/large_f66c207c-cfd7-4365-99e4-f0266ac57178.jpg 4x, https://www.instacart.com/image-server/272x272/www.instacart.com/assets/domains/product-image/file/large_6aba01b3-c295-466c-b059-e063df9b847b.jpg 4x, https://www.instacart.com/image-server/272x272/www.instacart.com/assets/domains/product-image/file/large_a8a27f2b-c9c0-4cdf-9dbe-6e22b3649237.jpg 4x, https://www.instacart.com/image-server/272x272/www.instacart.com/assets/domains/product-image/file/large_ae50ad4d-2e2d-417d-8ef6-e371e37b19f2.jpg 4x","Red Bull Energy Drink Gives You Wiiings Whenever You Need Them. Red Bull Is A Lightly Carbonated Energy Drink With An Impeccable Blend Of Caffeine, Taurine, B Vitamins, Real Sugar And Water. With 160 Calories Per 12 Fl Oz Can, Red Bull Is Great For Any Occasion. While Aiming For Great Heights During Your Workday, In Your Workouts Or When Gaming, Why Not Crack Open A Refreshing Can Of Red Bull? Drink Red Bull Straight From The Can Or Enjoy In A Glass Over Ice. This Can Of Red Bull Will Keep You Ready For Any Occasion, Whether It’S Hanging With Friends, Watching The Game Or Going On A Road Trip. Be Ready For The Big Moments With A Can Of Red Bull. Store This Can Of Red Bull At Room Temperature Or Toss It In The Fridge. Red Bull Gives You Wiiings. Always Check Can Labels For Most Updated Product Nutritional And Ingredient Information. Calcium And Sugars Values Declared On Labels May Vary Slightly Depending On Production Locations.","Carbonated Water, Sugar, Glucose, Citric Acid, Taurine, Natural And Artificial Flavors, Sodium Bicarbonate (baking Soda), Magnesium Carbonate, Colors, Caffeine, Niacinamide, Pyridoxine Hci (vitamin B6), Calcium Pantothenate, Vitamin B12.",{},"Not recommended for children, pregnant or nursing women and persons sensitive to caffeine.",,,,,,
Red Bull Sugar Free Energy Drink,$2.89,$3.59," https://www.instacart.com/image-server/272x272/www.instacart.com/assets/domains/product-image/file/large_8582b3cf-8dcf-4546-ba55-ea25e7b6311e.jpg 4x, https://www.instacart.com/image-server/272x272/www.instacart.com/assets/domains/product-image/file/large_70d69d58-62fd-4eda-8ac3-f3481d525680.jpg 4x, https://www.instacart.com/image-server/272x272/www.instacart.com/assets/domains/product-image/file/large_d9a43b0a-3af0-420b-8d81-12a2b5040a38.jpg 4x, https://www.instacart.com/image-server/272x272/www.instacart.com/assets/domains/product-image/file/large_cb7bcdc6-e93d-4bd9-88c0-36bc14162b73.jpg 4x","Red Bull Sugar Free Energy Drink Gives You Wiiings Whenever You Need Them. Red Bull Sugar Free Is A Lightly Carbonated Energy Drink Made With Caffeine, Taurine, B Vitamins And Water, That Brings You The Same Taste And Good Times Of Red Bull. Sweetened With Acesulfame-Potassium K And Sucralose, Red Bull Sugar Free Has 10 Calories Per 8.4 Fl Oz Can For A Low Calorie Energy Drink. While Aiming For Great Heights During Your Workday, In Your Workouts Or When Gaming, Why Not Crack Open A Refreshing Can Of Red Bull? Drink Sugar Free Red Bull Straight From The Can Or Pour Into A Glass Over Ice. This Can Of Red Bull Will Keep You Ready For Any Occasion, Whether It’S Hanging With Friends, Watching The Game Or Going On A Road Trip. Be Ready For The Big Moments With A Can Of Red Bull. Store This Can Of Red Bull At Room Temperature Or Toss It In The Fridge. Red Bull Gives You Wiiings. Always Check Can Labels For Most Updated Product Nutritional And Ingredient Information. Calcium And Sugars Values Declared On Labels May Vary Slightly Depending On Production Locations.","Carbonated Water, Citric Acid, Taurine, Natural And Artificial Flavors, Sodium Bicarbonate (baking Soda), Magnesium Carbonate, Colors, Caffeine, Aspartame, Acesulfame K, Xanthan Gum, Niacinamide, Pyridoxine Hcl (vitamin B6), Calcium Pantothenate, Vitamin B12.",{},Phenylketonurics: contains phenylalanine.,,,,,,
Monster Energy Zero Ultra,,$3.79," https://www.instacart.com/image-server/272x272/www.instacart.com/assets/domains/product-image/file/large_44d873e1-b4a5-480c-b758-b6a656143f27.png 4x, https://www.instacart.com/image-server/272x272/www.instacart.com/assets/domains/product-image/file/large_207cf64b-4fe6-48bc-a8ee-41d7c10e1336.png 4x","Some people are impossible to please. As soon as they get what they thought they wanted they always want more. Our team riders and Monster Girls are no different… they’ve been dropping some hints lately. They’ve been asking us for a new Monster drink. A little less sweet, lighter-tasting, but with a full load of our Monster energy blend. Sure, white is the new black. We went all out: Monster Energy Zero Ultra. Unleash the Ultra Beast!","Carbonated Water, Citric Acid, Erythritol, Taurine, Sodium Citrate, Natural & Artificial Flavors, Panax Ginseng Extract, L-carnitine L-tartrate, Sucralose, Caffeine, Sorbic Acid (preservative), Benzoic Acid (preservative), Niacinamide (vit. B3), Acesulfame Potassium,d-calcium Pantothenate (vit.b5),salt,guarana Extract, D-glucuronolactone, Inositol, Pyridoxine Hydrochloride (vit. B6), Cyanocobalamin (vit. B12).",{},"Consume Responsibly: Not recommended for children, people sensitive to caffeine, pregnant women or women who are nursing.",,,,,,
Red Bull Sugar Free Energy Drink,$3.49,$4.49," https://www.instacart.com/image-server/272x272/www.instacart.com/assets/domains/product-image/file/large_04261e76-d30a-4f3b-95a3-4f0b09e4abe0.jpg 4x, https://www.instacart.com/image-server/272x272/www.instacart.com/assets/domains/product-image/file/large_54f7ad23-856a-491c-bc7e-2584e8a4cba7.jpg 4x, https://www.instacart.com/image-server/272x272/www.instacart.com/assets/domains/product-image/file/large_4bd9a73e-276a-4855-8f29-a4aa3ac6849b.jpg 4x, https://www.instacart.com/image-server/272x272/www.instacart.com/assets/domains/product-image/file/large_0b051cf5-4a5c-4368-b839-afb96baea6df.jpg 4x","Red Bull Sugar Free Energy Drink Gives You Wiiings Whenever You Need Them. Red Bull Sugar Free Is A Lightly Carbonated Energy Drink Made With Caffeine, Taurine, B Vitamins And Water, That Brings You The Same Taste And Good Times Of Red Bull. Sweetened With Acesulfame-Potassium K And Sucralose, Red Bull Sugar Free Has 20 Calories Per 12 Fl Oz Can For A Low Calorie Energy Drink. While Aiming For Great Heights During Your Workday, In Your Workouts Or When Gaming, Why Not Crack Open A Refreshing Can Of Red Bull? Drink Sugar Free Red Bull Straight From The Can Or Pour Into A Glass Over Ice. This Can Of Red Bull Will Keep You Ready For Any Occasion, Whether It’S Hanging With Friends, Watching The Game Or Going On A Road Trip. Be Ready For The Big Moments With A Can Of Red Bull. Store This Can Of Red Bull At Room Temperature Or Toss It In The Fridge. Red Bull Gives You Wiiings. Always Check Can Labels For Most Updated Product Nutritional And Ingredient Information. Calcium And Sugars Values Declared On Labels May Vary Slightly Depending On Production Locations.","Carbonated Water, Citric Acid, Taurine, Natural And Artificial Flavors, Sodium Bicarbonate (baking Soda), Magnesium Carbonate, Colors, Caffeine, Aspartame, Acesulfame K, Xanthan Gum, Niacinamide, Pyridoxine Hcl (vitamin B6), Calcium Pantothenate, Vitamin B12. Phenylketonurics: Contains Phenylalanine.",{},Phenylketonurics: contains phenylalanine.,,,,,,
Celsius Kiwi Guava Sparkling Energy Drink,$1.67,$2.99, https://www.instacart.com/image-server/272x272/www.instacart.com/assets/domains/product-image/file/large_6aa7d0fb-43b7-432e-a622-dd742315792c.png 4x,"CELSIUS® is functional, Essential Energy, a better-for-you, premium alternative to traditional energy drinks. As a global, lifestyle fitness drink, CELSIUS® was created to help people LIVE FIT, exceed their goals and elevate their everyday lives. Made with proven, premium ingredients, 7 Essential Vitamins and zero sugar, no artificial colors, no aspartame, no high fructose corn syrup and non-GMO. CELSIUS® is vegan, gluten-free and Kosher. Our proprietary MetaPlus blend contains green tea extract with EGCG. It also includes guarana seed extract, ginger root for flavor and digestion, vitamin C to help support your immune system, vitamin B for energy production, and chromium to help control hunger, making it an ideal pre-workout drink. The tart and sweet flavors of kiwi combined with the unique juiciness of guava, packs a refreshingly tropical flavor into each sip of CELSIUS® Sparkling Kiwi Guava! Made with clinically proven ingredients, this carbonated flavor of CELSIUS® has the perfect balance of flavor and energy that serves as an awesome pick-me-up for active lifestyles. Make CELSIUS® your go to choice for Essential Energy!","Carbonated Filtered Water, Citric Acid, Taurine, Guarana Seed,Extract, Green Tea Extract, Caffeine, Vegetable Juice (color), Calcium,Carbonate, Ascorbic Acid, Glucuronolactone, Sucralose, Ginger Root,Extract, Calcium Pantothenate, Niacinamide, Natural Flavor, Pyridoxine,Hydrochloride, Riboflavin, Chromium Chelate, Biotin, Cyanocobalamin.",Ready to Drink,"Do not exceed more than (2) servings per day. Not Recommended for people who are caffeine sensitive, children under 18, and women pregnant or nursing.",Gluten Free,,,,,
Monster Energy Lo-Carb,,$3.79," https://www.instacart.com/image-server/272x272/www.instacart.com/assets/domains/product-image/file/large_681402e0-b2d8-4fa7-adf9-96926fc5d226.png 4x, https://www.instacart.com/image-server/272x272/www.instacart.com/assets/domains/product-image/file/large_907f5096-a642-4357-b6fc-6eb0820df43f.png 4x","Tear into a can of the meanest energy drink on the planet, Lo-Carb Monster Energy. Low calories, no compromise. That’s what Lo-Carb Monster Energy is all about. Get the big bad Monster buzz you know and love, but with a fraction of the calories and carbohydrates. Athletes, musicians, anarchists, co-ed’s, road warriors, metal heads, geeks, hipsters, and bikers dig it- you will too. Unleash the Beast!","Carbonated Water, Glucose, Citric Acid, Natural Flavors, Taurine, Sodium Citrate, Color Added, Panax Ginseng Extract, Caffeine, Sorbic Acid (preservative), Sucralose, Benzoic Acid (preservative), L-carnitine L-tartrate, Niacinamide (vit. B3), Acesulfame Potassium, Salt, D-glucuronolactone, Inositol, Guarana Extract, Pyridoxine Hydrochloride (vit. B6), Riboflavin (vit. B2), Maltodextrin, Cyanocobalamin (vit. B12).",{},"Consume Responsibly: Not recommended for children, people sensitive to caffeine, pregnant women or women who are nursing.",,,,,,
Monster Energy Juice Monster Mango Loco,,$3.99, https://www.instacart.com/image-server/272x272/www.instacart.com/assets/domains/product-image/file/large_871c562c-6526-408e-a53b-0255607a2d23.png 4x,"On the eve of October 31st each year friends and family gather to celebrate ""Dia de Los Muertos."" Marigolds, mysticism, and memories combined with food and drink entice the sounds of the departed to join the party. Mango Loco is a heavenly blend of exotic juices certain to attract even the most stubborn spirit. Crazy good taste with just enough of that Monster magic to keep the party going for days…Unleash The Beast!","Carbonated Water, Sugar, Guava Puree, White Grape Juice Concentrate, Mango Puree, Glucose, Apple Juice Concentrate, Citric Acid, Taurine, Pineapple Syrup, Pineapple Juice Concentrate, Potassium Citrate, Natural Flavors, Lemon Pulp, Apricot Puree, Orange Juice Concentrate, Peach Puree, Sodium Citrate, Potassium Sorbate (preservative), Caffeine, Niacinamide (vit. B3), L-carnitine L-tartrate, Sucralose, Xanthan Gum, Sodium Alginate, Passionfruit Juice Concentrate, Inositol, Gum Arabic, Sodium Benzoate (preservative), Pyridoxine Hydrochloride (vit. B6), Riboflavin (vit. B2), Ester Gum, Salt, Red #40, Cyanocobalamin (vit. B12).",{},"Consume Responsibly: Not recommended for children, people sensitive to caffeine, pregnant women or women who are nursing.",,,,,,
Monster Energy Ultra Sunrise,,$3.39," https://www.instacart.com/image-server/272x272/www.instacart.com/assets/domains/product-image/file/large_c672799b-126a-4d76-8d72-90bf5cd69066.png 4x, https://www.instacart.com/image-server/272x272/www.instacart.com/assets/domains/product-image/file/large_b88fad1a-025a-4b75-ab6a-49751accce85.png 4x","Get up, get out, go for it! Ultra Sunrise is dedicated to those who sacrifice sleep for passion: catching waves at dawn patrol, up on the bike when the morning dew gives the dirt more grip, or the first pass on that glassy lake kicking off an epic wake session. Ultra Sunrise will get you started but it`s great anytime: light, crisp, and refreshing with a flavor all its own. Packed with a full load of our Monster orange energy blend to keep the fire burning all day long. After all it's always sunrise somewhere. Unleash The Ultra Beast!","Carbonated Water, Natural Flavors, Erythritol, Lemon Pulp, Citric Acid, Taurine, Sodium Citrate, Panax Ginseng Extract, L-carnitine L-tartrate, Potassium Sorbate (preservative), Caffeine, Sucralose, Sodium Benzoate (preservative), Niacinamide (vit. B3), Acesulfame Potassium, D-calcium Pantothenate (vit. B5), Salt, Guarana Extract, D-glucuronolactone, Inositol, Pyridoxine Hydrochloride (vit. B6), Yellow #5, Yellow #6, Cyanocobalamin (vit. B12).",{},"Consume Responsibly: Not recommended for children, people sensitive to caffeine, pregnant women or women who are nursing.",,,,,,
Red Bull Red Edition Watermelon Energy Drink,$3.59,$4.69," https://www.instacart.com/image-server/272x272/www.instacart.com/assets/domains/product-image/file/large_9a73da34-e8e5-473f-82d2-70d3e72d1531.jpg 4x, https://www.instacart.com/image-server/272x272/www.instacart.com/assets/domains/product-image/file/large_dfdb67fb-6a9d-4562-bade-d1f98743872b.jpg 4x, https://www.instacart.com/image-server/272x272/www.instacart.com/assets/domains/product-image/file/large_caf8dedd-5d1f-419b-94db-bff2ab5db709.jpg 4x, https://www.instacart.com/image-server/272x272/www.instacart.com/assets/domains/product-image/file/large_c2a72739-7122-4ec7-b1ef-abc69132c733.jpg 4x","Red Bull Red Edition Watermelon Energy Drink Gives You Wiiings Whenever You Need Them. Red Bull Red Edition Is A Lightly Carbonated Energy Drink With A Blend Of Caffeine, Taurine, B Vitamins, Real Sugar And Water, Along With The Taste Of Watermelon.* With 160 Calories Per 12 Fl Oz Can, Red Bull Is Great For Any Occasion. While Aiming For Great Heights During Your Workday, In Your Workouts Or When Gaming, Why Not Crack Open A Refreshing Can Of Red Bull? Drink Red Bull Straight From The Can Or Enjoy In A Glass Over Ice. This Can Of Red Bull Will Keep You Ready For Any Occasion, Whether It’S Hanging With Friends, Watching The Game Or Going On A Road Trip. Be Ready For The Big Moments With A Can Of Red Bull. Store This Can Of Red Bull At Room Temperature Or Toss It In The Fridge. Red Bull Gives You Wiiings. Always Check Can Labels For Most Updated Product Nutritional And Ingredient Information. Calcium And Sugars Values Declared On Labels May Vary Slightly Depending On Production Locations.","Carbonated Water, Sugar, Glucose, Citric Acid, Taurine, Sodium Citrate, Caffeine, Colors, Niacinamide, Natural And Artificial Flavors, Pyridoxine Hcl (vitamin B6), Calcium Pantothenate, Vitamin B12.",,,,,,,,
Red Bull Strawberry Apricot Energy Drink,$3.59,$4.69," https://www.instacart.com/image-server/272x272/www.instacart.com/assets/domains/product-image/file/large_a0ad5a31-3304-414d-97d1-5fb639edf4bc.jpg 4x, https://www.instacart.com/image-server/272x272/www.instacart.com/assets/domains/product-image/file/large_46ebeb7e-921a-468a-90b7-27ec4dc98c4e.jpg 4x, https://www.instacart.com/image-server/272x272/www.instacart.com/assets/domains/product-image/file/large_8c4ce119-6a73-4568-b088-36f12db1cc21.jpg 4x, https://www.instacart.com/image-server/272x272/www.instacart.com/assets/domains/product-image/file/large_6441098f-68f3-4462-a470-38598ae30a71.jpg 4x","Red Bull Amber Edition Strawberry Apricot Energy Drink Gives You Wiiings Whenever You Need Them. Red Bull Amber Edition Is A Lightly Carbonated Energy Drink With Caffeine, Taurine, B Vitamins, Real Sugar And Water, Along With The Perfect Blend Of Strawberry And Apricot Flavors With A Touch Of Peach Taste.* With 160 Calories Per 12 Fl Oz Can, Red Bull Is Great For Any Occasion. While Aiming For Great Heights During Your Workday, In Your Workouts Or When Gaming, Why Not Crack Open A Refreshing Can Of Red Bull? Drink Red Bull Straight From The Can Or Enjoy In A Glass Over Ice. This Can Of Red Bull Will Keep You Ready For Any Occasion, Whether It’S Hanging With Friends, Watching The Game Or Going On A Road Trip. Be Ready For The Big Moments With A Can Of Red Bull. Store This Can Of Red Bull At Room Temperature Or Toss It In The Fridge. Red Bull Gives You Wiiings. Always Check Can Labels For Most Updated Product Nutritional And Ingredient Information. Calcium And Sugars Values Declared On Labels May Vary Slightly Depending On Production Locations.","Carbonated Water, Sugar, Glucose, Citric Acid, Taurine, Sodium Citrate, Natural And Artificial Flavors, Caffeine, Colors, Niacinamide, Pyridoxine Hcl (vitamin B6), Calcium Pantothenate, Vitamin B12",{},"Not recommended for children, pregnant or nursing women and persons sensitive to caffeine.",,,,,,
Monster Energy Java Monster Mean Bean,$3.69,$4.59, https://www.instacart.com/image-server/272x272/www.instacart.com/assets/domains/product-image/file/large_789fc0f0-5871-44e4-893e-cfd22e084c4d.png 4x,"No foam, extra hot, half-caf, no-whip, soy latte…Enough of the coffeehouse BS already! It’s time to get out of the line and step up to what’s next. Java Monster… Premium coffee and cream brewed up with killer flavor, supercharged with Monster energy blend. Coffee done the Monster way, wide open, with a take no prisoners attitude and the experience and know-how to back it up. Java Monster… premium coffee and cream brewed up with killer flavor, supercharged with Monster energy blend.","Brewed Coffee (filtered Water, Coffee), Condensed Skim Milk, Sugar, Heavy Cream, Glucose, Taurine, Sodium Citrate, Natural Flavors, Microcrystalline Cellulose, Panax Ginseng Extract, Ascorbic Acid (vit. C), Tricalcium Phosphate, Caffeine, Carrageenan, Sodium Alginate, Niacinamide (vit. B3), Sucralose, Color Added, D-glucuronolactone, Guarana Extract, Inositol, L-carnitine L-tartrate, Pyridoxine Hydrochloride (vit. B6), Riboflavin (vit. B2), Maltodextrin, Monster Energy Blend: Glucose, Taurine, Panax Ginseng Extract, Caffeine, Glucuronolactone, Guarana Extract, Inositol, L-carnitine, Maltodextrin",Shake gently,Contains milk; Allergen info: contains milk,,,,,,
Red Bull Yellow Edition Tropical Energy Drink,$3.59,$4.69," https://www.instacart.com/image-server/272x272/www.instacart.com/assets/domains/product-image/file/large_7d9adf73-3967-4789-8f42-9341cb05d3f1.jpg 4x, https://www.instacart.com/image-server/272x272/www.instacart.com/assets/domains/product-image/file/large_7bad36f1-b81b-41cb-a08c-e00f5e1288da.jpg 4x, https://www.instacart.com/image-server/272x272/www.instacart.com/assets/domains/product-image/file/large_15519c9e-2f46-4047-b543-550fdec2195e.jpg 4x, https://www.instacart.com/image-server/272x272/www.instacart.com/assets/domains/product-image/file/large_6f85d54a-dd14-474b-9ecc-7b2f38bdf8e1.jpg 4x","Red Bull Yellow Edition Tropical Energy Drink Gives You Wiiings Whenever You Need Them. Red Bull Yellow Edition Is A Lightly Carbonated Energy Drink With A Blend Of Caffeine, Taurine, B Vitamins, Real Sugar And Water, Along With A Perfect Blend Of Tropical Fruit Flavors.* With 160 Calories Per 12 Fl Oz Can, Red Bull Is Great For Any Occasion. While Aiming For Great Heights During Your Workday, In Your Workouts Or When Gaming, Why Not Crack Open A Refreshing Can Of Red Bull? Drink Red Bull Straight From The Can Or Enjoy In A Glass Over Ice. This Can Of Red Bull Will Keep You Ready For Any Occasion, Whether It’S Hanging With Friends, Watching The Game Or Going On A Road Trip. Be Ready For The Big Moments With A Can Of Red Bull. Store This Can Of Red Bull At Room Temperature Or Toss It In The Fridge. Red Bull Gives You Wiiings. Always Check Can Labels For Most Updated Product Nutritional And Ingredient Information. Calcium And Sugars Values Declared On Labels May Vary Slightly Depending On Production Locations.","Carbonated Water, Sugar, Glucose Citric Acid, Taurine, Sodium Citrate, Natural And Artificial Flavors, Caffeine, Colors. Niacinamide, Glycerol Ester Of Wood Rosin, Sucrose Acetate Isobutyrate, Pyridoxine Hcl (vitamin B6), Calcium Pantothenate, Vitamin B12.",{},"Not recommended for children, pregnant or nursing women and persons sensitive to caffeine.",,,,,,
