Name,Discounted Price,Original Price,Images,Details,Ingredients,Directions,Warnings,Highlights,Gluten Free
Bigelow Green Tea With Elderberry Plus Vitamin C,,$3.99, https://www.instacart.com/image-server/272x272/www.instacart.com/assets/domains/product-image/file/large_37d8d15e-367c-4428-b084-a6bc5a876117.png 4x,"Family tea blenders since 1945. Tea bags individually wrapped in foil pouches. Freshness stays in. Air and moisture stay out. Supports healthy immune system. Settling is not an option. Our time honored tradition of tea blending delivers a superior flavor that is smooth and delicate without any bitterness. Our family's recipe combines hand-picked tea leaves, harvested at their peak, with years of expertise and craftsmanship. Quality ingredients and unprecedented skill takes our green tea to a level beyond compare - one sip, and you will taste the difference. - The Bigelow Family. Cindi Bigelow. CEO & President. 3rd Generation, Visiting Tea Gardens. Every Cup counts. Protected in Foil: To maintain integrity of our carefully selected ingredients, we wrap each tea bag in a foil pouch to ensure the fullest flavor, freshness, and aroma. Our Family is Proud of Our Recipe: Each ingredient below has been carefully selected by the Bigelow family to deliver an uncompromised quality tea experience. This delicious blend of smooth green tea and elderberry provides 100% daily value to healthy antioxidant vitamin C. Healthy never tasted so good! 100% American family owned. Proud to be: Zero-Landfill Company. Green-E: Made with 100% certified renewable energy. Ethical tea partnership. Our folding cartons are recyclable. Our tea bags are compostable. Certified B Corporation: Simply Doing the Right Thing: This certificiaton recognizes our commitment to the highest standards of social and environmental impact.","Green Tea, Hibiscus, Rose Hips, Licorice Root, Ascorbic Acid (vitamin C), Elderberry, Natural Blackberry Flavor With Other Natural Flavors","Every Cup Counts: How to Make a Perfect Cup: Start with fresh cold water and bring to just under a boil. Pour over tea bag, steep for 2 minutes (or whatever time you like, remove bag. For iced tea by the glass, steep longer & pour over ice. Enjoy!",,Gluten Free,
Bigelow Green Tea With Ginger Probiotics,,$3.99, https://www.instacart.com/image-server/272x272/www.instacart.com/assets/domains/product-image/file/large_82395449-3c20-4ac0-8e02-2b94d0da8d20.png 4x,"America's classic. Family tea blenders since 1945. Powered by Ganeden BC 30 Probiotic. Plus probiotics. Supports healthy digestion. Healthy antioxidants. All natural. Protected in foil - because flavor matters. Our family selects ingredients so carefully that they must protect them in foil to allow you to experience their full: flavor; freshness; aroma. Bigelow Green Tea Blend: Green Tea with Ginger: Our Family is Proud of Our Recipe: Each ingredient below has been carefully selected by the Bigelow family to deliver an uncompromised tea experience. Our blend has been combined with Ganeden- BC30, an innovation that helps maintain a healthy balance in your digestive tract when used as part of a healthy diet. Proud to be: Zero-Landfill Company. Ethical Tea Partnership. It's easy being green Here at Bigelow Tea, our commitment to the environment is a top priority! Each of our facilities has a dedicated ""Green"" team focused on identifying ways to become more environmentally sensitive, from installing solar panels at our headquarters to enforcing company-wide composting & recycling programs. We were thrilled when our three manufacturing facilities achieved ""zero waste to landfill"" status. We are also extremely proud of the fact that, in 2003. we purchased the Charleston Tea Plantation in Wadmalaw Island. South Carolina. We were able to preserve 127 acres of beautiful tea bushes. The tea produced from these bushes is used exclusively for a special line of Charleston Tea Plantation teas. Today the farm is thriving and has over 60,000 visitors a year. At Bigelow we are 100% committed to protecting the environment now, and for generations to come! - The Bigelow Family.","Green Tea, Ginger, Cardamom, Anise, Allspice, Black Pepper, Bc30 (bacillus Coagulans Gbi-30, 6086)","Boil: 2 Steps to a Great Cup: Be sure to start with fresh cold water and bring to a rolling boil. Pour over tea bag, steep for 2 minutes (or whatever time you like), remove bag. For Iced Tea by the Glass: Steep a little longer. Pour over ice. Caff-O-Meter (Represents average caffeine content; individual products may vary) content per serving: Coffee: 100-120 mg; Black Tea: 30-60 mg; Green Tea: 25-50 mg; Decaf Tea: 1-8 mg; Herbal Tea: 0 mg.",,Gluten Free,
Gold Peak Unsweetened Black Tea Bottle,$3.49,$4.39, https://www.instacart.com/image-server/272x272/www.instacart.com/assets/domains/product-image/file/large_d64b2893-458d-4046-8923-cc2894b70d31.jpeg 4x,"Gold Peak is real brewed tea made from tea leaves picked for peak taste - enjoy Gold Peak Unsweetened Tea. Perfect for the whole family, these convenient bottles let you take real brewed tea wherever you go.,Whether it’s a picnic in the park, watching the game, or a backyard barbeque, get that delicious fresh brewed flavor with every sip. Gold Peak Unsweetened Tea is a sugar free, zero-calorie tea that uses pure filtered water for a difference you can taste.,Gold Peak has a variety of real brewed flavors that pair marvelously with any occasion, from unplanned get-togethers, to holiday traditions. And the fresh flavor makes any meal feel like home cooking, whether it’s lunch on-the-go or family takeout night, Gold Peak’s real taste will match those real moments.,There’s a variety of Gold Peak Teas to choose from, whether you like zero-sugar teas, sweetened real brewed teas or unsweetened real brewed tea options. We have a collection of classic flavors like Gold Peak Lemon Tea, Gold Peak Green Tea and Gold Peak Lemonade Tea and even offer refreshing flavors that are available nationally, like California Raspberry Tea and Georgia Peach Tea.,Real Brewed. Real Tea. Real Good.,• Gold Peak Real Brewed Unsweetened Black Tea,• High quality tea leaves make for a flavor so refreshing you’ll swear it was homemade,• Real Brewed Tea with no sugar for a zero calorie, unsweet tea,• 59 fl oz bottle of Gold Peak Unsweetened Tea,• Enjoy the taste of Gold Peak Real Brewed Tea in a variety of flavors","Brewed Tea (filtered Water, Black Tea Leaves), Phosphoric Acid",Refrigerate after opening.,,,
"AriZona Half & Half, Iced Tea, Lemonade, Zero",$4.59,$5.69, https://www.instacart.com/image-server/272x272/www.instacart.com/assets/domains/product-image/file/large_95eb962d-d00c-4049-ba47-30baa85438fb.jpeg 4x,"No calories. No preservatives. No artificial flavor. No artificial color. drinkarizona.com. The name Arnold Palmer has legendary roots as an original beverage combination of half iced tea and half lemonade. Arizona Beverages, makers of one of America's favorite ice teas have teamed with Arnold Palmer to bring you Arnold Palmer Zero Half and Half. - Arnold Palmer. Contains 5% juice. Antiox. Vitamin C antioxidant. Arizona an American company. For more information about Arizona call 1 800 832 3775. Visit us at www.drinkarizona.com. www.arnoldpalmer.com.","Premium Brewed Blend Of Black Teas Using Filtered Water, Lemon Juice From Concentrate, Pear Juice From Concentrate, Citric Acid, Natural Flavors, Ascorbic Acid (vitamin C), Malic Acid, Sucralose (splenda Brand), Gum Acacia.",Shake well. Refrigerate after opening.,,,
Twinings Irish Breakfast 100% Pure Black Tea,$6.99,$9.99, https://www.instacart.com/image-server/272x272/www.instacart.com/assets/domains/product-image/file/large_4d51fe6b-af83-42a2-91a5-93d365f0c57f.png 4x,"Experience the bold, rich taste of this hearty tea.,The Twinings of London® Story,In 1706, Thomas Twining began selling fine tea from an English storefront in The Strand, London. Today, Twinings continues to sell some of the world's best teas from the original store and in more than 100 countries throughout the world.,Tea Profile,Strength: 4/4.,Notes: Thick, malty, full-bodied.,Origins: Kenya, Indonesia, Assam and China.,Our Irish Breakfast tea pays tribute to the Irish, who are well-known for the love of strong teas. This blend combines teas carefully selected from four distinct regions to give it added body, flavour and strength.,The bold taste originates from teas grown in the tropical climate of Assam and the rich, amber colour from teas grown in the fertile terra rossa soil of Kenya. The hardiness from these regions is complemented by the softer and more subtle teas from other regions to yield a full-bodied tea with a smooth finish.,Master Blender's Notes,Notes: Thick, malty, full-bodied.,Colour: Bright, coppery-red.,Strength: 4/4.,Steep time: 4 minutes (recommended).",Black Tea.,"Want tips on how to make it? Hot Tea: Pour boiling water over tea bag, steep for 3-5 minutes, remove & enjoy! Iced Tea: Fill half a pitcher with boiling water, steep 4 tea bags 3 minutes, remove, add ice to desired strength. Or use 1 tea bag in a heat-resistant glass. Enjoy immediately!,Drink hot or cold.,Store in a cool, dry place.",,,
Pure Leaf Real Brewed Tea Blackberry,,$10.49," https://www.instacart.com/image-server/272x272/www.instacart.com/assets/domains/product-image/file/large_39aa7b92-e5c0-4480-bf15-75f0b716ac0e.png 4x, https://www.instacart.com/image-server/272x272/www.instacart.com/assets/domains/product-image/file/large_4e48abea-7f6a-433b-bccb-7f0fe54d17ab.png 4x, https://www.instacart.com/image-server/272x272/www.instacart.com/assets/domains/product-image/file/large_ef9f64ef-6865-4b16-8d08-a9285b4a74aa.png 4x, https://www.instacart.com/image-server/272x272/www.instacart.com/assets/domains/product-image/file/large_d6fededa-94e0-41e8-8e9b-51b457949135.png 4x",,"Brewed Black Tea*, Sugar, Citric Acid, Natural Flavor, Citrus Pectin.",Refrigerate after opening.,,,
TAZO TEA Organic Awake English Breakfast Tea,,$5.49, https://www.instacart.com/image-server/272x272/www.instacart.com/assets/domains/product-image/file/large_3042f149-542d-46f5-bf57-3e90b30ae6bf.png 4x,"Tazo® Regenerative Awake® English Breakfast Is Made From Ingredients Grown With Regenerative Agriculture Practices And Principles That Improve The Health Of The Soil And Ensure Better Care For The Farmers Who Grow Our Teas. Need Something With Enough Kick To Perk Up Those Early Mornings And Afternoon Slumps? This Bold, Full-Bodied Blend Of Organic Assam And Kenyan Black Teas Is Packed With Enough Caffeine To Have You Parting Ways With Your Usual Cup Of Joe. Brewing'S Easy: Just Bring 8 Fl Oz Fresh, Filtered Water To A Boil, Pour Over Your Tea Bag, Steep For 5 Minutes—And Voilà! You’Ve Got A Bold Cup Of Smooth, No-Nonsense Black Tea. Comes Packaged With 16 Individual Tea Bags For Your Sipping Pleasure, And It'S Kosher, Fair Trade And Non-Gmo Project Verified. At Tazo®, We’Re Not Just A Tea Company. We’Re A Group Of Tea-Obsessed People On A Mission To Challenge The Status Quo. This Doesn’T Stop At Exciting, New Tea Blends; It Continues With Making The World A Better Place. That Means Investing In Regenerative Growing Practices. Stepping Up For Environmental Justice. And Shining A Spotlight On Important Issues (Like The Climate Crisis) To Help Our Communities—And The Planet. So Choose Your Favorite Blend, Brew A Cup, And Let'S Stir Things Up.","A Blend Of Organic Black Teas*, *fair Trade Certified™ By Fair Trade Usa®",For Best Brewing: 212 degrees F - Bring fresh water to a boil. 8 fl oz - Pour water into cup. 5 min - Add teabag and let it brew. Wait patiently for perfection.,,,
Bigelow Lavender Chamomile Herbal Plus Probiotics Tea,,$3.99, https://www.instacart.com/image-server/272x272/www.instacart.com/assets/domains/product-image/file/large_1a7cb9e3-87d2-41aa-9e30-0ed5ef029c67.png 4x,"Family tea blenders since 1945. BC 30 probiotic. Supports healthy digestion. Freshness stays in. Air and moisture stay out. Settling is not an option. Chamomile is an essential ingredient in this blend which is why only an exceptional flower will do. We use the whole flower which gives our tea an exquisitely sweet and delicate flavor. Our family continues to partner with the same dedicated growers for over 40 years because their fields produce some of the finest quality chamomile. Trust us, you can truly taste the difference. - The Bigelow Family. The beauty of Chamomile flowers at peak season. Every cup counts. Protected in Foil: To maintain the integrity of our carefully selected ingredients, we wrap each tea bag in a foil pouch to ensure the fullest flavor, freshness, and aroma. Our Family is Proud of Our Recipe: Each ingredient below has been carefully selected by the Bigelow family to deliver an uncompromised quality tea experience. A relaxing blend of lavender, chamomile and just a hint of sweet honey flavor is combined with BC30 probiotic to create a unique innovation that supports healthy digestion. Healthy never tasted so good! Simply Doing the Right Thing: This certification recognizes our commitment to the highest standards of social and environmental impact. Proud to Be: Zero - Landfill Company. Green-e: Made with 100% certified renewable energy. 100% American family owned. Our folding cartons are recyclable. Our tea bags are compostable. Certified B Corporation.","Chamomile, Rose Hips, Lavender, Licorice Root, Natural Lavender And Honey Flavors With Other Natural Flavors, Bc30 (bacillus Coagulans Gbi-30, 6086)","2 Steps to a Great Cup: Be sure to start with fresh cold water and bring to a rolling boil. Pour over tea bag, steep for 4 minutes (or whatever time you like), remove bag. For iced tea by the glass: steep a little longer. Pour over ice.",,Gluten Free,
"Bigelow Black Tea, Decaffeinated, Constant Comment, Tea Bags",$4.09,$5.29, https://www.instacart.com/image-server/272x272/www.instacart.com/assets/domains/product-image/file/large_6ff5a761-da82-4420-8de5-e12f66ba260e.jpeg 4x,"Constant Comment is a unique blend that reinvented tea in America. This recipe has never changed and is still only blended by Eunice and David Bigelow.,• The Bigelow Family's first and most famous blend flavored with a secret recipe of orange rind and sweet spice without the caffeine,• Gluten–free, Non-GMO, Kosher Parve,• 20 Tea bags, individually wrapped in foil pouches for peak flavor, freshness and aroma,• Each Ingredient has been carefully selected by the Bigelow Family to deliver an uncompromised quality tea experience","Decaffeinated Black Tea, Rind Of Oranges, Sweet Spice, Natural Flavor","How to make a perfect cup. Start with fresh cold water and bring to a rolling boil. Pour over tea bag, steep for 4 minutes (or whatever time you like), remove bag. For iced tea by the glass, steep longer & pour over ice. Enjoy!",,Gluten Free,
Yogi Tea Organic Throat Comfort,$4.50,$5.99, https://www.instacart.com/image-server/272x272/www.instacart.com/assets/domains/product-image/file/large_b85e04f3-602a-44c1-9af4-e2d17d4e0d29.png 4x,Yogi Throat Comfort® tea is an herbal tea blend that combines Licorice Root with Slippery Elm Bark; both used in Western herbalism to help relieve minor throat irritation. Wild Cherry Bark helps soothe and add sweet flavor along with fragrant Orange Peel. Enjoy Yogi Throat Comfort® tea when you need a gentle and comforting blend to soothe your throat.*,"Organic Licorice Root, Organic Fennel Seed, Organic Wild Cherry Bark, Organic Cinnamon Bark, Organic Orange Peel, Organic Slippery Elm Bark, Organic Cardamom Pod, Organic Ginger Root, Organic Mullein Leaf, Organic Clove Bud, Organic Black Pepper.","Get the most out of every cup. Bring water to boiling and steep 7 minutes. For a stronger tea, use 2 tea bags. Drink 3-6 cups daily. To warm up or soothe the throat, such as for singing or public speaking, sip as needed throughout the day.*","Not recommended for use if you are pregnant or nursing. Consult your healthcare provider prior to use if you are taking any medication, if you have a medical condition or for daily use beyond 4 to 6 weeks.",,
Bigelow Lemon Ginger plus Probiotics Herbal Tea Bags,,$4.79, https://www.instacart.com/image-server/272x272/www.instacart.com/assets/domains/product-image/file/large_5958f9ba-5e5d-42ed-998d-80e4d6ba79a5.jpg 4x,"Tea is gluten-free beverage. Caffeine free. All natural. Family tea blenders since 1945. Powered by Ganeden BC 30 probiotic. Plus probiotics supports healthy digestion. Tea bags individually wrapped in foil pouches. Unlock the freshness. Here's the key. We use a special foil pouch to protect your tea from any air, moisture and surrounding aromas. So open and enjoy the unparalled. Flavour. Freshness. Aroma of Bigelow Tea everywhere you go! Son, don't tell your mother. Back in 1945, when the Bigelow Tea company first started, the family could only afford a single-colour label for their tea. To help spruce up the package, David Jr. and David Sr. would sit together each night, hand-painting colour on the label. One night, David Sr. turned to David Jr. and said Son, don't tell your mother, but I don't think this company is ever going anywhere. Almost 70 years later, David Jr. still smiles at the memory and is grateful that his father was mistaken. The Bigelow Family. Our Promise: We're fully committed to your satisfaction and we love to hear from you! When you do call, please share the code hear from you! When you do call, please share the code number on this box with the Consumer Service Crew. bigelowtea.com. Our boxes, tea bags, strings and tags are 100% biodegradable We love recycle. Blended and package in the U.S.A. Bigelow® ""Son, don't tell your mother..."",Back in 1945, when the Bigelow Tea company first started, the family could only afford a single-colour label for their tea. To help spruce up the package, David Jr. and David Sr. would sit together each night, hand-painting colour on the label. One night, David Sr. turned to David Jr. and said ""Son, don't tell your mother, but I don't think this company is ever going anywhere."" Almost 70 years later, David Jr. still smiles at the memory and is grateful that his father was mistaken.,The Bigelow Family","Lemongrass, Lemon Peel, Cinnamon, Natural Ginger And Lemon Flavours With Other Natural Flavours (soy Lecithin), Lemon Verbena, Rose Hips, Ginger, Licorice Mot, Ganedenbc30 (bacillus Coagulans Gbi-30, 6086), Citric Acid","2 Steps to a Great Cup: Be sure to start with fresh cold water and bring to rolling boil. Pour over tea bag, steep for 4 minutes (or whatever time you like), remove bag (but no squeezing please!). For Iced Tea by the Glass: Steep little longer. Pour over ice.,Boil: 2 Steps to a Great Cup,Be sure to start with fresh cold water and bring to a rolling boil.,• Pour over tea bag, steep for 4 minutes (or whatever time you like), remove bag (but no squeezing please!),• For Iced Tea by the Glass: Steep a little longer. Pour over ice.",,Gluten Free,
"Celestial Seasonings Tension Tamer, Caffeine-Free Herbal Tea",$4.39,$5.19," https://www.instacart.com/image-server/272x272/www.instacart.com/assets/domains/product-image/file/large_022d2696-9137-4ab8-bf9e-43bee53bddd4.png 4x, https://www.instacart.com/image-server/272x272/www.instacart.com/assets/domains/product-image/file/large_bade0f41-f8e2-47db-93af-30ab1a4e33b1.png 4x, https://www.instacart.com/image-server/272x272/www.instacart.com/assets/domains/product-image/file/large_a3cd0f0c-de9b-45ba-bc15-80cdf7c41c8f.png 4x","Blendmaster's notes: Tension tamer: This soothing blend begins with eleuthero, an Asian herb popular for centuries because of the sense of calm and wellbeing it imparts. We've added cooling peppermint, spicy ginger and tangy lemon flavor to create an uplifting and restorative blend that can bring harmony to any moment of your day. - Charlie Baden, Celestial Seasonings Blendmaster. Bleding herbs, art and inspiration since 1969. The story of celestial seasonings: Back in 1969, we started picking herbs from the fields and forests of the rocky mountains and at that moment, we created America's very first herbal tea. Still blended in boulder by our expert Blendmaster, our uniquely delicious teas are made with the finest ingredients, passion and inspiration. The greatest heroes that the world can know, to women their original must owe. -Mary Collier. Blended in Boulder .Co.","Eleuthero, Peppermint, Cinnamon, Ginger, Chamomile, Lemongrass, Licorice, Catnip, Tilia Flowers, Natural Lemon Flavor With Other Natural Flavors, Hops, Pyridoxine Hydrochloride (vitamin B6), Cyanocobalamin (vitamin B12)",Hot tea by the cup (Always pour boiled water into heat-resistant cup): Pour boiled water over one tea bag. Steep 4 to 6 minutes and remove tea bag. Sweeten if desired. Iced tea by the glass (Always pour boiled water into heat-resistant cup): Pour boiled water over two tea bags. Steep 4 to 6 minutes and remove tea bags. Pour into a tall glass filled with ice.,,Gluten Free,
Bolthouse Farms Vanilla Chai,,$11.29," https://www.instacart.com/image-server/272x272/www.instacart.com/assets/domains/product-image/file/large_a0e7c89f-8fff-4e4f-8726-2a0d3b99bd3b.png 4x, https://www.instacart.com/image-server/272x272/www.instacart.com/assets/domains/product-image/file/large_8865876c-af61-4401-a13a-a47809ec378d.png 4x, https://www.instacart.com/image-server/272x272/www.instacart.com/assets/domains/product-image/file/large_932bb729-b1bc-4aae-b889-d62e3f81bdf2.png 4x","Natural green tea, with a hint of vanilla and spice flavors mixed into a creamy drink. All perfectly balanced with 7 grams of protein per serving, it makes for a delicious start to the day or the perfect afternoon snack.","Soy Milk From Concentrate (water, Soy Milk Concentrate), Cane Sugar, Contains 2% Or Less: Soy Protein Concentrate, Natural Flavors, Acacia Gum, Sea Salt, Green Tea (water, Green Tea Extract).","Shake well.,Perishable. Keep refrigerated.",Contains: soy,,
Snapple Peach Tea,$2.49,$2.99, https://www.instacart.com/image-server/272x272/www.instacart.com/assets/domains/product-image/file/large_32040088-1316-44d1-95f9-394fa6ec4b42.jpeg 4x,"Naturally flavored with other natural flavors. All natural. Made from green & black tea. 160 calories per bottle. Life's a peach. Made from the best stuff on Earth! At Snapple, we believe life's a peach. We've been living this mantra since we were a small brand in New York in the 80's. Take a sip of our delicious peach tea, and go back to the times of big hair, neon leggings and breakdancing. Ok - not literally, but you can use your imagination. So go ahead, break out the boom box and enjoy the best stuff on Earth. Please recycle. Call us at 1-800-762-7753 or visit us at snapple.com. Gluten free.","Filtered Water, Sugar, Citric Acid, Tea, Natural Flavors.",Refrigerate after opening. Shake it! Then shake the bottle too. Settling is natural.,Safety button pops up when original seal is broken. Reject if button is up.,Gluten Free,
TAZO TEA Organic Chai Tea,,$5.49, https://www.instacart.com/image-server/272x272/www.instacart.com/assets/domains/product-image/file/large_281310e9-fab7-4e8e-979d-b2196e541bbb.png 4x,"Tazo® Regenerative Chai Is Made From Ingredients Grown With Regenerative Agriculture Practices And Principles That Improve The Health Of The Soil And Ensure Better Care For The Farmers Who Grow Our Teas. This Robust Blend Of Usda Organic Black Teas Combines Rich Spices Like Cinnamon, Ginger, And Cardamom To Bring You The Full-Bodied Cup Of Chai Of Your Dreams. Plus, It’S Got The Perfect Amount Of Caffeine: Not Too Much, Not Too Little—Just Enough To Give You A Boost, Sans The Jitters. Our Organic Chai Comes Packaged With 16 Individual Tea Bags For Your Sipping Pleasure, And It'S Kosher, Fair Trade And Non-Gmo Project Verified. By The Way, Brewing'S Also A Cinch: Just Bring Fresh, Filtered Water To A Boil, Carefully Pour Water Over Your Black Tea Bag, And Let It Steep For 5 Minutes (The Longest 5 Minutes, We Know). Then, You’Re Good To Take That First Sip! At Tazo®, We’Re A Group Of Tea-Obsessed People On A Mission To Challenge The Status Quo. This Doesn’T Stop At Exciting, New Tea Blends; It Continues With Making The World A Better Place. That Means Investing In Regenerative Growing Practices. Stepping Up For Environmental Justice. And Shining A Spotlight On Important Issues (Like The Climate Crisis) To Help Our Communities—And The Planet. So Choose Your Favorite Blend, Brew A Cup, And Let'S Stir Things Up.","Organic Black Teas*, Organic Ginger*, Organic Cinnamon*, Organic Black Pepper*, Organic Cardamom*, Organic Cloves*, Organic Star Anise*, *fair Trade Certified™ By Fair Trade Usa®",For Best Brewing: 212 degrees F - Bring fresh water to a boil. 8 fl oz - Pour water into cup. 5 min - Add teabag and let it brew. Wait patiently for perfection.,,,
