Name,Discounted Price,Original Price,Images,Highlights,Gluten Free,Details,Ingredients,Directions,Warnings,Egg Free,Soy Free,Peanut Free,Treenut Free,Shellfish Free,Wheat Free,Milk Free
Oatly Full Fat Oatmilk,,$5.79, https://www.instacart.com/image-server/272x272/www.instacart.com/assets/domains/product-image/file/large_734052f2-c3e3-499f-afbe-2ef4e5df5229.png 4x,Gluten Free,,"The original. Wow no cow! Here’s What We Believe: Most companies think having a strong opinion means scaring away customers who think differently. We think it's a good way to make some new friends. For the record, we believe we should eat stuff we can grow instead of growing stuff to feed animals and then eat them. Everybody - regardless of spiritual beliefs, birth country, race, gender, sexual orientation or color of their nail polish - is of equal worth. The reckless pursuit of profits without any consideration for the well-being of the planet and the humans that live here should be considered a crime. Companies have as much responsibility as politicians for building a society the rest of the world can admire. Bigfoot the legendary Sasquatch is real. Okay, that last one has nothing to do with Oatly and is just the personal belief of the guy writing this. Apologies, this package is not a place for personal reflection. To unlock the carton please look here. This carton of oatmilk has been upgraded to include the latest face-recognition software technology in order to upgrade user security when left unattended in an unsecure location, such as your refrigerator. To unlock, simply hold at eye level and focus on the dot. The carton inherently recognizes who the rightful owner is, and simultaneously grants access. This new feature also allows you to grant access to friends and family from a remote location through cutting-edge automated SMS/ MMS technology. Enjoy the future today! The boring (But very important) side. If this side bores you, please read no further. Flip the carton around and have a wonderful day. Otherwise, please do enjoy. Added sugars are created when we liquefy our oats. FSC: Mix - Board.","Oatmilk (water, Oats), Low Erucic Acid Rapeseed Oil, Contains 2% Or Less Of: Dipotassium Phosphate, Calcium Carbonate, Tricalcium Phosphate, Sea Salt, Dicalcium Phosphate, Dha Algal Oil, Riboflavin, Vitamin A, Vitamin D2, Vitamin B12","Shake me!,Keep refrigerated.,Please consume within 7 days after opening.",,,,,,,,
Coffee mate Peppermint Mocha Liquid Coffee Creamer,$4.09,$6.89, https://www.instacart.com/image-server/272x272/www.instacart.com/assets/domains/product-image/file/large_e3a317c4-d116-4a76-8a25-c86372a5eb72.jpeg 4x,Gluten Free,,"Coffee Mate Peppermint Mocha Flavored Liquid Coffee Creamer Is The Perfect Way To Create A Delicious Cup Of Coffee Perfection. Coffee Mate Peppermint Mocha Flavored Coffee Creamer Adds The Taste Of Minty Chocolate To Your Morning Cup With Cool Peppermint And Rich Mocha Flavors. This Non Dairy Creamer Is Gluten Free And Cholesterol Free. Coffee Mate Liquid Creamer Provides An Easy Way To Transform Your Hot Or Iced Coffee Into Flavorful Deliciousness, Whether It's Your Morning Cup Of Coffee Or Afternoon Pick-Me-Up. The Flavored Peppermint Mocha Taste Is Perfect For A Delicious Morning Ritual. Coffee Mate Coffee Creamer Comes In A Convenient Bottle With A Snap Lid To Allow For Easy Pouring And Storage. Store Coffee Mate Peppermint Mocha Flavored Creamer In The Refrigerator.,•,•,•,•,• Enhance your Mother's Day brunch with Coffee mate creamers - the perfect addition to elevate your coffee and delight mom's taste buds!,•,•","Water, Sugar, Soybean Oil, And Less Than 2% Of Micellar Casein (a Milk Derivative), Mono- And Diglycerides, Dipotassium Phosphate, Cellulose Gel, Natural And Artificial Flavor, Cellulose Gum, Carrageenan.","Shake before use.,Try in iced coffee.,Do not freeze. Storage Advice: Keep refrigerated.,Completely remove freshness seal under cap.,For best quality, use within 14 days of opening.",Contains: a milk derivative.,,,,,,,
Yoplait Original Low Fat Strawberry and Strawberry Banana Yogurt Cups,,$7.69," https://www.instacart.com/image-server/272x272/www.instacart.com/assets/domains/product-image/file/large_5a0e44f5-ee79-4dd3-831b-733b1e6cc473.png 4x, https://www.instacart.com/image-server/272x272/www.instacart.com/assets/domains/product-image/file/large_0bb24f13-a280-49f8-b5a8-890260823081.png 4x, https://www.instacart.com/image-server/272x272/www.instacart.com/assets/domains/product-image/file/large_f3aa433f-cf43-48bf-a5fe-4f91ddde9cd9.png 4x, https://www.instacart.com/image-server/272x272/www.instacart.com/assets/domains/product-image/file/large_e1591318-1159-4ab7-b48b-c3e546430fcf.png 4x","Gluten Free,Egg Free,Peanut Free,Shellfish Free,Soy Free,Treenut Free,Wheat Free",,"Savor Yoplait Original Strawberry and Strawberry Banana Low Fat Yogurt as a delicious addition to an easy breakfast or snack! Made with real fruit plus live and active yogurt cultures, there are no artificial flavors or colors from artificial sources, and no high fructose corn syrup. Each serving is a good source of vitamin D and calcium, an excellent source of vitamin A, and gluten free. Enjoy the yogurt plain, pair it with granola, or blend into a refreshing strawberry or strawberry banana yogurt smoothie. Make it a tasty alternative to Greek yogurt. Grab a convenient yogurt cup as a part of breakfast to go. Or stock up for quick snacks for the family. Also try our other varieties, such as low fat French vanilla yogurt and low fat mixed berry yogurt. Store Yoplait Yogurt in the refrigerator and keep cold until you're ready to grab a spoon and enjoy. Yoplait brings goodness to everyday moments, one serving of yum at a time.,• CREAMY AND DELICIOUS: Smooth and creamy strawberry and strawberry banana yogurt made with live and active cultures and real fruit; No artificial flavors or colors from artificial sources, and no high fructose corn syrup,• LOW FAT YOGURT: Gluten free, our low fat yogurt is a good source of vitamin D and calcium, and an excellent source of vitamin A; Enjoy the yogurt plain or topped with granola,• YOGURT CUP: Single serve low fat yogurt cup with 140 calories per serving; Explore other varieties such as low fat French vanilla yogurt and low fat mixed berry yogurt,• MORNING OR SNACK TIME: Enjoy yogurt as a quick breakfast food, afternoon snacks, or packed in a lunch box as a kids snack; Liven up snacking with the taste of our Yoplait Yogurt as an alternative to plain Greek yogurt or kefir,• CONTAINS: One 48 oz Variety Pack of Yoplait Original Strawberry and Strawberry Banana Low Fat Yogurt; 4 yogurt cups of each flavor; 8 yogurt cups total","Strawberry Ingredients: Pasteurized Grade A Reduced Fat Milk, Sugar, Strawberries, Modified Corn Starch, Kosher Gelatin, Natural Flavor, Pectin, Colored With Carmine, Yogurt Cultures (l. Bulgaricus, S. Thermophilus, L. Acidophilus), Vitamin A Acetate, Vitamin D3. Strawberry Banana Ingredients: Pasteurized Grade A Reduced Fat Milk, Sugar, Strawberries, Modified Corn Starch, Banana Puree, Kosher Gelatin, Natural Flavor, Pectin, Colored With Carmine, Yogurt Cultures (l. Bulgaricus, S. Thermophilus, L. Acidophilus), Vitamin A Acetate, Vitamin D3.",Keep refrigerated.,Contains Milk Ingredients.,,,,,,,
Almond Breeze Original Unsweetened Almondmilk,,$6.49, https://www.instacart.com/image-server/272x272/www.instacart.com/assets/domains/product-image/file/large_43b35f18-ef8e-4aeb-b517-fb2bb66a1de3.png 4x,Gluten Free,,"Almond Breeze non-dairy almondmilk is delicious in everything, from cereals and smoothies to cooking and baking. Browse our variety of refrigerated and shelf stable almondmilk, including sweetened and unsweetened, vanilla, chocolate, our coconut and banana almondmilk blends, as well as almondmilk creamers and almondmilk yogurts. The best almonds make the best almondmilk.,• Made with real California almonds,• Free from Dairy, Soy and Lactose,• Excellent source of vitamins D & E,• 50% More Calcium than Milk,• Non-GMO Project Verified","Almondmilk (filtered Water, Almonds), Calcium Carbonate, Sea Salt, Potassium Citrate, Sunflower Lecithin, Gellan Gum, Natural Flavors, Vitamin A Palmitate, Vitamin D2, D-alpha-tocopherol (natural Vitamin E).",Shake well.,Contains: almonds.,,,,,,,
Land O Lakes Salted Butter in Half Sticks,,$9.79," https://www.instacart.com/image-server/272x272/www.instacart.com/assets/domains/product-image/file/large_45bb0a4d-a990-4369-984e-1a7d0c3eb457.png 4x, https://www.instacart.com/image-server/272x272/www.instacart.com/assets/domains/product-image/file/large_222dcad8-8102-4c28-b2fc-e2fe1da7b4e6.png 4x, https://www.instacart.com/image-server/272x272/www.instacart.com/assets/domains/product-image/file/large_37346471-bb27-4ae1-9efb-2f91795427c1.png 4x, https://www.instacart.com/image-server/272x272/www.instacart.com/assets/domains/product-image/file/large_62b5e872-c831-4277-95a6-cb2bdd567c87.png 4x",Gluten Free,,"Whether melted, browned, creamed or clarified, Land O Lakes Salted Butter sticks improve the taste of everything they touch. Land O Lakes Salted Butter is made with two ingredients - sweet cream and salt. Use these eight salted butter half sticks in your favorite dinner recipes or to create delicious baked goods like muffins, pies, cookies and cakes. It's also ideal for making grilled cheese sandwiches with a golden, crispy edge. No matter how you use it, this stick butter will take your cooking to a whole new level. Land O Lakes Butter comes in pre-measured, ready-to-use butter sticks that are individually wrapped in our FlavorProtect wrapper to protect the flavor you love. You can enjoy these salted butter sticks knowing you are supporting farmer-owners in communities across the country. Contains 8 half sticks, 1 lb pack in total.,• SALTED BUTTER: Melted, browned, creamed or clarified, Land O Lakes Salted Butter is the all-purpose butter that improves the taste of everything it touches; It’s the original that never lets you, or your taste buds, down,• VERSATILE BAKING & COOKING: Salted butter adds a layer of flavor when melted over fresh steamed veggies, gives pie crusts the perfect flakiness, and complements every grilled cheese with a golden, crispy edge,• QUALITY INGREDIENTS: Land O Lakes Salted Butter is made with two ingredients: sweet cream and salt; No matter how you use it, this stick butter will take your cooking to a whole new level,• PRE-MEASURED STICKS: Comes in pre-measured, ready-to-use butter sticks that are individually wrapped in a FlavorProtect wrapper to protect the dairy flavor you love,• CONTAINS: 4 sticks, 1 lb pack","Sweet Cream, Salt",Keep refrigerated. Pull to open. May be kept up to 4 months if frozen. BEST if used by date on package.,Contains: milk,,,,,,,
Yoplait Original Low Fat Mixed Berry Yogurt Cup,,$1.19," https://www.instacart.com/image-server/272x272/www.instacart.com/assets/domains/product-image/file/large_68762831-3600-4424-a3bf-f88478f1ffe7.png 4x, https://www.instacart.com/image-server/272x272/www.instacart.com/assets/domains/product-image/file/large_0eef5693-6d2a-4d05-8b02-dd32501221be.png 4x, https://www.instacart.com/image-server/272x272/www.instacart.com/assets/domains/product-image/file/large_83b36b93-6f7d-48b3-a23a-48149a8c7cab.png 4x, https://www.instacart.com/image-server/272x272/www.instacart.com/assets/domains/product-image/file/large_0528d561-89c1-4541-b4d6-b1fe660d5a79.png 4x",Gluten Free,,"Savor Yoplait Original Mixed Berry Low Fat Yogurt as a delicious addition to an easy breakfast or snack! Made with real fruit, plus live and active yogurt cultures, there are no artificial flavors or colors from artificial sources, and no high fructose corn syrup. Each serving contains vitamins A and D, is a good source of calcium, and is gluten free. Enjoy the yogurt plain, pair it with granola, or blend into a refreshing mixed berry yogurt smoothie. Make it a tasty alternative to Greek yogurt. Grab a convenient yogurt cup as a part of breakfast to go. Or stock up for quick snacks for the family. Also try our other Yoplait Yogurt varieties, such as low fat French vanilla yogurt and low fat strawberry yogurt. Yoplait brings goodness to everyday moments, one serving of yum at a time.,• CREAMY AND DELICIOUS: Smooth and creamy mixed berry yogurt made with live and active cultures and real fruit; No artificial flavors or colors from artificial sources, and no high fructose corn syrup,• LOW FAT YOGURT: Gluten free, our low fat yogurt contains vitamins A and D and is a good source of calcium; Enjoy the yogurt plain or topped with granola,• YOGURT CUP: Single serve low fat yogurt cup with 140 calories per serving; Explore other varieties such as low fat French vanilla yogurt and low fat strawberry yogurt,• MORNING OR SNACK TIME: Enjoy yogurt as a quick breakfast food, afternoon snack, or packed in a lunch box as a kids snack; Liven up snacking with the taste of our Yoplait Yogurt as an alternative to plain Greek yogurt or kefir,• CONTAINS: One 6 oz yogurt cup of Yoplait Original Mixed Berry Low Fat Yogurt","Cultured Grade A Reduced Fat Milk, Sugar, Blueberries, Water, Modified Corn Starch, Raspberries, Strawberries, Contains 1% Or Less Of: Blackberries, Corn Starch, Tricalcium Phosphate, Pectin, Natural Flavor, Vitamin A Acetate, Vitamin D₃",Keep refrigerated.,Contains Milk Ingredients.,,,,,,,
Silk Caramel Almond Creamer,,$5.49, https://www.instacart.com/image-server/272x272/www.instacart.com/assets/domains/product-image/file/large_332ece24-6d08-44a2-b507-1e0185865f77.png 4x,Gluten Free,,"Make your days more flavorful with Silk Caramel Almond Creamer. Not your average coffee creamer, this smooth and lusciously creamy dairy free almond caramel creamer is a great way to start your day. Silk creamer is free of dairy, lactose, carrageenan and gluten, making it a great choice for any lifestyle. Plus, there are no artificial colors or flavors in this lactose free creamer. Make a “me” moment by adding a splash of this caramel flavored vegan creamer to smoothies, shakes, your morning coffee or anything that could use a smooth and creamy almond boost. At Silk, we believe in the power of plants to do a world of good, so people can enjoy good, feel good and do good. Silk gluten free, non dairy creamer is the #1 brand of plant based creamers.* It’s also Non-GMO Project Verified. Silk is passionate about doing right by the planet, which is why we're helping almond farmers implement regenerative agriculture practices. Level up your coffee experience with Silk Almond Creamer. *Leading brand based on national sales data.","Almondmilk (filtered Water, Almonds), Cane Sugar, Sunflower Oil, Pea Protein, Potassium Citrate, Baking Soda, Natural Flavor, Sunflower Lecithin, Sea Salt, Gellan Gum","Shake well.,Perishable. Keep refrigerated.,Silk will stay fresh up to 14 days in refrigerator after opening.",Contains almond.,,,,,,,
Coffee mate Original Flavored Coffee Creamer,$10.39,$11.19, https://www.instacart.com/image-server/272x272/www.instacart.com/assets/domains/product-image/file/large_5542de67-0694-4564-8e2b-194d36e8c3a8.jpeg 4x,Gluten Free,,"• FOR THE LOVE OF COFFEE: Ditch your boring coffee routine and upgrade your brew game with our Coffee mate Original Flavored Coffee Creamer. We’ve been working on our recipes since 1961, so we know what we’re doing when it comes to our flavored coffee creamers,• ICONICALLY NON-DAIRY AND GLUTEN-FREE: We’re all about creating tasty creamers that everyone can enjoy. Cheers to inclusive indulgence with our gluten-free, cholesterol-free, and non-dairy flavored creamer for coffee,• HOT, ICED, OR MIXED: Our liquid creamer is your coffee’s new BFF — We’re here for your coffee mug, your cup and your martini glass, any time you’re looking to sweeten up your cup,• MVP OF CREAMERS: Whoever said they didn’t like coffee creamer clearly hasn’t tried Coffee mate. Make your coffee goals a reality with our original flavored creamer,• KEEP IT CHILL: Keep your Coffee mate creamer chilled for that perfect original flavor. Pop it in the fridge after opening and use your creamer within 14 days, if it even lasts that long,• EVERY SIP COUNTS: Cheers to a brighter tomorrow with every mug Our original flavored creamer comes in recyclable packaging,• SNAP and EBT Eligible item,It’S Time To Make Your Coffee Breaks Iconic With Coffee Mate Original Flavored Coffee Creamer. You’Re Going To Fall In Love With Our Liquid Coffee Creamer, Taking You From Your Early Morning Grind To Your Late-Night Fuel Up With Up To One Hundred And Twenty-Six 1 Tbsp Servings. We’Re Here For Your Coffee Mug, Your Iced Coffee Glass And Your Midnight Martini. Dietary Preferences? We Have Those Covered Too – Our Coffee Mate Liquid Creamer Is Non-Dairy, Cholesterol-Free, And Gluten-Free. We Really Like Coffee, Just As Much As We Like Our Recyclable Packaging. Keep Your Original Flavored Creamer Cool In The Fridge For Up To 14 Days (If You Don’T Finish It Right Away). Ready To Level Up Your Coffee Game With Our Original Flavored Creamer Yet?","Water, Corn Syrup Solids, Soybean Oil, And Less Than 2% Of Micellar Casein (a Milk Derivative), Mono- And Diglycerides, Dipotassium Phosphate, Natural Flavor, Carrageenan.","Shake before use.,Try in iced coffee.,Do not freeze. Storage Advice: Keep refrigerated.,Completely remove freshness seal under cap.,For best quality, use within 14 days of opening.",Contains: a milk derivative.,,,,,,,
Chobani Vanilla Oat Milk,$4.99,$5.99, https://www.instacart.com/image-server/272x272/www.instacart.com/assets/domains/product-image/file/large_7dfe8903-7eb5-45c7-81b0-678d2faf76e0.png 4x,Gluten Free,,"Plant-based. Oat milk. Drink it. Mix it. Pour it. Stir it. Oats good for you - and the planet. Grown with Less Water: Oats require less water to grow than almonds. Improves Soil Health: Oats are a cover crop, enriching the soil where they grow and protecting it from erosion. Diversifies Our Diets: While agricultural production is primarily corn, rice, and wheat, oats bring a welcome diversity to our diet. Creamy Like Milk: Oats give a rich and creamy texture like dairy milk - without the dairy. Packaged sustainably: Chobani oat is packaged in a recyclable Sustainable Forestry Initiative – certified pulp carton. SFI: Certified Chain of Custody. Promoting sustainable forestry. www.sfiprogram.org.","Oat Blend (water, Whole Grain Oats), Contains 2% Or Less Of: Rapeseed Oil, Cane Sugar, Vanilla Extract, Natural Flavors, Sea Salt, Vitamin A Palmitate, Vitamin D2 (yeast Extract), Calcium Carbonate, Gellan Gum, Dipotassium Phosphate","Shake well.,Keep refrigerated. Do not freeze.",,,,,,,,
Blue Diamond Original Almond Breeze,,$3.69, https://www.instacart.com/image-server/272x272/www.instacart.com/assets/domains/product-image/file/large_bf5002ee-0441-43e6-b5f8-c67261cc33e3.png 4x,Gluten Free,,"Almond Breeze non-dairy almondmilk is delicious in everything, from cereals and smoothies to cooking and baking. Browse our variety of almondmilk including sweetened and unsweetened as well as vanilla and chocolate.,• Made with real California almonds,• Free from Dairy, Soy and Lactose,• Excellent source of vitamins D & E,• 50% More Calcium than Milk,• Non-GMO Project Verified","Almondmilk (filtered Water, Almonds), Cane Sugar, Calcium Carbonate, Sea Salt, Potassium Citrate, Sunflower Lecithin, Gellan Gum, D-alpha-tocopherol (natural Vitamin E).",Shake well.,Contains: almonds.,,,,,,,
The Laughing Cow Original Spreadable Creamy Cheese Wedges,$5.49,$6.49, https://www.instacart.com/image-server/272x272/www.instacart.com/assets/domains/product-image/file/large_ae764d53-5037-461c-aeee-277359c4a568.png 4x,,,"The creaminess of The Laughing Cow® cheese will transform snack time and keep your palate surprised. Every perfectly portioned wedge is made with real cheese, provides two grams of Complete Protein and is a good source of Calcium, Vitamins A & D. Rich and ready to top anything is the mantra of this versatile and classic Original flavor. Unwrap and combine this cheese wedge with your favorite snacks. Swap out your string cheese, cottage cheese and cheese cube snacks for The Laughing Cow®. From apples to zucchini, pretzels to crackers, breads and more, the pairing possibilities are endless for this spreadable cheese!,• Deliciously creamy spreadable cheese,• Eight perfectly portioned sized snack wedges made with real cheese,• 2g of complete protein per wedge,• Good source of Calcium, Vitamins A&D,• 45 Calories per wedge,• No Artificial Flavors, No Artificial Colors, No Artificial Growth Hormone","Cheddar, Semisoft, And Swiss Cheese (pasteurized Milk And Part-skim Milk, Cultures, Salt, Enzymes), Whey, Milk Protein Concentrate, Butter (cream), Water, Skim Milk, Sodium Polyphosphate, Less Than 2% Of Each: Tricalcium Phosphate, Citric Acid, Milk Fat, Salt, Vitamins (cholecalciferol [vitamin D] And Vitamin A Acetate)","Refrigerate after purchase.,Pull the red string to open!",Contains: milk.,,,,,,,
Kraft Parmesan & Romano Grated Cheese,,$8.09," https://www.instacart.com/image-server/272x272/www.instacart.com/assets/domains/product-image/file/large_271f21e6-ed15-42ed-964d-ac5a8037d08f.jpg 4x, https://www.instacart.com/image-server/272x272/www.instacart.com/assets/domains/product-image/file/large_eae45136-7145-462f-8dc7-6aa13df777da.jpg 4x, https://www.instacart.com/image-server/272x272/www.instacart.com/assets/domains/product-image/file/large_12c599f0-de13-4752-9f65-aaa0bfc4b8ea.jpg 4x, https://www.instacart.com/image-server/272x272/www.instacart.com/assets/domains/product-image/file/large_8594246d-d0d8-4dd0-906f-c9487b3c1000.jpg 4x",,,"Kraft Grated Parmesan and Romano Cheese made adds the zesty flavor of grated cheese to pizza, pasta, or anything else you can imagine. The shaker bottle allows for the easy addition of the perfect amount of grated cheese to your recipes and favorite dishes. This cheese blend is made from a mix of Parmesan and Romano cheese crafted from real, premium quality milk and grated into a fine powder. Its ideal for sprinkling on pasta, adding on top of pizza, or for use in your family's chicken Parmesan recipe. Packaged in an 8 ounce resealable shaker bottle for convenient storage and to help lock in flavor.,• One 8 oz shaker bottle of Kraft Grated Parmesan & Romano Cheese,• Kraft grated cheese resealable shaker bottle allows you to add just the right amount of cheese,• Blend of Parmesan and Romano cheese,• Finely grated cheese is easy to add to food,• Made with premium quality milk,• Add to recipes or sprinkle on top of food after it has been prepared,• Shaker bottle is resealable to help lock in flavor","Parmesan Cheese And Romano Cheese Made From Cow's Milk (pasteurized Part-skim Milk, Cheese Culture, Salt, Enzymes), Cellulose Powder, Potassium Sorbate To Protect Flavor",Refrigerate After Opening.,Contains: milk.,,,,,,,
"BelGioioso Fresh Mascarpone Cheese, Cup",$6.89,$8.69," https://www.instacart.com/image-server/272x272/www.instacart.com/assets/domains/product-image/file/large_da5e2945-d167-4647-b3ea-7d62c9e49bf9.png 4x, https://www.instacart.com/image-server/272x272/www.instacart.com/assets/domains/product-image/file/large_ef7ee8f4-c23f-4074-8296-fa21ae7e0d38.png 4x, https://www.instacart.com/image-server/272x272/www.instacart.com/assets/domains/product-image/file/large_ea17f429-45f0-48c2-80c6-ea79b889a0d8.png 4x, https://www.instacart.com/image-server/272x272/www.instacart.com/assets/domains/product-image/file/large_da5c7aa4-2f71-43cc-9d36-477eaa89a9d7.png 4x",Gluten Free,,For tiramisu and more. Classic Italian cheeses. rBST free (No significant difference has been found in milk from cows treated with artificial hormones).,"Pasteurized Milk And Cream, Citric Acid.","Do not freeze. Keep refrigerated.,For best flavor, once seal is broken, consume within 3-5 days.",Do not freeze.,,,,,,,
