Name,Discounted Price,Original Price,Images,Highlights,Gluten Free,Details,Ingredients,Directions,Warnings,Egg Free,Soy Free,Peanut Free,Treenut Free,Shellfish Free,Wheat Free,Milk Free
Kraft American Cheese Slices,$8.09,$9.19," https://www.instacart.com/image-server/272x272/www.instacart.com/assets/domains/product-image/file/large_56866016-7178-4e80-90f2-bff0646fdb0a.jpg 4x, https://www.instacart.com/image-server/272x272/www.instacart.com/assets/domains/product-image/file/large_353c8031-fa8d-4a21-b904-63b1a5558073.jpg 4x, https://www.instacart.com/image-server/272x272/www.instacart.com/assets/domains/product-image/file/large_1368d448-39b0-44a1-8468-dfc521d5dade.jpg 4x, https://www.instacart.com/image-server/272x272/www.instacart.com/assets/domains/product-image/file/large_7e869e96-90d3-4088-8452-623aadb238b4.jpg 4x",,,"Delicious any way you square it, Kraft Singles American Slices deliver the classic American taste and irresistible melt that take your favorite foods to the next level. Made with real dairy and no artificial flavors, our slices have a mild, savory flavor and smooth, creamy texture that’s perfectly melty. Our simple squares are ideal for more than just grilled cheese. Try adding Kraft Singles to your breakfast sandwich, burger or tuna melt. Transform steak and bread into a Philly cheesesteak, put a twist on ramen or turn plain fries into ooey gooey cheese fries. When you’re craving classic comfort food, add America's favorite square to your mac and cheese for a simple joy that’s sure to make you smile. Each cheese slice comes individually wrapped for convenience, so you can stack and snack any time. Kraft Singles contain 50 calories per serving. For optimal creamy goodness, keep our pack of 24 cheese slices refrigerated.,• One 24 ct pack of individually wrapped Kraft Singles American Slices,• Perfectly melty, Kraft Singles feature the classic American cheese taste and irresistible melt everyone loves,• Simply irresistible, Kraft Singles contain 50 calories per serving,• America's Favorite SQUARE is made with no artificial flavors,• Irrefutably delicious, our Kraft Singles are made with real dairy,• Take your foods to the next level by stacking Kraft Singles on your favorite sandwich, grilled cheese, burger, Philly cheesesteak and more,• Our Kraft Singles American Slices are perfect for adding ooey, gooey melted goodness on all your favorite foods, like ramen, fries and more,• Elevate your summer grilling with the perfect little square,• SNAP EBT Eligible","Cheddar Cheese (cultured Milk, Salt, Enzymes) Skim Milk, Milkfat, Milk Protein Concentrate, Whey, Calcium Phosphate, Sodium Phosphate, Contains Less Than 2% Of Modified Food Starch, Salt, Lactic Acid, Milk, Sorbic Acid As A Preservative, Oleoresin Paprika (color), Enzymes, Cheese Culture, Annatto (color). Contains. Milk","Do Not Freeze, Keep Refrigerated.",Contains: milk.,,,,,,,
Yoplait Original Low Fat Strawberry Banana Yogurt Cup,,$1.19," https://www.instacart.com/image-server/272x272/www.instacart.com/assets/domains/product-image/file/large_48f6a865-dd76-4730-8c59-d905861dd024.png 4x, https://www.instacart.com/image-server/272x272/www.instacart.com/assets/domains/product-image/file/large_0f68ed13-8e36-4ee5-85c6-f753585c2c9a.png 4x, https://www.instacart.com/image-server/272x272/www.instacart.com/assets/domains/product-image/file/large_c1f0dd32-9c92-4e0f-a839-989b4e333615.png 4x, https://www.instacart.com/image-server/272x272/www.instacart.com/assets/domains/product-image/file/large_08489e31-cce3-4fe6-a84f-a8437f30798f.png 4x",Gluten Free,,"Savor Yoplait Original Strawberry Banana Low Fat Yogurt as a delicious addition to an easy breakfast or snack! Made with real fruit plus live and active yogurt cultures, there are no artificial flavors or colors from artificial sources, and no high fructose corn syrup. Each serving is a good source of calcium, contains vitamins A and D, and is gluten free. Enjoy the yogurt plain, pair it with granola, or blend into a refreshing strawberry banana yogurt smoothie. Make it a tasty alternative to Greek yogurt. Grab a convenient yogurt cup as a part of breakfast to go. Or stock up for quick snacks for the family. Also try our other varieties, such as low fat French vanilla yogurt and low fat mixed berry yogurt. Store Yoplait Yogurt in the refrigerator and keep cold until you're ready to grab a spoon and enjoy. Yoplait brings goodness to everyday moments, one serving of yum at a time.,• CREAMY AND DELICIOUS: Smooth and creamy strawberry banana yogurt made with live and active cultures and real fruit; No artificial flavors or colors from artificial sources, and no high fructose corn syrup,• LOW FAT YOGURT: Gluten free, our low fat yogurt is a good source of calcium, contains vitamins A and D, and is gluten free; Enjoy the yogurt plain or topped with granola,• YOGURT CUP: Single serve low fat yogurt cup with 140 calories per serving; Explore other varieties such as low fat French vanilla yogurt and low fat mixed berry yogurt,• MORNING OR SNACK TIME: Enjoy yogurt as a quick breakfast food, afternoon snacks, or packed in a lunch box as a kids snack; Liven up snacking with the taste of our Yoplait Yogurt as an alternative to plain Greek yogurt or kefir,• CONTAINS: One 6 oz yogurt cup of Yoplait Original Strawberry Banana Low Fat Yogurt","Cultured Grade A Reduced Fat Milk, Sugar, Strawberries, Modified Corn Starch, Water, Banana Puree, Contains 1% Or Less Of: Corn Starch, Tricalcium Phosphate, Natural Flavor, Pectin, Carmine (for Color), Vitamin A Acetate, Vitamin D₃",Keep refrigerated.,Contains Milk Ingredients.,,,,,,,
Chobani Black Cherry Greek Yogurt,$1.67,$1.79, https://www.instacart.com/image-server/272x272/www.instacart.com/assets/domains/product-image/file/large_60f99a06-3b31-45fb-ba66-5feab6656cd2.png 4x,Gluten Free,,Only natural ingredients. Billions of probiotics. Protein rich. Authentically crafted. No fake fruit. No artificial sweeteners. No preservatives. No rBST (Milk from rBST-treated cows is not significantly different).,"Cultured Nonfat Milk, Black Cherries, Cane Sugar, Water, Fruit Pectin, Cherry Juice Concentrate, Natural Flavors, Locust Bean Gum, Guar Gum, Lemon Juice Concentrate",Keep refrigerated.,,,,,,,,
Almond Breeze Original Almondmilk,,$5.79," https://www.instacart.com/image-server/272x272/www.instacart.com/assets/domains/product-image/file/large_cd5124d3-43b9-4291-bf9d-4ffb8f422533.jpg 4x, https://www.instacart.com/image-server/272x272/www.instacart.com/assets/domains/product-image/file/large_e60850b7-91aa-466b-897b-bd02bf8805d1.jpg 4x, https://www.instacart.com/image-server/272x272/www.instacart.com/assets/domains/product-image/file/large_b0e5428b-c046-41c1-816d-f90bcf56b108.jpg 4x, https://www.instacart.com/image-server/272x272/www.instacart.com/assets/domains/product-image/file/large_a059e105-526d-4601-88bb-3eca8ea44663.jpg 4x","Gluten Free,Egg Free",,"Almond Breeze non-dairy almondmilk is delicious in everything, from cereals and smoothies to cooking and baking. Browse our variety of refrigerated and shelf stable almondmilk, including sweetened and unsweetened, vanilla, chocolate, our coconut and banana almondmilk blends, as well as almondmilk creamers and almondmilk yogurts. The best almonds make the best almondmilk.,• Made with real California almonds,• Free from Dairy, Soy and Lactose,• Excellent source of vitamins D & E,• 50% More Calcium than Milk,• Non-GMO Project Verified","Almondmilk (filtered Water, Almonds), Cane Sugar, Calcium Carbonate, Sea Salt, Potassium Citrate, Sunflower Lecithin, Gellan Gum, Vitamin A Palmitate, Vitamin D2, D-alpha-tocopherol (natural Vitamin E).",Shake well.,Contains: almonds.,,,,,,,
Chobani Vanilla Greek Style Yogurt,$1.67,$1.79, https://www.instacart.com/image-server/272x272/www.instacart.com/assets/domains/product-image/file/large_6d028357-c571-4771-9ea2-91a2a9049028.png 4x,Gluten Free,,"Chobani® Non-Fat Greek Yogurt Vanilla Blended.,Locally sourced milk.,0% Milkfat.,Net Wt 5.3 oz (150 g).","Cultured Nonfat Milk, Cane Sugar, Water, Natural Flavors, Fruit Pectin, Guar Gum, Locust Bean Gum, Vanilla Extract, Lemon Juice Concentrate",Keep refrigerated.,,,,,,,,
Chobani Sweet Cream Coffee Creamer,$5.99,$6.99, https://www.instacart.com/image-server/272x272/www.instacart.com/assets/domains/product-image/file/large_c7a4efef-028d-4078-a68b-f6128402fa49.png 4x,,,Rich & creamy. Authentically Crafted: No sweeteners. No preservatives. No emulsifiers. No rBST (milk from rBST-treated cows is not significantly different). No carrageenan. Simple and delicious. Good for great mornings. Makes every sip of coffee more delicious than the last. Naturally. FSC: Mix - Board. Packaged sustainably in recyclable cartons made with paperboard from FSC-Certified Forests and other controlled sources.,"Milk, Cream, Cane Sugar, Natural Flavors","Shake well.,Keep refrigerated.",,,,,,,,
Horizon Organic Reduced Fat Organic Milk,,$6.99," https://www.instacart.com/image-server/272x272/www.instacart.com/assets/domains/product-image/file/large_4c7e0d16-46cb-44d7-8832-2a93600f3f6c.jpg 4x, https://www.instacart.com/image-server/272x272/www.instacart.com/assets/domains/product-image/file/large_a3c0574a-4c79-42f2-88ea-105ba96fca40.jpg 4x, https://www.instacart.com/image-server/272x272/www.instacart.com/assets/domains/product-image/file/large_1822c7d9-a073-411a-87aa-fd7d4fe36fee.jpg 4x, https://www.instacart.com/image-server/272x272/www.instacart.com/assets/domains/product-image/file/large_43286d49-43af-47a3-9e54-5eb52f1da7dd.jpg 4x",,,"Get the joy of a cold glass of real milk with Horizon Organic High Vitamin D 2 Percent Milk. With 38% less fat than whole milk and 25% of the recommended daily value of vitamin D in every delicious serving, this organic reduced fat milk makes it super easy to get essential nutrients into your day to help support strong bones. Always USDA Certified Organic, every Horizon milk carton comes from cows cared for by trusted farmers. Plus, it comes from cows that are fed non-GMO feed and not treated with antibiotics or growth hormones.* Every 1 cup serving of this ultra-pasteurized 2% milk has 8 grams of protein and provides nutrients including calcium and vitamin A. It’s real organic milk that adults and kids can happily enjoy. At Horizon Organic, we believe that farming done the right way can drive healthier, more sustainable food communities for our world. Pioneering organic for the one horizon we all share. From our farmers to your family, Horizon Organic Milk is nourishing a happy, healthy future. *No significant difference has been shown between milk from rBST-treated & non rBST-treated cows.","Organic Grade A Reduced Fat Milk, Vitamin A Palmitate, Vitamin D3.",Do Not Freeze,Contains milk.,,,,,,,
I Can't Believe It's Not Butter Original Spread,$4.09,$5.79," https://www.instacart.com/image-server/272x272/www.instacart.com/assets/domains/product-image/file/large_02cdd38e-842a-4f95-9d4c-0e7acef27eff.png 4x, https://www.instacart.com/image-server/272x272/www.instacart.com/assets/domains/product-image/file/large_41c0baee-78d0-4a2a-ab34-2264350b167c.png 4x, https://www.instacart.com/image-server/272x272/www.instacart.com/assets/domains/product-image/file/large_fe433be5-9f3a-4858-8f22-0f5a53decf50.png 4x, https://www.instacart.com/image-server/272x272/www.instacart.com/assets/domains/product-image/file/large_985a9ad3-fd98-44f6-b7fd-f920571d4039.png 4x",,,"I Can’t Believe It’s Not Butter! Original Spread 15 oz is not just a fantastic way to add delicious buttery flavor to your favorite foods, it’s also what you yell pretty much every time you taste it. And how fun is that? We’ll tell you: a lot of fun. Compared to dairy butter, per 1 tbsp. serving, I Can’t Believe It’s Not Butter! Original Spread has less saturated fat, fewer calories, and more omega-3 ALAs. 375mg of omega-3 ALA (23% of the 1.6g daily value) compared to 44mg (1.1% of the 1.6g daily value) contained in dairy butter to be exact.,Also, unlike dairy butter, I Can’t Believe It’s Not Butter! Original Spread meets the nutritional requirements of the American Heart Association Heart-Check Food Certification Program. It’s made with good fats from plant-based oils, including soybean oil. Supportive but not conclusive scientific evidence suggests that eating about one and a half tablespoons (20.5g) of soybean oil daily, which contains unsaturated fat, may reduce the risk of coronary heart disease.,Made with simple ingredients such as a delicious blend of plant-based oils, purified water, and a pinch of salt. I Can’t Believe It’s Not Butter! Original Spread delivers unbelievable buttery goodness with no artificial flavors, and no artificial preservatives. Per 1 tablespoon serving, it has 6g total fat and 0g of trans-fat, and just 60 calories. At 2g of saturated fat per 1 tablespoon serving, that's 70% less than what dairy butter has! And when a guest comes over and sees I Can’t Believe It’s Not Butter! in your fridge? They’re smiling...guaranteed.,I Can’t Believe It’s Not Butter! Isn’t just a good decision, it’s also a pretty good time. Now go ahead and say the name again. Out loud. It feels great, pinky swear.,• OMEGA 3S? YES PLEASE: Rich in omega-3 ALA at 375 mg per tablespoon serving (23% of the 1.6g daily value),• PLANT-BASED OILS: buttery goodness made with good fats from plant-based oils including soybean and palm.,• HEART HEALTHY: Certified as a heart healthy food by the American Heart Association Heart-Check Certification Program.,• NUTRITION FACTS FOR THE WIN: 40% fewer calories and 70% less saturated fat per 1 tbsp. serving than dairy butter.,• 0G TRANS FAT PER SERVING: and NO hydrogenated or partially hydrogenated oils","Purified Water, Soybean Oil, Palm And Palm Kernel Oil, Salt, Lecithin (soy), Natural Flavor, Vinegar, Vitamin A Palmitate, Beta Carotene (color).","Keep refrigerated. For best quality do not refreeze.,Best if used by date on lid.",Contains milk and soy.,,,,,,,
Chobani Vanilla Coffee Creamer,$5.99,$6.99, https://www.instacart.com/image-server/272x272/www.instacart.com/assets/domains/product-image/file/large_0c5d293b-3fa1-45f9-9c10-2eb23fc35a64.png 4x,,,Rich & creamy. Authentically crafted. No sweeteners. No preservatives. No emulsifiers. No rBST (milk from rBST-treated cows is not significantly different). No carrageenan. simple and delicious. Good for great mornings. Makes every sip of coffee more delicious than the last. Naturally. FSC: Mix - Board. Packaged sustainable in recyclable cartons made with paperboard from FSC-Certified Forests and other controlled sources.,"Milk, Cream, Cane Sugar, Natural Flavors, Vanilla Extract","Shake well.,Keep refrigerated.",,,,,,,,
Daisy Sour Cream,$5.19,$5.79, https://www.instacart.com/image-server/272x272/www.instacart.com/assets/domains/product-image/file/large_01b89f23-5afe-4b6c-b4fc-5f9ed862166d.jpeg 4x,,,"What makes Daisy America’s favorite sour cream? Every tub of Daisy's rich and cream sour cream is carefully crafted to elevate your favorite recipes. Whether it’s baked potatoes, tacos, chili, or your other favorite foods, a dollop of Daisy’s delicate and dynamic flavor makes everything taste better. The secret to delivering the signature flavor in every dollop of Daisy is one simple ingredient, cultured cream. Daisy pure & natural sour cream is free from preservatives, stabilizers, gums, thickeners, and other things that don't belong in sour cream. Do a dollop of Daisy!,• Fresh and delicious taste,• Made with one wholesome ingredient: cultured cream,• Pure & Natural,• No artificial additives or preservatives,• Grade A,• rBST Free,• Kosher",Cultured Cream.,Keep refrigerated.,Contains milk,,,,,,,
Philadelphia Original Whipped Cream Cheese Spread,,$6.89," https://www.instacart.com/image-server/272x272/www.instacart.com/assets/domains/product-image/file/large_9849f82c-585e-4f54-b8f0-1921476e34bd.jpg 4x, https://www.instacart.com/image-server/272x272/www.instacart.com/assets/domains/product-image/file/large_3c897530-c82a-41d4-a09d-27056a5b880f.jpg 4x, https://www.instacart.com/image-server/272x272/www.instacart.com/assets/domains/product-image/file/large_1df73176-775c-4724-8c73-d7c4836d7b4e.jpg 4x, https://www.instacart.com/image-server/272x272/www.instacart.com/assets/domains/product-image/file/large_f0f8ed91-790d-4ffc-8fe0-e3e11061a04d.jpg 4x",,,"Dive into immersive pleasure with Philadelphia Original Whipped Cream Cheese Spread. Fresh milk and real cream are whipped for an extra creamy, multi-dimensional taste you can add to any meal. At Philly, we leave out the artificial preservatives, flavors and dyes to ensure a rich, quality flavor. Our light and fluffy whipped cream cheese spread is easy to spread, making it the perfect choice for adding to your morning bagel or dipping veggies, chips and crackers. Keep our 8 ounce resealable container of cream cheese spread refrigerated. With Philadelphia Cream Cheese Spread, enjoy a rich, creamy experience you don't just taste, you feel.,• One 8 oz tub of Philadelphia Original Whipped Cream Cheese Spread,• Dive into immersive pleasure with our original whipped cream cheese spread,• Fresh milk and real cream are whipped for a light, fluffy experience you don't just taste, you feel.,• Philadelphia stays charmingly real with no artificial preservatives, flavors or dyes,• Easy to spread cream cheese spread creates smooth satisfaction,• Creamy and delicious, Philly cream cheese is perfect to spread on bagels or enjoy with any of your favorite breakfast foods,• Try our light and fluffy whipped cream cheese spread as a dip for veggies, chips and crackers to create a blissful snacking experience,• Packaged in a resealable tub to maintain a rich, dynamic taste,• Kosher","Pasteurized Milk And Cream, Skim Milk, Whey Protein Concentrate, Whey, Modified Food Starch, Salt, Carob Bean Gum, Xanthan Gum, Lactic Acid, Natamycin (a Natural Mold Inhibitor), Vitamin A Palmitate, Cheese Culture","Keep Refrigerated.,For Best Quality, Use Within 10 Days Of Opening.",Contains: milk.,,,,,,,
Nestle Table Cream,,$3.29, https://www.instacart.com/image-server/272x272/www.instacart.com/assets/domains/product-image/file/large_93d7ecbc-f214-422e-9641-b31646651007.jpg 4x,,,"• MEDIA CREMA: Nestlé Media Crema has a rich creaminess that enhances all dishes with double consistency: liquid at room temperature or thicker in the refrigerator.,• SWEET AND SAVORY DISHES: Unlock your culinary creativity Media Crema is a versatile, velvety topping or ingredient that transforms both sweet & savory dishes, hot or cold.,• NESTLÉ TABLE CREAM: Stock up worry-free Media Crema is a shelf stable cream for the long run, ready to add creamy goodness to your dishes anytime. Enjoy this Nestlé Cream year-round as well.,• TASTE THE TRADITION: Enjoy the culinary heritage of Nestlé Media Crema. Share meals and share moments with Nestlé Media Crema. Enhance the consistency of any dish with a single touch.,• SECRET INGREDIENT: Media Crema is the secret ingredient that enhances all your dishes. From dips to desserts, Media Crema adds depth and texture to your culinary creations.,• SNAP and EBT Eligible item,Nestlé Media Crema Table Cream, The Perfect Addition To Your Kitchen For All Your Sweet And Savory Dishes. This Media Crema Topping Or Ingredient Is A Versatile Cream That Will Elevate The Consistency Of Any Dish. Whether You'Re Making Enchiladas, Tacos, Tres Leches Cake, Or Even Adding A Rich And Creamy Finish To Your Morning Coffee, This Shelf Stable Cream Is A Must-Have Pantry Staple For Cooking And Baking. Made With Quality Ingredients, Nestlé Media Crema Is Your Go-To Cooking Cream That Adds A Touch Of Indulgence To Any Recipe. This Table Cream Has A Smooth And Velvety Texture That Blends Seamlessly Into Both Hot And Cold Dishes. With Its Convenient 7.6 Fl Oz Can Size, You Can Easily Keep This Table Cream On Hand For Whenever Inspiration Strikes In The Kitchen. The Taste Of Tradition, This Media Crema Is An Essential Ingredient For Any Home Cook. Add Nestlé Media Crema To Your Cart Today And Experience A New Level Of Creaminess. When You'Re Looking For A Reliable Table Cream Nestlé Has You Covered With Their Top-Of-The-Line Products. Elevate Your Culinary Creations With Nestlé Media Crema Today","Light Cream, Carrageenan, Sodium Alginate, Disodium Phosphate, Sodium Citrate","Shake well before use. Shake well.,Keep in a cool dry place. Do not freeze. Refrigerate after opening.,See bottom of can for best if used by date.",Contains: milk.,,,,,,,
Coffee mate French Vanilla Flavored Coffee Creamer,$4.09,$6.89, https://www.instacart.com/image-server/272x272/www.instacart.com/assets/domains/product-image/file/large_186a3845-fc2c-4e50-a972-2d8362585406.jpeg 4x,Gluten Free,,"• FOR THE LOVE OF COFFEE: Ditch your boring coffee routine and upgrade your brew game with our Coffee mate French Vanilla Flavored Zero Sugar Coffee Creamer. We’ve been working on our recipes since 1961, so we know what we’re doing when it comes to our flavored coffee creamers,• ICONICALLY GLUTEN-FREE WITH ZERO SUGAR: We’re all about creating tasty creamers that everyone can enjoy. Cheers to inclusive indulgence with our gluten-free, cholesterol-free flavored creamer for coffee with zero sugar,• HOT, ICED, OR MIXED: Our zero sugar creamer is your coffee’s new BFF — We’re here for your coffee mug, your cup and your martini glass. Add our French Vanilla flavored coffee creamer any time you’re looking to sweeten up your cup,• MVP OF CREAMERS: Whoever said they didn’t like coffee creamer clearly hasn’t tried Coffee mate. Make your coffee goals a reality with our zero sugar creamer,• KEEP IT CHILL: Keep your Coffee mate creamer chilled for that perfect coffee flavor. Pop it in the fridge after opening and use your zero sugar creamer within 14 days, if it even lasts that long,• EVERY SIP COUNTS: Cheers to a brighter tomorrow with every mug Our zero sugar coffee creamer comes in recyclable packaging,• SNAP and EBT Eligible item,It’S Time To Make Your Coffee Breaks Iconic With Coffee Mate French Vanilla Flavored Zero Sugar Coffee Creamer. You’Re Going To Fall In Love With Our Liquid Coffee Creamer, Taking You From Your Early Morning Grind To Your Late-Night Fuel Up With Up To Sixty-Three Servings. We’Re Here For Your Coffee Mug, Your Iced Coffee Glass And Your Midnight Martini. Dietary Preferences? We Have Those Covered Too – Our Coffee Mate Liquid Creamer Is Cholesterol-Free, Gluten-Free, And Has Zero Sugar. We Really Like Coffee, Just As Much As We Like Our Recyclable Packaging. Keep Your Zero Sugar Creamer Cool In The Fridge For Up To 14 Days (If You Don’T Finish It Right Away). Ready To Level Up Your Coffee Game With Our French Vanilla Flavored Coffee Creamer Yet?","Water, Soybean Oil, And Less Than 2% Of Micellar Casein (a Milk Derivative), Maltodextrin**, Dipotassium Phosphate, Monoand Diglycerides, Natural And Artificial Flavor, Carrageenan, Sucralose, Acesulfame Potassium (non-nutritive Sweetener).","Shake before use.,Try in iced coffee.,Do not freeze. Storage Advice: Keep refrigerated.,Completely remove freshness seal under cap.,For best quality, use within 14 days of opening.",Contains: a milk derivative.,,,,,,,
