"Field Roast Burgers, Plant-Based, Chef's Signature",,," https://www.instacart.com/image-server/272x272/www.instacart.com/assets/domains/product-image/file/large_c8bb9078-e16c-4933-94da-c559f38f34ab.png 4x, https://www.instacart.com/image-server/272x272/www.instacart.com/assets/domains/product-image/file/large_55b9abe1-5ad9-4c97-b803-fd70320a9ddf.png 4x, https://www.instacart.com/image-server/272x272/www.instacart.com/assets/domains/product-image/file/large_728bf3c9-40c5-417c-b8d4-9b34397d2f15.png 4x","Meat & Cheese co. Discover a world of flavor. Ready to eat. Enjoy. Sizzled to Perfection: Fire up the grill and enjoy our Chef's Signature Plant Based Burgers. Handcrafted with garlic, fresh carrots, onions, and seasoned to perfection, this is not your traditional veggie burger. With a satisfying savory flavor, pile on your favorite toppings or redefine the burger and crumble it in your famous chili. Carbon zero (Learn more about our commitment to carbon neutrality: fieldroast.com/carbonneutral) made by a Carbon Neutral Company. Paper box. Plastic wrap. how2recycle.info.","Filtered Water, Vital Wheat Gluten, Wheat Protein Isolate (wheat Gluten, Trisodium Phosphate, Malic Acid, L-cysteine), Organic Expeller Pressed Palm Fruit Oil, Barley, Garlic, Expeller Pressed Safflower Oil, Onions. Tomato Paste, Celery, Carrots, Yeast Extract (yeast, Natural Flavor, Salt), Onion Powder, Barley Malt Extract, Mushrooms, Sea Salt, Spices, Celery Seed, Balsamic Vinegar, Black Pepper, Shiitake Mushrooms, Porcini Mushroom Powder, Yellow Pea Flour, Cultured Cane Sugar, Vinegar.","Grill: Grill on low or indirect heat for 3 minutes, flip and grill for an additional 3 minutes until heated through. Stove Top: Preheat nonstick pan to medium-low. Place burger in pan and cook for 5 minutes, flip and cook for an additional 5 minutes until heated through. Oven: Preheat oven to 350 degrees F. Place burger on baking sheet. Bake for 5 minutes, flip and bake for an additional 5 minutes until heated through. Microwave: Place burger on a microwave-safe plate. Microwave on high for 30 seconds, carefully flip and microwave for an additional 15 seconds until heated through.,Keep refrigerated. May have been previously frozen. Okay to refreeze.",Contains: wheat. Manufactured in a facility that processes tree nuts.,,,,,,,,,,,,
"Yves Veggie Cuisine Veggie Bacon, Plant Based",,$6.49,,Contain no meat.,"Water, Vital Wheat Gluten, Soy Protein Isolate, Natural Flavors, Contains 2% or Less of: Spice, Onion Powder, Potato Starch, Salt, Vitamins & Minerals (Dimagnesium Phosphate, Ferric Orthophosphate, Zinc Oxide, Niacinamide, Vitamin B12, Calcium Pantothenate, Thiamine Hydrochloride, Pyridoxine Hydrochloride, Riboflavin, Iron Oxide), Wheat Starch, Caramel Color, Sugar, Beet Powder (Color), Yeast Extract, Carrageenan, Salt-Blend (Sea Salt, Potassium Chloride, Magnesium Chlorides, Magnesium Sulfates).","Pre-cooked! Stovetop: Saute in a lightly-oiled pan over medium heat for 1 - 1-1/2 minutes on each side.,Keep refrigerated.",Contains: soy and wheat.,,,,,,,,,,,,
Wildwood Grilling 2Pk Extra Firm Tofu,,$4.49," https://www.instacart.com/image-server/272x272/www.instacart.com/assets/domains/product-image/file/large_425f89b4-1a91-41af-9b41-38107d7ad274.png 4x, https://www.instacart.com/image-server/272x272/www.instacart.com/assets/domains/product-image/file/large_413ccf8c-fba0-4d63-b7ad-f0beaa24c546.png 4x, https://www.instacart.com/image-server/272x272/www.instacart.com/assets/domains/product-image/file/large_92b5becb-724c-401b-9a57-5755eca7d5ff.png 4x, https://www.instacart.com/image-server/272x272/www.instacart.com/assets/domains/product-image/file/large_cf990da0-1a7a-4c41-8243-ae4979d6e3d2.png 4x",Made with sprouted soybeans. A gluten free food. USDA Organic. Heart healthy (Diets low in saturated fat and cholesterol that include 25 grams of soy protein a day may reduce the risk of heart disease. One serving of Extra Firm Tofu provides 9 grams of soy protein). Meets our genuinely natural strict principles. 90 calories; 1 g sat fat (5% DV); 15 mg sodium (1% DV); 0 g sugars; calcium (10% DV). Certified Organic by QAI. Authentic wholesome foods. www.wildwoodfoods.com. Product of USA.,"Filtered Water, Sprouted Organic Soybeans, Calcium Sulfate, Glucono Delta Lactone, Nigari [magnesium Chloride, A Natural Firming Agent].",Keep refrigerated.,Contains: soy.,,,,,,,,,,,,
"Lightlife Tempeh, Organic, Original",,, https://www.instacart.com/image-server/272x272/www.instacart.com/assets/domains/product-image/file/large_d4e6f904-aebd-4535-bb58-ebcab041bcc1.png 4x,"From the sunny islands of Indonesia comes an ancient food that is as savoury as it is versatile. Made from organically grown soybeans, Tempeh (pronounced tem-pay) is high in protein, and a good source of iron. Tempeh is naturally a low sodium food. Each serving contains 16 g protein. Enjoy! Since 1979. Canada organic. Non GMO Project verified. nonGMOproject.org. Certified vegan. vegan.org. 16 g veggie protein per serving. Facebook. Twitter. Instagram. Pinterest. Lightlife Tempeh is rich in protein and can be sauteed, grated, stewed or baked for a variety of main courses. Occasional dark areas on Tempeh are a result of the natural colouring process and do not indicate spoilage. Toll-free, M-F, 9-5 EST 1-800-769-3279. Certified organic by QAI. Product of USA.","Cultured Organic Soybeans (Soybeans, Lactic Acid from Plant Sources), Water, Organic Brown Rice.",Best by date on package. Keep refrigerated. For Food Quality and Safety: Will keep for 5-7 days tightly wrapped and refrigerated after opening. To Fry: Cut into 1/4 inch thick slices; heat in well oiled skillet with 2 tbsp soy sauce until golden brown on both sides. Season to taste.,Contains: soy.,,,,,,,,,,,,
Yves Veggie Cuisine Veggie Dogs,,," https://www.instacart.com/image-server/272x272/www.instacart.com/assets/domains/product-image/file/large_c56c0d34-7aa5-47ff-8dbf-eccbd45efcdd.png 4x, https://www.instacart.com/image-server/272x272/www.instacart.com/assets/domains/product-image/file/large_e89bdaa6-6858-49c6-8f87-cf0d8a768bc2.png 4x, https://www.instacart.com/image-server/272x272/www.instacart.com/assets/domains/product-image/file/large_8341a495-e65f-4722-9181-0d2050ae28f3.png 4x","Simulated wieners. Contains no meat.,Terracycle.ca.,• Kosher,• Plant-Based","Water, Soy Protein, Wheat Gluten, Cane Sugar, Wheat Starch, Salt, Yeast Extract, Spices, Carrageenan (from Seaweed), Natural Liquid Smoke, Beetroot Powder, Potassium Chloride, Vitamin and Mineral Blend.","Precooked! Boil, BBQ or Panfry with Oil: 3-4 mins.,Keep refrigerated.","Contains soy, wheat and mustard.",,,,,,,,,,,,
Sweet Earth Benevolent Bacon,,," https://www.instacart.com/image-server/272x272/www.instacart.com/assets/domains/product-image/file/large_e220c7c5-c0e5-41d5-9afc-7d0e8e097ab5.jpg 4x, https://www.instacart.com/image-server/272x272/www.instacart.com/assets/domains/product-image/file/large_bc134518-c305-41e3-80d0-fbdab54aab4f.jpg 4x, https://www.instacart.com/image-server/272x272/www.instacart.com/assets/domains/product-image/file/large_0e960a5d-1151-4228-8bd3-bf0f054ab3e9.jpg 4x, https://www.instacart.com/image-server/272x272/www.instacart.com/assets/domains/product-image/file/large_a80445b0-d08f-4f2d-be20-ec24918c1a71.jpg 4x","Vegan, *Plant-Based Substitute For Pork Bacon, 60% Less Fat And Sodium Than Pork Bacon**, Smoky, Saucy, Savory. Plant Based, Skillet Ready, Omg Cholesterol, Ngmpv, 2D Code, Bop: A Cholesterol Free Food. Bop:**One Serving Cooked Pork Bacon Contains 7G Fat Vs. 2.5G Fat In One Serving Of Sweet Earth Benevolent Bacon. One Serving Of Cooked Pork Bacon Contains 336Mg Sodium Vs. 120Mg Sodium In One Serving Sweet Earth Benevolent Bacon. Pork Bacon Nutritionals Pulled From Usda Fooddata Central","Water, Vital Wheat Gluten, Canola Oil3, Natural Flavor, Adzuki Beans1, Buckwheat Groats1, Natural Hickory Smoke Flavor, Cane Sugar1, Smoked Paprika, Annatto, Maple Syrup1, Tomato Powder, Garlic, Onion Powder, Spices, Tomato Paste, Soy Sauce2 (water, Soybeans2, Wheat, Salt, Alcohol1), Nutritional Yeast1, Apple Cider Vinegar1, Coconut Oil, Sea Salt And Caramel Color1.","Benevolent Bacon Cooking Instructions: From Refrigerated: Stovetop: Pre-heat a lightly oiled non-stick pan or skillet over medium heat. Cook approximately 2 minutes per side or until desired crispness. From Frozen: Thaw package under frugal use of cool water for 10 minutes, then use stovetop instructions. Cook to an internal temp. of 165 degrees F. Eat or freeze within 4 days of opening.,Keep refrigerated or frozen, my friend.","Contains soy, wheat made in a facility that processes egg, milk",,,,,,,,,,,,
Franklin Farms Extra Firm Tofu,,, https://www.instacart.com/image-server/272x272/www.instacart.com/assets/domains/product-image/file/large_ad8ec23e-e4a2-4932-bcb9-2e24d213f42c.png 4x,Plant based.,"Water, Non-gmo Soybeans, Calcium Sulfate, Glucono Delta-lactone.",Keep refrigerated.,,,,,,,,,,,,,
Wildwood Grilling Sproutofu Baked Tofu,,$5.59," https://www.instacart.com/image-server/272x272/www.instacart.com/assets/domains/product-image/file/large_1fd80615-185c-417f-810d-6f44bdb0036c.png 4x, https://www.instacart.com/image-server/272x272/www.instacart.com/assets/domains/product-image/file/large_989899d1-0e94-4fe0-96d0-27cf116fe3eb.png 4x, https://www.instacart.com/image-server/272x272/www.instacart.com/assets/domains/product-image/file/large_b740039d-9bf4-404d-a4cf-461ce94ef6cd.png 4x, https://www.instacart.com/image-server/272x272/www.instacart.com/assets/domains/product-image/file/large_69ffc186-a28d-4c6a-83cd-85094ed0ce3b.png 4x","Wildwood® Organic Sproutofu® Savory Baked Tofu.,Made with sprouted soybeans.,Meets our strict principles, genuinely natural™.,USDA organic.,150 calories.,1.5g sat fat, 8% DV.,390mg sodium, 16%DV.,<1g sugars.,Heart healthy*.","Organic Tofu (filtered Water, Sprouted Organic Soybeans, Nigari [magnesium Chloride, A Natural Firming Agent], Calcium Sulfate), Filtered Water, Organic Soy Sauce (water, Organic Soybeans, Sea Salt, Organic Whole Wheat, Organic Alcohol [to Preserve Freshness]), Organic Apple Cider Vinegar, Organic Stone-ground Mustard (organic Apple Cider Vinegar, Organic Mustard Seeds, Salt, Organic Spices), Organic Apple Juice, Organic Toasted Sesame Oil, Organic Onion Powder, Organic Garlic Powder.",Perishable. Keep refrigerated.,"Contains: soy, wheat & sesame.",,,,,,,,,,,,
Bob's Red Mill Textured Vegetable Protein,,," https://www.instacart.com/image-server/272x272/www.instacart.com/assets/domains/product-image/file/large_6baad03c-bd45-48a3-9c5d-77eda53cc9d7.png 4x, https://www.instacart.com/image-server/272x272/www.instacart.com/assets/domains/product-image/file/large_493d20d5-fa67-4735-8ab0-84c7c7aadc81.png 4x","To your good health - Bob Moore. An employee-owned company. Gluten free. High protein TVP. You can see our quality! Textured vegetable protein is a highly nutritious soy product. It is incredibly wealthy in complete protein and contains no fat, so it is an excellent alternative to meat. It is also a good source of dietary fiber, iron, magnesium and phosphorus. Textured vegetable protein is made from defatted soy flour that has been cooked under pressure and then dried. It is very easy to prepare and takes on the flavor of whatever recipe to which it is added, making it an incredibly versatile addition to a wide variety of dishes. Wholesome. Bob's Red Mill products labeled gluten free are batch tested in our quality control laboratory. We use an ELISA gluten assay test to confirm that a product is gluten free. Our product line is diverse and extensive. For information and recipes, visit our website at www.bobsredmill.com. Dear Friends, Since starting this company over thirty years ago, our mission has always been to offer the most diverse array of stone ground, whole grain products. About ten years ago, we noticed that some folks were exclusively buying gluten free grains like brown rice, sorghum and quinoa. Soon after that, we learned all about celiac disease and gluten intolerance and how serious they are to millions of people like you. Over the years we have introduced a variety of measures to ensure purity in our line of gluten free products that have become industry standard. We inspect all farm deliveries, use dedicated gluten free production facilities and employ batch testing in our quality control laboratory. Knowing that we're providing safe and delicious gluten free foods that you and your family can trust makes it all worth the effort. To your good health, Bob Moore. To learn more about our gluten free products visit www.bobsredmill.com/gluten-free. Made in the USA.",Defatted Soy Flour.,"Keeps best refrigerated or frozen. To Rehydrate: 7/8 cup water or vegetable broth; 1 cup Bob's Red Mill TVP. To rehydrate the granules, pour boiling water or broth over Bob's Red Mill TVP. Stir and let stand for 5 to 10 minutes. To Cook in Microwave: 7/8 cup water or vegetable broth; 1 cup Bob's Red Mill TVP. To cook in a microwave, cover tightly with plastic wrap and cook on high for 5 to 6 minutes; check after 2 minutes and add a little more liquid if needed. You can prepare a double batch of chunks, enough for 2 or 3 recipes, and the cooked Bob's Red Mill TVP will keep in the refrigerator several days. Or freeze some to thaw later in the microwave or in the refrigerator. Once TVP has been rehydrated, it must be kept under refrigeration.",Manufactured in a facility that uses tree nuts and soy.,,,,,,,,,,,,
"Good Catch Crab Cakes, Plant-Based, New England Style",,," https://www.instacart.com/image-server/272x272/www.instacart.com/assets/domains/product-image/file/large_327aec6a-b108-4f0b-a604-aa2cc71ba8fd.png 4x, https://www.instacart.com/image-server/272x272/www.instacart.com/assets/domains/product-image/file/large_4f792a5d-57ae-4b1f-8f10-aef6044d55d9.png 4x, https://www.instacart.com/image-server/272x272/www.instacart.com/assets/domains/product-image/file/large_2c8cb277-a1b9-436d-89d5-5cd912f98b00.png 4x","Here's the deal. We're passionate about great- tasting food and showing our planet some respect. Our mission is to make plant-based products that give you the taste and texture of seafood without giving you anxiety about mercury, microplastics, or overfishing. And, we developed a lot of great recipes using our products, so check them out on the Good Catch website. Chad & Derek Sarno, Founding Chefs.","Water, Good Catch® 6-plant Protein Blend (pea Protein Isolate, Soy Protein Concentrate, Chickpea Flour, Faba Protein, Lentil Protein, Soy Protein Isolate, Navy Bean Powder), Red Bell Peppers, Green Onions, Sunflower Oil, Corn Starch, Italian Flat Leaf Parsley, Natural Flavors, Lemon Juice, Salt, Methylcellulose, Onion Powder, Algal Oil, Paprika, Spices, Yeast Extract, Garlic Powder","Cook thoroughly. Cooking Instructions: 1. Preheat skillet (cast iron preferred) over medium heat and add oil. 2. Place frozen cakes on skillet. Do not overcrowd. 3. Cook cakes with lid on, flipping occasionally, until internal temperature reaches 165 degrees F (74 degrees C), approximately 8 minutes.,Keep frozen.",Contains soy.,,,,,,,,,,,,
Sweet Earth Vegan Mindful Chik'N Plant Based Protein Pieces,,," https://www.instacart.com/image-server/272x272/www.instacart.com/assets/domains/product-image/file/large_e5adddeb-2c97-44d6-8c02-89ca91f62e67.jpg 4x, https://www.instacart.com/image-server/272x272/www.instacart.com/assets/domains/product-image/file/large_46000dbb-36b6-4549-a93d-291fbc0975f1.jpg 4x, https://www.instacart.com/image-server/272x272/www.instacart.com/assets/domains/product-image/file/large_ad35184e-5436-4914-be2f-eeebd41178b5.jpg 4x, https://www.instacart.com/image-server/272x272/www.instacart.com/assets/domains/product-image/file/large_006633fd-8451-43a9-b97f-69d3b493954d.jpg 4x","• One 8 Oz package of Sweet Earth Mindful Chik'n Plant Based Pieces,• Flavor-forward, Non-GMO Project Verified plant based meat substitute is perfect for ready to eat meals you can feel good about,• Sweet Earth Mindful Chik’n strips offer 18 g of protein per serving and is a good source of iron,• Easily prepare this ready to eat plant based chicken in a skillet or microwave as part of a vegan meal,• Serve Sweet Earth plant based protein straight from the package, or add it to pasta, soups and salads,• Keep vegan protein refrigerated or frozen until you're ready to enjoy,• Sweet Earth plant based protein products move the needle towards a happier planet with ingredients that matter,• SNAP and EBT Eligible item,Choose Food That’S Good In Every Sense Of The Word With Sweet Earth Mindful Chik'N Plant Based Pieces. Made With Ingredients That Matter, This Vegan Chicken Substitute Is Ideal For Use In Place Of Traditional Fully Cooked Frozen Chicken. High In Protein And Fiber, Mindful Chik'N Strips Have 18 Grams Of Protein, 5 Grams Of Fiber And 4 Grams Of Total Fat Per Serving. Easily Prepare Sweet Earth Plant Based Fully Cooked Chicken Strips In A Skillet, Or Enjoy Them Straight From The Package. Make A Delicious Vegan Dinner By Using The Chik'N Strips As A Stir Fry Meat Substitute, Or Channel Your Inner Chef And Add Plant Based Chicken To Pasta, Soups And Salads. Keep This Fully Cooked Plant Based Chicken Refrigerated Or Frozen Until Ready To Prepare. Sweet Earth Foods Offer Exceptional Flavor And Goodness In A Variety Of Different Plant Based Protein Products And Frozen Meals, Moving The Needle Towards A Happier Planet.","Water, Soy Protein Concentrate2, Canola Oil3, Distilled Vinegar, 2% Or Less Of Yeast Extract, Seasoning (salt, Natural Flavors, Yeast Extract1, Citric Acid, Roasted Onion Powder, Onion Powder1, Sugar1), Sea Salt.","Cook Thoroughly. Cooking Instructions: This product is raw and not ready to eat until thawed and thoroughly cooked. Here's how. If purchased frozen, thaw completely in the fridge before cooking. Consume within 30 days of thawing and within 3 days of opening the inner package. If purchased refrigerated, consume by stickered Use By date and within 3 days of opening the inner package. Do not refreeze. Skillet (preferred) - Remove strips from tray. Pre-heat a lightly oiled pan over medium heat. Stir fry for about 7 min, until they reach an internal temperature of 165 degrees F. (Optional) Microwave on high for about 1 min and 30 sec in a plastic covered microwave safe dish, until they reach an internal temperature of 165 degrees F.,Perfect for: Stir fry pasta soups salads.,Keep refrigerated or frozen, my friend.",Contains: soy.,,,,,,,,,,,,
"Lightlife Deli Slices, Plant-Based, Bologna",,," https://www.instacart.com/image-server/272x272/www.instacart.com/assets/domains/product-image/file/large_a8707541-cfa3-4995-94a2-fb24caa088b2.png 4x, https://www.instacart.com/image-server/272x272/www.instacart.com/assets/domains/product-image/file/large_c46c4b77-cee8-4e3b-9e5b-bfcc6caaadc1.png 4x, https://www.instacart.com/image-server/272x272/www.instacart.com/assets/domains/product-image/file/large_bcc3fece-2726-4875-b248-c254ca027023.png 4x","Our Smart Deli Bologna slices are made with great tasting plant-based ingredients and without the higher levels of saturated fat or cholesterol found in traditional deli slices. Serve in a cold-cut sandwich or pan-fry for a plant-based favorite the whole family can enjoy! What we're made of: Water; Wheat; Soy protein; Sugarcane. Did you know? Many plant proteins, such as soy, are complete proteins comprised of essential amino acids your body needs. Plant based. Carbon zero: Made by a carbon neutral company (learn more about our commitment to carbon neutrality: Lightlife.com/carbonneutral. Paper box. Plastic wrap. how2recycle.info.","Water, Vital Wheat Gluten, Soy Protein Isolate, Salt, Evaporated Cane Syrup, Less Than 2% Of: Natural Flavor (from Plant Sources), Calcium Carbonate, Carrageenan, Dried Garlic, Xanthan Gum, Fermented Rice Flour, Guar Gum, Oleoresin Paprika (color), Natural Smoke Flavor (from Plant Sources).",For Food Safety: Keep refrigerated. Use or freeze within 3-5 days of opening.,"Contains: wheat, soy.",,,,,,,,,,,,
"Actual Veggies Veggie Burger, with Purple Sweet Potato, Purple Carrot & Beet, Purple Roots",,," https://www.instacart.com/image-server/272x272/www.instacart.com/assets/domains/product-image/file/large_a374fa71-6d44-41c5-9008-3694f5b45df6.png 4x, https://www.instacart.com/image-server/272x272/www.instacart.com/assets/domains/product-image/file/large_c96a3a7e-6bce-4122-8417-e318ad041d9f.png 4x, https://www.instacart.com/image-server/272x272/www.instacart.com/assets/domains/product-image/file/large_b3c9d824-70ec-45e8-b461-cd13864f8b84.png 4x",,"White Bean, Carrot, Purple Sweet Potato, Beet, Potato, Onion, Oat, White Quinoa, Cannellini Bean, Red Onion, Potato Starch, Chickpea Flour, Apple Cider Vinegar, Ovata Seed, Purple Carrot, Spice Blend (kosher Salt, Garlic Powder, Roasted Onion Powder, Black Pepper, Dill)","Safe Handling Instructions: This product was prepared from inspected and passed meat and/or poultry. Some food products may contain bacteria that could cause illness if the product is mishandled or cooked improperly. For your protection, follow these safe handling instructions. Keep refrigerated or frozen. Thaw in refrigerator or microwave. Keep raw meat and poultry separate from other foods. Wash working surfaces (including cutting boards), utensils and hands after touching raw meat or poultry. Cook thoroughly. Keep hot foods hot. Refrigerate leftovers immediately or discard.,Recommended Cooking Instructions: Skillet or Grill: Pre-heat non-stick pan or grill with a light amount of oil over medium to high heat and cook each side for 5-6 minutes. Air-Fryer: Pre-heat to 400 degrees and cook each side for 6-7 minutes. Oven: Pre-heat oven to 425 degrees and cook for 14-15 minutes.,Keep frozen.","Safe handling instructions:,some raw products may contain bacteria that can cause illness if mishandled, or cooked improperly.,keep refrigerated or frozen. Thaw in refrigerator.,keep raw product separate from other foods. Wash working surfaces (including cutting boards), utensils, and hands after touching raw product.,cook thoroughly to an internal temperature of 165°.,keep hot foods hot. Refrigerate leftovers or discard.",,,,,,,,,,,,
"Lightlife Deli Slices, Plant-Based, Ham",,," https://www.instacart.com/image-server/272x272/www.instacart.com/assets/domains/product-image/file/large_aa0addfc-6550-4cd1-9738-7d62286710fe.png 4x, https://www.instacart.com/image-server/272x272/www.instacart.com/assets/domains/product-image/file/large_a32cdaf3-4196-41fc-aab1-4b96f9008631.png 4x, https://www.instacart.com/image-server/272x272/www.instacart.com/assets/domains/product-image/file/large_06d33c5e-9b4a-4f16-b3d1-93804af26dec.png 4x, https://www.instacart.com/image-server/272x272/www.instacart.com/assets/domains/product-image/file/large_324e4737-65c0-4fd5-814f-5ea87fc410de.png 4x",Ingredients you know and taste you'll love. Our Smart Deli ham slices are made with great tasting plant-based ingredients and without the higher levels of saturated fat or cholesterol found in a sandwich served cold or panini pressed for a delicious meal you can feel great about. What we're made of: Water; Wheat; Soy protein; Sugarcane. Carbon zero: Made by a carbon neutral company (learn more about our commitment to carbon neutrality: Lightlife.com/carbonneutral.) Paper box. Plastic wrap.,"Water, Vital Wheat Gluten, Soy Protein Isolate, Evaporated Cane Syrup, Less Than 2% Of: Natural Flavor (from Plant Sources), Tapioca Starch, Bakers Yeast Extract, Sea Salt, Salt, Carrageenan, Natural Smoke Flavor (from Plant Sources), Fermented Rice Flour, Oleoresin Paprika (color).",For Food Safety: Keep refrigerated. Use or freeze within 3-5 days of opening.,"Contains: wheat, soy.",,,,,,,,,,,,
Sprouts Organic Extra Firm Tofu,,$2.49, https://www.instacart.com/image-server/272x272/www.instacart.com/assets/domains/product-image/file/large_cc6edd69-04fa-4d71-bfc6-33517711f0cf.png 4x,,"WATER, ORGANIC SOYBEANS, CONTAINS LESS THAN 2% OF CALCIUM SULFATE, MAGNESIUM CHLORIDE.",,,Gluten Free,,,,,,,,,,,
Sprouts Organic Firm Tofu,,$2.49, https://www.instacart.com/image-server/272x272/www.instacart.com/assets/domains/product-image/file/large_beaac16c-8e8a-468d-bbf9-dda0ec05e09a.png 4x,,"Filtered Water, Organic Soybeans, Calcium Sulfate, Glucono Delta Lactone, Nigari (magnesium Chloride).",,Contains: soy,Gluten Free,,,,,,,,,,,
"Tofurky Tempeh, Smoky Maple Bacon, Treehouse",,$5.59," https://www.instacart.com/image-server/272x272/www.instacart.com/assets/domains/product-image/file/large_aa2ed254-5e97-4a0e-97e2-3ea57797ef9a.png 4x, https://www.instacart.com/image-server/272x272/www.instacart.com/assets/domains/product-image/file/large_f3c2052f-7902-4d33-af9e-7bcd24597ba0.png 4x, https://www.instacart.com/image-server/272x272/www.instacart.com/assets/domains/product-image/file/large_f8491a95-9e17-4d3c-8ae5-f9736391f4c0.png 4x","Tofurky® Tempeh Marinated Strips Smokey Maple Bacon.,Made with organic soybeans.,Vegan.,Family owned & independent since 1980.","Organic Soybeans, Water, Shoyu Soy Sauce (water, Non-gmo Soybeans, Wheat, Salt, Culture), Molasses, Maple Syrup, Natural Smoke Flavor, Autolyzed Yeast Extract, Salt, Organic Apple Cider Vinegar, Starter Culture (rhizopus Oligosporus).","How to Cook: On a stovetop, heat 1 to 2 tbsp oil in pan (cast iron is best). Add tempeh strips to hot oil and cook 1 1/2 to 2 min. each side until nicely browned, or 160 degrees.,Keep refrigerated. Ok to freeze.","Contains: soy, wheat.",,,,,,,,,,,,
