On The Rocks EFFEN Espresso Martini,,$18.19," https://www.instacart.com/image-server/272x272/www.instacart.com/assets/domains/product-image/file/large_b37609e7-2563-4e77-9836-e59a5d1a36c2.png 4x, https://www.instacart.com/image-server/272x272/www.instacart.com/assets/domains/product-image/file/large_948f1447-9820-44eb-983d-d3b8d2bbfa74.png 4x, https://www.instacart.com/image-server/272x272/www.instacart.com/assets/domains/product-image/file/large_308bbc98-f077-4c96-8ff2-7fd93f76686f.png 4x, https://www.instacart.com/image-server/272x272/www.instacart.com/assets/domains/product-image/file/large_d13cefd5-ff43-45d4-97f2-1bb6986602a5.png 4x",,,"Taste the modern twist on a classic with On The Rocks, OTR Espresso Martini Ready to Drink Cocktail. On The Rocks carefully crafts cocktails that make the moment. On the sofa, at your hotel, after the slopes, this rich Espresso Martini is ready to pour over ice and enjoy. Developed by mixologists, On The Rocks cocktails bring the bar to you with premium spirits and pure creativity. A little dark and a little daring, this Espresso Martini is crafted with ultra smooth EFFEN Vodka and espresso coffee liqueur. Just pour over ice for effortless enjoyment, whether you’re sitting by the fire or cooking dinner with friends. Garnish with a coffee bean to elevate the evening. Each bottle contains 20% alcohol by volume and should be enjoyed responsibly. OTR delivers the bar wherever you are. Just open, pour over ice and enjoy.,• Smooth EFFEN vodka intertwined with rich espresso coffee liqueur make this OTR cocktail a happy hour favorite,• OTR provides a dark and daring cocktail to wake up the evening,• OTR craft cocktails made with the complexity and craftsmanship of the bar—but without the need for special ingredients or equipment,• OTR ready to drink cocktails are crafted carefully to enjoy effortlessly, whether you’re hosting a party or sitting on your patio,• OTR cocktails bring the bar to you with mixologist-crafted drinks that blend premium spirits and natural flavors,• Contains 20% alcohol by volume: Just open, pour over ice and enjoy",{},,,,
Jose Cuervo Authentic Margarita Classic Lime Light Cocktail,$18.59,$25.19," https://www.instacart.com/image-server/272x272/www.instacart.com/assets/domains/product-image/file/large_fd80cd2e-b3d0-4e63-865f-63a97272bdc3.jpg 4x, https://www.instacart.com/image-server/272x272/www.instacart.com/assets/domains/product-image/file/large_41982876-337b-462c-8a7e-9a5f32fe713d.jpg 4x, https://www.instacart.com/image-server/272x272/www.instacart.com/assets/domains/product-image/file/large_dfaa00d3-01bc-4be9-884d-2fa9966df7e2.jpg 4x, https://www.instacart.com/image-server/272x272/www.instacart.com/assets/domains/product-image/file/large_6493823c-45b3-4851-8ed9-8c104a6fae8a.jpg 4x",,,"The world’s #1 ready-to-serve margaritas come in many classic, fruity and fun flavors. America’s Favorite Ready-to-Drink Margarita, Authentic Cuervo® Margaritas are made exclusively with Jose Cuervo® tequila. The leading brand also offers Cuervo® Light Margaritas with the same great taste as the original, but with fewer calories per serving. All of the flavor, none of the guilt!",Refrigerate after opening.,"GOVERNMENT WARNING: (1) According to the Surgeon General, women should not drink alcoholic beverages during pregnancy because of the risk of birth defects. (2) Consumption of alcoholic beverages impairs your ability to drive a car or operate machinery, and may cause health problems.",Contains FD&C Yellow 5.,,
Jameson Black Barrel Irish Whiskey,$46.29,$66.19," https://www.instacart.com/image-server/272x272/www.instacart.com/assets/domains/product-image/file/large_e1297fe6-ae9e-47ce-a8e1-8645656e460e.jpg 4x, https://www.instacart.com/image-server/272x272/www.instacart.com/assets/domains/product-image/file/large_94d390ac-99a0-4b63-88bd-27e6f749ec53.jpg 4x, https://www.instacart.com/image-server/272x272/www.instacart.com/assets/domains/product-image/file/large_8fe2adb5-096a-4cc1-ae32-554b76939f48.jpg 4x, https://www.instacart.com/image-server/272x272/www.instacart.com/assets/domains/product-image/file/large_8d582dff-2c7d-486e-9d68-d43ebe04b7c4.jpg 4x",,,"Jameson Black Barrel Irish Whiskey delivers the smooth taste of triple-distilled Jameson Irish Whiskey with intense vanilla and caramel flavor notes to your favorite cocktails. Jameson uses carefully selected ingredients like locally sourced barley from Ireland and water from the Dungourney River that flows right through its distillery. To achieve a signature smoothness, it's made with triple distilled Jameson Whiskey. This tradition began in 1780 and we continue this legacy. Next, it's aged in double-charred barrels to achieve a classic Irish whiskey taste with intense aromas of butterscotch, fudge and toffee. This one-of-a-kind Black Barrel whiskey showcases the perfect balance of spicy, nutty and vanilla undertones; a delicate, smooth and full mouthfeel with distinctive spice notes; and a rich and intense finish with toasted wood and vanilla. Enjoy this liquor neat, on the rocks, or in cocktails like a Whiskey Sour or Old Fashioned cocktail. You’ll taste the care and craftsmanship Jameson puts into its whiskeys from grain to glass, so live “without fear” or “Sine Metu,” as it proudly says on the label. Drink responsibly.,BLACK BARREL IRISH WHISKEY: The smooth taste of triple-distilled Jameson Irish Whiskey, perfectly balanced with an intense vanilla flavor,INCLUDES: One 750 mL bottle of Jameson Black Barrel Irish Whiskey; 80 proof or 40% alcohol by volume; Drink responsibly,SERVE IT YOUR WAY: Enjoy this alcohol neat, on the rocks, or in alcohol drinks like a Whiskey Sour,FLAVOR AND AROMA: Subtly sweet with spicy, nutty, vanilla undertones with a rich toasted wood and vanilla finish, and butterscotch, fudge and toffee aromas,SIGNATURE DISTILLATION PROCESS: This Jameson Whiskey is triple distilled for its signature smoothness",Enjoy Jameson Black Barrel neat or on the rocks or in cocktail such as the Jameson Black Barrel Old Fashioned.,"Government Warning: (1) According to the Surgeon General, women should not drink alcoholic beverages during pregnancy because of the risk of birth defects. (2) Consumption of alcoholic beverages impairs your ability to drive a car or operate machinery, and may cause health problems.","Water, barley and maize.",,
Tullamore D.E.W. Irish Whiskey,$29.09,$35.69, https://www.instacart.com/image-server/272x272/www.instacart.com/assets/domains/product-image/file/large_deb8462c-b04e-4b05-8aa0-64f7bb4c7ffd.jpeg 4x,,,"Tullamore D.E.W. is the legendary original triple blended Irish Whiskey. It is a blend of all three styles of Irish Whiskey, giving it a balance of flavor like no other in the category. Grain whiskey gives a sweetness, malt brings the fruitiness and pot-still gives the blend that iconic Irish Whiskey spice. Tully is triple distilled making it exceptionally smooth and triple cask matured, giving it a great depth of flavor.,Best enjoyed on the rocks, in a cocktail, or however you please!,Tullamore D.E.W. triple distilled Irish Whiskey is crafted in our state-of-the-art Tullamore Distillery which brought whiskey production back to the village of Tullamore, Ireland, where it was originally made in 1829.,D. E. W. are the initials of Daniel Edmund Williams who was our General Manager and one of the greatest distillers Ireland has ever had, whom we honor on every bottle.,Glasses up to responsible drinking!,• The original triple blend Irish whiskey with a smooth and gentle complexity,• Nose: A mild blend of spicy, lemony and malty notes, with charred wood and vanilla undertones.,• Palate: Warming, pleasant maltiness with toasted wood and vanilla hints.,• Finish: Smooth and gentle, the complex flavors lingering.",{},"Government warning: (1) According to the surgeon general, women should not drink alcoholic beverages during pregnancy because of the risk of birth defects. (2) Consumption of alcoholic beverages impairs your ability to drive a car or operate machinery, and may cause health problems.","Golden Grain, Pot Still and Malt.",,
E&J VSOP Brandy,$17.19,$19.89," https://www.instacart.com/image-server/272x272/www.instacart.com/assets/domains/product-image/file/large_acb7aecd-7266-484a-a4e2-82e0a765d011.png 4x, https://www.instacart.com/image-server/272x272/www.instacart.com/assets/domains/product-image/file/large_9950b859-08ff-4f55-bb88-30345342ea57.png 4x, https://www.instacart.com/image-server/272x272/www.instacart.com/assets/domains/product-image/file/large_c0d97bb8-e8b5-42d4-84c0-b309ff7d74c7.png 4x, https://www.instacart.com/image-server/272x272/www.instacart.com/assets/domains/product-image/file/large_552f96a8-6cdc-4cd9-bcd2-4fe320f0883c.png 4x",,,"E&J VSOP Brandy is blended for peak richness, full flavor and a satisfying smooth finish. Distinct vanilla, apple and berry notes, rounded out with hints of toasted oak from barrel aging, bring classic authenticity to this premium VSOP brandy. Perfect for sipping straight or in mixed drinks, enjoy E&J VSOP Brandy over ice, or in simple cocktails. Since 1938, E&J Brandy has perfected its craft to bring the best brandy to market and become America's most award winning brandy.,• One 750 mL bottle of E&J VSOP Brandy,• Distinct vanilla, apple and berry notes rounded out with hints of toasted oak,• Aged in oak barrels for a smooth finish,• Enjoy straight up or mixed into a favorite cocktail,• America's most award winning brandy,• Gold medal and best of show awards at some of the world's most prestigious spirits competitions,• Screw cap for easy opening and secure closure,• Glass bottle that is 100% recyclable",{},"GOVERNMENT WARNING: (1) According to the Surgeon General, women should not drink alcoholic beverages during pregnancy because of the risk of birth defects. (2) Consumption of alcoholic beverages impairs your ability to drive a car or operate machinery, and may cause health problems.",,,
BuzzBallz Peach Chiller,,," https://www.instacart.com/image-server/272x272/www.instacart.com/assets/domains/product-image/file/large_d81106e8-bcc6-4b3b-8a4f-712c3b37d560.jpg 4x, https://www.instacart.com/image-server/272x272/www.instacart.com/assets/domains/product-image/file/large_45191e9e-7aba-4485-a21a-b55d5252ef41.jpg 4x, https://www.instacart.com/image-server/272x272/www.instacart.com/assets/domains/product-image/file/large_8c2af51b-1f7d-4053-aa80-498cd936f220.jpg 4x",,,Have a ball. Please drink responsibly. Go Texan. Women owned.,Shake well.,Contains sulfites,Contains FD&C Yellow #6.,,
Ketel One Botanical Peach & Orange Blossom Vodka Distilled With Real Botanicals And Infused With Natural Flavors,$26.49,$40.99," https://www.instacart.com/image-server/272x272/www.instacart.com/assets/domains/product-image/file/large_18aeb03c-3e90-4c55-883a-c56c0c101f4e.jpg 4x, https://www.instacart.com/image-server/272x272/www.instacart.com/assets/domains/product-image/file/large_ed66914d-ac3e-40ee-88e8-622c79568e69.jpg 4x",,,"Ketel One Botanical Peach & Orange Blossom Vodka is meticulously crafted using non-GMO grain and features notes of lush, juicy white peaches and bold notes of fragrant orange blossoms. Perfect for any vodka soda.",No artificial flavors or sweeteners*,"GOVERNMENT WARNING: (1) According to the Surgeon General, women should not drink alcoholic beverages during pregnancy because of the risk of birth defects. (2) Consumption of alcoholic beverages impairs your ability to drive a car or operate machinery, and may cause health problems.",,,
Rancho La Gloria Strawberry Margarita,,$15.99, https://www.instacart.com/image-server/272x272/www.instacart.com/assets/domains/product-image/file/large_8be93986-31e0-4283-8282-086e3676e649.jpg 4x,Gluten Free,,"Crafted with fresh lime, ripe strawberry juice and agave wine, this refreshing margarita is a convenient cocktail for barbecues and beach days. Pour over ice or enjoy right out of the bottle for a perfectly tasty warm-weather libation.",Refrigerate after opening.,"Contains sulfites., Government Warning: (1) According to the Surgeon General, women should not drink alcoholic beverages during pregnancy because of the risk of birth defects. (2) Consumption of alcoholic beverages impairs your ability to drive a car or operate machinery, and may cause health problems.","Made with 100% De Agave Wine and natural flavors,13.9% ABV",,
"Toki Suntory Whisky, Japan, 750 ml",,$33.99, https://www.instacart.com/image-server/272x272/www.instacart.com/assets/domains/product-image/file/large_3a8b41b9-474b-431b-a722-35e97c2b09df.jpeg 4x,,,"Toki means 'time', and this silky-smooth whisky lets you savor the moment where old meets new Japan. Heritage techniques are met with an innovative modern touch to create a subtly sweet Japanese whisky with a spicy finish. It's as vivid as it is innovative.,It has fresh and herbaceous aromas of crisp green apple and basil, with each sip bringing notes of peppermint and thyme, grapefruit and green grapes. It's a wonderful way to make the classic highball cocktail by filling a glass to the brim with ice and gently pouring over Toki whisky. Top up with three measures of chilled sparkling water, poured gently along the side of the glass to avoid melting the ice or bursting the bubbles. Alternatively, sip it neat or over ice in your favorite crystal rocks glass. The Japanese respect for tradition and innovation can be seen in the unique way this whisky is made. It's a blend of a trio of whiskies from three renowned distilleries: Hakushu, Chita and Yamazaki. Mastered by Japanese craftsmanship, Toki is an innovative blend of Suntory Whisky. Pinpointing the moment where old and new Japan meet, this whisky will transport you through time. Each drop is presented in a sleek, modern bottle which makes a striking addition to any liquor cabinet.,• Vivid blend of whiskies from Hakushu, Yamazaki and Chita distilleries,• Innovative blend of Japanese grain and malt whiskies,• Silky smooth with a subtle sweet and spicy finish,• Tastes of grapefruit, green grapes, peppermint and thyme,• Old meets new Japan, where tradition is reinvented",{},"Government warning: (1) according to the surgeon general, women should not drink alcoholic beverages during pregnancy because of the risk of birth defects. (2) consumption of alcoholic beverages impairs your ability to drive a car or operate machinery, and may cause health problems.",,,
On The Rocks EFFEN Cosmopolitan,$13.29,$17.19," https://www.instacart.com/image-server/272x272/www.instacart.com/assets/domains/product-image/file/large_7dad3367-c0aa-4f74-b128-a180d3cf9ce4.png 4x, https://www.instacart.com/image-server/272x272/www.instacart.com/assets/domains/product-image/file/large_0c504773-46c8-4729-b4dc-000cb7c3988c.png 4x, https://www.instacart.com/image-server/272x272/www.instacart.com/assets/domains/product-image/file/large_e87d37a2-2c36-4917-b5ce-05ce043a3881.png 4x, https://www.instacart.com/image-server/272x272/www.instacart.com/assets/domains/product-image/file/large_725e8c79-7fc7-4a3a-869d-5153a62c6cb0.png 4x",,,"Taste the modern twist on a classic with On The Rocks, OTR Cosmopolitan Ready to Drink Cocktail. On The Rocks carefully crafts cocktails that make the moment. On the sofa, by the pool, at a festival, this Cosmo is ready to pour over ice and enjoy. Developed by mixologists, On The Rocks cocktails bring the bar to you with premium spirits and pure creativity. This iconic recipe is Cosmopolitan by name and nature, combining the refreshingly tart hint of cranberry, lemon and lime flavor, with the orange sweetness of Triple Sec. All cut through with crystal-clear EFFEN Vodka. Just pour over ice for effortless enjoyment, whether you’re flying back home or finishing the 9-to-5. Garnish with a lemon peel to elevate the evening. Each bottle contains 20% alcohol by volume and should be enjoyed responsibly. OTR delivers the bar wherever you are. Just open, pour over ice and enjoy.,• Smooth EFFEN vodka blended with the sweet-tart flavors of cranberry, triple sec, lemon and lime flavor make this OTR cocktail a happy hour favorite,• OTR provides a modern twist on the wildly popular pink cocktail with a simple recipe and a big history,• OTR craft cocktails made with the complexity and craftsmanship of the bar—but without the need for special ingredients or equipment,• OTR ready to drink cocktails are crafted carefully to enjoy effortlessly, whether you’re hosting a party or sitting on your patio,• OTR cocktails bring the bar to you with mixologist-crafted drinks that blend premium spirits and natural flavors,• Contains 20% alcohol by volume: Just open, pour over ice and enjoy",{},"Government Warning: (1) According to the Surgeon General, women should not drink alcoholic beverages during pregnancy because of the risk of birth defects. (2) Consumption of alcoholic beverages impairs your ability to drive a car or operate machinery, and may cause health problems.",,,
Sauza Hacienda Gold Tequila,$18.59,$23.79," https://www.instacart.com/image-server/272x272/www.instacart.com/assets/domains/product-image/file/large_cd516ea0-c1b7-478a-a2e2-92aacd6ffa48.png 4x, https://www.instacart.com/image-server/272x272/www.instacart.com/assets/domains/product-image/file/large_e23a5756-ac1d-4d5a-ab93-74df1abd23ac.png 4x, https://www.instacart.com/image-server/272x272/www.instacart.com/assets/domains/product-image/file/large_5656363d-f1a0-4741-836a-f5d13e2b78a5.png 4x, https://www.instacart.com/image-server/272x272/www.instacart.com/assets/domains/product-image/file/large_9099bccb-92cc-4b63-982d-01700cb02c0b.png 4x",,,"Finely crafted at one of Jalisco's best-known distilleries, our Sauza Hacienda Gold takes tequila to a new level. It's sparkling gold in color and brings notes of sweet caramel and vanilla to the characteristic fresh blue agave flavor. Versatile enough to drink as a shot, it also makes the perfect secret ingredient in a cocktail. Mix with lime juice, orange juice, triple sec and agave nectar to create a Sauza citrus margarita to impress your friends.,The soul of any tequila is in its agave flavor, and Sauza Hacienda Gold has plenty of it. The special extraction process helps keep the taste of the blue agave pure, fresh and crisp. After extraction, it's distilled twice in copper pot stills. This keeps the full agave flavor at the forefront. Finally, for this Gold edition, the spirit is aged in barrels to add its shimmering golden color and soft caramel flavor.,As well as being at the forefront of tequila, Sauza has been a true champion of Mexican culture and its people since 1873. This is a distillery of ""firsts"". It was one of the first to put the name ""tequila"" on a bottle, and one of the first to export the spirit. Today, Sauza is proud to be a fresh take on tequila that everyone can enjoy, and welcomes everyone like they are part of the family. So, raise a glass to the three dons – Don Francisco Javier, Don Cenobio and Don Eladio – and celebrate the spirit of revolution and the spirit of connection,• A pioneering tequila from the Casa Sauza distillery,• Golden color with a sparkling brightness,• Double-distilled in copper stills to preserve natural Agave flavor,• Flavors of fresh blue agave, sweet caramel and balanced pepper,• Finely crafted in Jalisco, Mexico, for over 145 years",{},"Government Warning: (1) According to the Surgeon General, women should not drink alcoholic beverages during pregnancy because of the risk of birth defects. (2) Consumption of alcoholic beverages impairs your ability to drive a car or operate machinery, and may cause health problems.",Gold Tequila.,,
"Bacardí® Superior White Rum, Gluten Free",,$13.49," https://www.instacart.com/image-server/272x272/www.instacart.com/assets/domains/product-image/file/large_1c8a6298-6871-4572-94eb-9f892935cb8d.png 4x, https://www.instacart.com/image-server/272x272/www.instacart.com/assets/domains/product-image/file/large_053c9418-8ff4-4683-b370-0ee817a456dd.jpg 4x, https://www.instacart.com/image-server/272x272/www.instacart.com/assets/domains/product-image/file/large_dd2883f0-a3c9-4da0-8b37-3eadf3c97c8f.png 4x, https://www.instacart.com/image-server/272x272/www.instacart.com/assets/domains/product-image/file/large_fab0d9ba-c0d6-4b68-a6f4-84d6c4e40db7.png 4x",Gluten Free,,"BACARDI Superior is the perfect white rum that you can casually sip or mix into any number of cocktails to liven up the party. This BACARDI white rum liquor is aged in American white oak barrels and shaped through a secret blend of charcoal for a distinctive smoothness that makes it easy to have fun. This superior BACARDI Rum alcohol is a light and aromatically balanced aged rum that is 80 proof and offers an aroma of almonds and fruit with a smooth and creamy flavor and a dry, clean, fresh finish. When you are out with your friends enjoying the moment, use BACARDI Superior Rum as a drink mixer with a number of tropical cocktails or alcohol drinks such as a Mojito, frozen Daiquiri, Rum and Cola, Pina Colada, or even a Rum Punch. BACARDI is the oldest and largest family-owned rum in the world.,• One 750 mL bottle of BACARDI Superior White Rum,• Aged in American white oak barrels and shaped through a secret blend of charcoal for a distinctive smoothness,• This BACARDI rum offers a smooth and creamy flavor that’s easy to mix and simple to enjoy,• White rum that delivers an aroma of almonds and fruit with a dry, clean, fresh finish that’s as crisp as it is exciting,• Mix this rum into a delicious cocktail like a Mojito, frozen Daiquiri, Rum and Cola, Pina Colada, or even a Rum Punch",{},"WARNING: Drinking distilled spirits, beer, coolers, wine and other alcoholic beverages may increase cancer risk, and, during pregnancy, can cause birth defects. For more information go to www.P65Warnings.ca.gov/alcohol.",,,
New Amsterdam 80 PR Gin,$18.59,$19.89, https://www.instacart.com/image-server/272x272/www.instacart.com/assets/domains/product-image/file/large_4d4c3777-e603-439f-a785-63b271371adb.jpeg 4x,,,"New Amsterdam Gin is uniquely distilled with flavors of orange, lime, vanilla, and a hint of traditional juniper and anise. With a smooth finish, this versatile classic can be enjoyed straight, or as a part of classic cocktails, such as gin and tonic or a martini. This award winning dry gin has received 95 Points from The Tasting Panel, 2017. New Amsterdam Gin is a modern take on the 400-year tradition.,• One 750 mL bottle of New Amsterdam Gin,• Features hints of traditional juniper and anise and a smooth finish,• Uniquely distilled with notes of orange, lime and vanilla,• Smooth enough to be enjoyed straight, mixed in a cocktail or in a classic gin martini,• 95 Points, The Tasting Panel Magazine 2017",,"Government Warning: (1) According to the Surgeon General, women should not drink alcoholic beverages during pregnancy because of the risk of birth defects. (2) Consumption of alcoholic beverages impairs your ability to drive a car or operate machinery, and may cause health problems.",,,
Captain Morgan Original Spiced Rum (Made with Real Madagascar Vanilla),,$28.99," https://www.instacart.com/image-server/272x272/www.instacart.com/assets/domains/product-image/file/large_de497dc6-8a95-476d-ba8c-9628671ff91a.jpg 4x, https://www.instacart.com/image-server/272x272/www.instacart.com/assets/domains/product-image/file/large_99f23e71-c226-41b5-a31b-d77acafbe6c9.jpg 4x",Gluten Free,,"Spice up the flavor with our exquisite Captain Morgan Original Spiced Rum. It’s an exceptional blend of Caribbean rum, natural flavors and spice, with notes of cinnamon, clove, and spice.","Made with Caribbean rum, natural flavors and spice, with notes of cinnamon, clove, and spice","GOVERNMENT WARNING: (1) According to the Surgeon General, women should not drink alcoholic beverages during pregnancy because of the risk of birth defects. (2) Consumption of alcoholic beverages impairs your ability to drive a car or operate machinery, and may cause health problems.",,,
Bulleit Bourbon Whiskey,$59.59,$96.59," https://www.instacart.com/image-server/272x272/www.instacart.com/assets/domains/product-image/file/large_8a33e541-5209-4ae7-8242-78293b71508d.jpg 4x, https://www.instacart.com/image-server/272x272/www.instacart.com/assets/domains/product-image/file/large_a0bc3d9b-645c-48ee-bb9c-418a98bebe07.jpg 4x",,,"Bulleit Bourbon Whiskey has hints of maple, oak, and nutmeg. Simply serve neat or on the rocks. It was awarded a Gold Medal in 2021 at the San Francisco World Spirits Competition.","Simply combine our bourbon whiskey with cloves, lemon juice, brown sugar and hot water for a comforting Hot Toddy","GOVERNMENT WARNING: (1) According to the Surgeon General, women should not drink alcoholic beverages during pregnancy because of the risk of birth defects. (2) Consumption of alcoholic beverages impairs your ability to drive a car or operate machinery, and may cause health problems.",,,
Ketel One Botanical Grapefruit & Rose Vodka Distilled With Real Botanicals And Infused With Natural Flavors,$26.49,$40.99," https://www.instacart.com/image-server/272x272/www.instacart.com/assets/domains/product-image/file/large_7d53ad0f-dff5-453d-9a5b-d675da3a2d1a.jpg 4x, https://www.instacart.com/image-server/272x272/www.instacart.com/assets/domains/product-image/file/large_86edd383-5933-4a64-934f-9bfe130f0fc4.jpg 4x",,,"Ketel One Botanical Grapefruit & Rose Vodka is meticulously crafted using non-GMO grain and features notes of zesty, mouthwatering grapefruit. Perfect for any vodka soda.",No artificial flavors or sweeteners*,"GOVERNMENT WARNING: (1) According to the Surgeon General, women should not drink alcoholic beverages during pregnancy because of the risk of birth defects. (2) Consumption of alcoholic beverages impairs your ability to drive a car or operate machinery, and may cause health problems.",,,
