Rancho La Gloria Strawberry Margarita,,, https://www.instacart.com/image-server/272x272/www.instacart.com/assets/domains/product-image/file/large_3f093737-4c3b-4626-bfb9-1aaa0069b2c7.jpg 4x,,,"Crafted with fresh lime, ripe strawberry juice and agave wine, this refreshing margarita is a convenient cocktail for barbecues and beach days. Pour over ice or enjoy right out of the bottle for a perfectly tasty warm-weather libation.",Refrigerate after opening.,"Contains sulfites. Government Warning: (1) According to the surgeon general, women should not drink alcoholic beverages during pregnancy because of the risk of birth defects. (2) Consumption of alcoholic beverages impairs your ability to drive a car or operate machinery, and may cause health problems.","Made with 100% De Agave Wine and natural flavors,13.9% ABV",,
Elijah Craig 94PR Kentucky Straight Bourbon Whiskey,$38.39,$44.99," https://www.instacart.com/image-server/272x272/www.instacart.com/assets/domains/product-image/file/large_bc9a45c3-c770-49e0-bf31-7f3f310b1022.jpg 4x, https://www.instacart.com/image-server/272x272/www.instacart.com/assets/domains/product-image/file/large_a489e8c1-2e7c-41d6-b740-99c009a52076.jpg 4x",,,"Discover the Greatness Within with Elijah Craig Small Batch Kentucky Straight Bourbon Whiskey. It's distilled, aged and bottled in Kentucky. Each Small Batch of Bourbon is made from a mingling of 8 to 12-year-old barrels and is bottled at 94 proof. Ideal for easy summer cocktails like Whiskey, Tea and Lemonade or a Mint Julep. Elijah Craig Small Batch Bourbon has a 47% alcohol by volume.",{},Must be over 21 to drink.,,,
Don Julio Anejo Tequila,$80.69,$103.19, https://www.instacart.com/image-server/272x272/www.instacart.com/assets/domains/product-image/file/large_a2aabcda-dbe1-463f-addd-ed86d10a388e.jpg 4x,,,"Crafted from blue Weber agave and aged 18 months in American white-oak, Don Julio Anejo Tequila offers a smooth, rich flavor with caramel and vanilla notes. Enjoy neat, on the rocks, or in cocktails. A perfect tequila gift showcasing Mexican craftsmanship.","This premium, aged tequila is a true expression of luxury, perfect for sipping neat, on the rocks, or in an unforgettable cocktail","GOVERNMENT WARNING: (1) According to the Surgeon General, women should not drink alcoholic beverages during pregnancy because of the risk of birth defects. (2) Consumption of alcoholic beverages impairs your ability to drive a car or operate machinery, and may cause health problems.",,,
Cutwater Ginger Beer & Lime Flavor Vodka Mule 4 Pack 12 fl oz Cans,$15.89,$22.49," https://www.instacart.com/image-server/272x272/www.instacart.com/assets/domains/product-image/file/large_0198c7c2-bdfd-41f0-bfdc-f235bb862bc0.jpg 4x, https://www.instacart.com/image-server/272x272/www.instacart.com/assets/domains/product-image/file/large_3559ec0e-cc42-47da-a2d2-f905a9ddfb93.jpg 4x, https://www.instacart.com/image-server/272x272/www.instacart.com/assets/domains/product-image/file/large_765b250a-b53d-404a-971a-134de713f4e4.jpg 4x, https://www.instacart.com/image-server/272x272/www.instacart.com/assets/domains/product-image/file/large_040b57f7-8593-4eb3-8d2f-688f69fb2438.jpg 4x",Gluten Free,,"Get ready to elevate your canned cocktail experience with Cutwater Vodka Mule. This bar-quality canned cocktail is made with real award-winning vodka and it's the perfect choice for any occasion. At 7% Alc / Vol , you can enjoy the sweet, spicy flavor of the vodka and ginger beer with just the right amount of flavor. As you take your first sip, you'll be hit by a blend of flavors that tantalize the taste buds. Whether it's a summer day at the beach or an evening full of friends and laughter, this ready to drink vodka mule cocktail is perfect. But what really sets Cutwater Vodka Mule apart from others is that it’s gluten-free! Cutwater Vodka Mule will always be there to provide a refreshingly smooth bar-quality cocktail experience that won't disappoint - grab a Cutwater Vodka Mule and let yourself enjoy!",Chill or drink on ice.,"GOVERNMENT WARNING: (1) According to the Surgeon General, women should not drink alcoholic beverages during pregnancy because of the risk of birth defects. (2) Consumption of alcoholic beverages impairs your ability to drive a car or operate machinery, and may cause health problems.",Made with 1+ shots real vodka.,,
Jack Daniel's Tennessee Fire,,$20.99," https://www.instacart.com/image-server/272x272/www.instacart.com/assets/domains/product-image/file/large_2d63e5f3-5474-46b1-997c-7b2feca056fe.jpg 4x, https://www.instacart.com/image-server/272x272/www.instacart.com/assets/domains/product-image/file/large_dfea3853-b994-4b27-9383-8efda86cfc59.jpg 4x, https://www.instacart.com/image-server/272x272/www.instacart.com/assets/domains/product-image/file/large_dfaca8e1-f0b0-410e-8b3b-150b703f55f4.jpg 4x, https://www.instacart.com/image-server/272x272/www.instacart.com/assets/domains/product-image/file/large_f235306a-b9fa-4226-bf46-821eb1456a40.jpg 4x",,,"Jack Daniel's Tennessee Fire is a blend of Jack Daniel’s Tennessee Whiskey and cinnamon liqueur, creating a taste that’s one-of-a-kind and unmistakably Jack. The blend of Jack Daniel's Tennessee Whiskey mixed with a unique cinnamon liqueur delivers a surprisingly smooth finish with a cinnamon spice flavor. Try Jack Daniel's Tennessee Fire in cocktails and mixed drinks, drink it as a chilled shot, or pair this alcohol liquor with a cool pint of hard cider for a balance of flavors. This whiskey is perfect for sharing with friends or enjoying during a relaxing night at home. With hints of cinnamon and the bold character of Jack, Jack Daniel’s Tennessee Fire offers a taste that's unexpected. Please Drink Responsibly.",Jack Daniel’s Tennessee Fire is best enjoyed as a chilled shot.,Please drink responsibly,,,
Crown Royal Vanilla Flavored Whisky,$31.79,$40.99," https://www.instacart.com/image-server/272x272/www.instacart.com/assets/domains/product-image/file/large_1a4b04b4-9020-46fb-83bd-755428cbb14d.jpg 4x, https://www.instacart.com/image-server/272x272/www.instacart.com/assets/domains/product-image/file/large_9ac7b891-e3f7-4109-982c-cb997343b7b6.jpg 4x, https://www.instacart.com/image-server/272x272/www.instacart.com/assets/domains/product-image/file/large_9104c3f7-ccf0-46c2-999d-41f99d4be2d1.jpg 4x",,,"Crown Royal Vanilla Flavored Whisky is infused with strong notes of rich, vanilla bean with delicate hints of oak for a refined flavor. It is perfect for a Vanilla Lager cocktail.","Infused with strong notes of rich, vanilla bean with delicate hints of oak for a refined flavor","GOVERNMENT WARNING: (1) According to the Surgeon General, women should not drink alcoholic beverages during pregnancy because of the risk of birth defects. (2) Consumption of alcoholic beverages impairs your ability to drive a car or operate machinery, and may cause health problems.",Bourbon Vanilla.,,
"Bacardí® Gold Rum, Gluten Free",$27.79,$35.69," https://www.instacart.com/image-server/272x272/www.instacart.com/assets/domains/product-image/file/large_6ac26ebf-6fbd-4b8f-a871-31b9eb9eb0d5.jpg 4x, https://www.instacart.com/image-server/272x272/www.instacart.com/assets/domains/product-image/file/large_f3fcb712-59e6-4aef-9091-dfb7a7af6d5c.jpg 4x, https://www.instacart.com/image-server/272x272/www.instacart.com/assets/domains/product-image/file/large_301ef46a-7ee7-4a0a-82d2-8897774dcbab.png 4x, https://www.instacart.com/image-server/272x272/www.instacart.com/assets/domains/product-image/file/large_7ef6ceb3-f35a-4e4e-a07c-8bc058717791.png 4x",Gluten Free,,"BACARDI Gold Rum is the perfect aged rum that you can casually sip or mix into any number of cocktails. This light-bodied rum is filtered through a secret blend of charcoal, mellowed for one to two years in toasted American white oak barrels, and blended to create a light golden rum with a soft oak flavor. This gluten free BACARDI Rum imparts notes of vanilla, ginger root and toasted with a dry and slightly sweet finish. When you are out with your friends enjoying the moment, use this rum liquor to bring depth and character to classic rum cocktails like the Cuba Libre, Ginger Snap or Rum and Cola. BACARDI is the oldest and largest family-owned rum company in the world. Please Drink Responsibly.,• One 1.75 L bottle of BACARDI Gold Rum,• Light rum is filtered through a secret blend of charcoal and mellowed for one to two years in toasted American white oak barrels,• Golden rum offers a rich, toasted and soft oak flavor that's easy to mix and simple to enjoy,• Aged rum that delivers aromatic notes of dry vanilla, ginger root, and toasted almond with a slightly sweet finish,• Mix this gluten free drink mixer into a number of alcohol drinks like a Cuba Libre cocktail, Ginger Snap or Rum and Cola","Fill a tall glass with plenty of cubed ice. Squeeze in two lime wedges. Add 1 part of Bacardi Gold, 2 parts of your favorite cola and stir.","WARNING: Drinking distilled spirits, beer, coolers, wine and other alcoholic beverages may increase cancer risk, and, during pregnancy, can cause birth defects. For more information go to www.P65Warnings.ca.gov/alcohol.",Superior Gold Rum.,,
Buchanan's DeLuxe Aged 12 Years Blended Scotch Whisky,$39.69,$55.59," https://www.instacart.com/image-server/272x272/www.instacart.com/assets/domains/product-image/file/large_2f3e3cba-1518-4e37-8c82-d41a72b457a9.jpg 4x, https://www.instacart.com/image-server/272x272/www.instacart.com/assets/domains/product-image/file/large_6e07eb2b-6537-42d2-bb05-723c050b217a.jpg 4x, https://www.instacart.com/image-server/272x272/www.instacart.com/assets/domains/product-image/file/large_30cb07b1-4328-4fd7-9f70-1920ea18dc71.jpg 4x",,,"Includes one 750 mL bottle of Buchanan's DeLuxe Aged 12 Years Blended Scotch Whisky. Features notes of citrus fruits and honey for a sweet, smooth flavor.",Best enjoyed in a Buchanita,"GOVERNMENT WARNING: (1) According to the Surgeon General, women should not drink alcoholic beverages during pregnancy because of the risk of birth defects. (2) Consumption of alcoholic beverages impairs your ability to drive a car or operate machinery, and may cause health problems.",,,
1800 Tequila Reposado,$35.69,$50.29," https://www.instacart.com/image-server/272x272/www.instacart.com/assets/domains/product-image/file/large_b530b94a-b44d-405d-a94f-8b52b3052d2b.jpg 4x, https://www.instacart.com/image-server/272x272/www.instacart.com/assets/domains/product-image/file/large_3194ddc1-4891-4f15-95ae-99a35d251fc4.jpg 4x, https://www.instacart.com/image-server/272x272/www.instacart.com/assets/domains/product-image/file/large_c63540d4-4c9e-4b23-bdaf-74dd941123dd.jpg 4x, https://www.instacart.com/image-server/272x272/www.instacart.com/assets/domains/product-image/file/large_58da868d-66aa-419c-a9ac-59dea9702653.jpg 4x",,,"1800® Reposado tequila is crafted using 100% Tequilana Weber blue agave cared for and handpicked by expert farmers in the highlands of Jalisco, Mexico. A selection of double-distilled white tequilas are blended together then matured in French and American oak barrels. This rich liquid has notes of buttery caramel, mild spices and a touch of smokiness, which is imparted by the finishing process. Perfect mixed in a cocktail or on the rocks. (ABV 40% - 80 proof)",{},"GOVERNMENT WARNING: (1) According to the Surgeon General, women should not drink alcoholic beverages during pregnancy because of the risk of birth defects. (2) Consumption of alcoholic beverages impairs your ability to drive a car or operate machinery, and may cause health problems.",100% Agave.,,
Chivas Regal Regal 12 Year Old Blended Scotch Whisky,$43.69,$48.99," https://www.instacart.com/image-server/272x272/www.instacart.com/assets/domains/product-image/file/large_5af6b33b-5b27-4a71-a040-0c6fa83abf71.jpg 4x, https://www.instacart.com/image-server/272x272/www.instacart.com/assets/domains/product-image/file/large_e781c11f-19cb-4a58-ac86-267e946c3374.jpg 4x, https://www.instacart.com/image-server/272x272/www.instacart.com/assets/domains/product-image/file/large_47ad08b7-4212-4614-b097-a744259289ba.jpg 4x, https://www.instacart.com/image-server/272x272/www.instacart.com/assets/domains/product-image/file/large_04908643-fa19-4ca5-8ab5-0bd0d7786114.jpg 4x",,,"Chivas Regal 12 Year Old Blended Scotch Whisky is a warm, smooth dram that brings together Strathisla malt and grain whiskies. This luxury scotch whisky uses a unique blend of the finest Speyside whiskies that have been aged for 12 years resulting in a smoother, richer taste. Wild herbs, heather, honey and orchard fruit aromas lead to a round and creamy palate with notes of honey, vanilla and ripe apple, ending in a rich, lingering finish. Reclaim a moment of connection and share Golden Hour with a glass of Chivas. Enjoy neat, on the rocks or in a variety of whisky cocktails like a Pineapple Gold Rush. Chivas Regal Whisky is a multi-award winning dram with over 300 awards to date. Chivas believes that blended is better, in life and in Scotch. Drink Responsibly.,BLENDED SCOTCH WHISKY: A warm, generous dram made from Strathisla malt and grain and aged 12 years for a smoother, richer taste,INCLUDES: One 750 mL bottle of Chivas Regal 12 Year Old Blended Scotch Whisky; 80 proof or 40% alcohol by volume; Enjoy and drink responsibly,SIP YOUR WAY: Enjoy this liquor neat, on the rocks, or in alcohol drinks like a Pineapple Gold Rush or classic cocktail at Golden Hour,TASTING NOTES: Wild herbs, heather and orchard fruits on the nose with tasting notes of luxurious honey and vanilla to ripe apple ending in a warm, lingering finish,CASK FINISH: A variety of casks are used for maturation of the 12-year-old Scotch whiskies that make up this blend","As A Speyside Whisky, Chivas Is Ultra Smooth, Perfect For Mixing With Cocktails (Or On Its Own) But Always To Be Shared.","Government Warning: (1) According to the Surgeon General, women should not drink alcoholic beverages during pregnancy because of the risk of birth defects. (2) Consumption of alcoholic beverages impairs your ability to drive a car or operate machinery, and may cause health problems.","Water,Grain,Malt",,
Absolut Citron Flavored Vodka,$25.19,$30.49," https://www.instacart.com/image-server/272x272/www.instacart.com/assets/domains/product-image/file/large_79a1a8cd-8a7c-44f6-a928-c934fb388a7b.jpg 4x, https://www.instacart.com/image-server/272x272/www.instacart.com/assets/domains/product-image/file/large_5f83f9f3-c9c8-4a8b-bbe9-1169d76776c3.jpg 4x, https://www.instacart.com/image-server/272x272/www.instacart.com/assets/domains/product-image/file/large_4837af55-731e-4c04-bee0-05c5c06bbe61.jpg 4x, https://www.instacart.com/image-server/272x272/www.instacart.com/assets/domains/product-image/file/large_29a36a54-9c7d-4fcd-9842-abc38e5d0141.jpg 4x",,,"Absolut Citron Flavored Vodka has provided a kick of lemon flavor and a smooth finish to your favorite cocktails for nearly 30 years. This fruity and luscious flavored vodka has the perfect balance of tangy lemon and vibrant lime with an underlying complexity that ends in a creamy mouthfeel with a touch of tartness. Crafted with local and quality ingredients, this premium vodka uses Swedish water, winter wheat grown in the fields of Ahus, Sweden, and no added sugar. Produced at the famous old distilleries near Ahus with more than 400 years of Swedish tradition, Absolut Vodka is sustainably crafted in an energy-efficient CO2-neutral distillery using a continuous distillation method to help achieve optimum purity. Enjoy this liquor with soda and ice for a quick and delicious cocktail, or try it in a Cosmopolitan, Citron Vodka Soda, or Lemon Drop cocktail. As one of the most famous vodkas in the world, Absolut continues to be a staple for your everyday get togethers and special moments with friends and family. Enjoy and Drink Responsibly.,ICONIC VODKA: Flavored vodka with a bright and refreshing citrus twist with lemon and lime notes,INCLUDES: One 750 mL bottle of Absolut Citron Vodka; 80 proof or 40% alcohol by volume; Enjoy and drink responsibly,BORN TO MIX: An easy-to-mix citrus-flavored zero sugar alcohol; enjoy in a variety of alcohol drinks and classic cocktails like Cosmopolitans and Lemon Drop Martinis,CRAFTED LOCALLY: Crafted with quality, local ingredients like Swedish water and winter wheat with no added sugar,EXPERTLY DISTILLED: Premium vodka distilled multiple times to help deliver a rich but clean taste and an exceptionally smooth mouthfeel","Enjoyed neat, on the rocks, or mixed in a classic cosmopolitan cocktail","Government Warning: (1) According to the Surgeon General, women should not drink alcoholic beverages during pregnancy because of the risk of birth defects. (2) Consumption of alcoholic beverages impairs your ability to drive a car or operate machinery, and may cause health problems.","Winter Wheat, Pristine Water",,
Dewar's® White Label Blended Scotch Whisky,,$24.99," https://www.instacart.com/image-server/272x272/www.instacart.com/assets/domains/product-image/file/large_25a47251-be57-4bd7-8959-abc810fc6ac6.jpg 4x, https://www.instacart.com/image-server/272x272/www.instacart.com/assets/domains/product-image/file/large_056becd0-ccf7-4fc3-b761-72e962878719.jpg 4x, https://www.instacart.com/image-server/272x272/www.instacart.com/assets/domains/product-image/file/large_b2ad675a-9bb4-4247-aef4-9657a3b89924.jpg 4x, https://www.instacart.com/image-server/272x272/www.instacart.com/assets/domains/product-image/file/large_4d9c8923-c74b-4c66-ab27-56cd3f2e9497.jpg 4x",,,"Dewar's White Label Blended Scotch Whisky is double aged for extra smoothness. This Scotch liquor delivers flavor notes of citrus, pear and honey so you can bring a tasteful sophistication to your drink. When you want to try something new, this Scotch alcohol can be enjoyed in delicious cocktails like the Original Soda Highball or on the rocks. You can also kick the flavorful experience up a notch by pairing this oak cask whisky with delectable foods like brie cheese, smoked salmon and dark orange chocolate. Dewar’s White Label Blended Scotch Whisky is aged, blended and aged again to ensure that it is as smooth as it possibly can be. This process guarantees that all flavors intertwine together to forge a well-rounded, Scotch whisky. Dewar’s is the world’s most awarded blended Scotch whisky. Enjoy Responsibly.,• One 750 mL bottle of Dewar's White Label Blended Scotch Whisky,• Scotch whisky that is double aged for extra smoothness,• Featuring flavor notes of citrus, pear and honey for a seamlessly well-rounded whisky,• 40% (80 proof) ABV alcohol,• Best served in your favorite whisky glass on the rocks or in a Original Soda Highball cocktail",{},"WARNING: Drinking distilled spirits, beer, coolers, wine and other alcoholic beverages may increase cancer risk, and, during pregnancy, can cause birth defects. For more information go to www.P65Warnings.ca.gov/alcohol.",Malt and Grain.,,
"Monkey Shoulder Whisky, Blended Malt Scotch",$47.59,$52.89, https://www.instacart.com/image-server/272x272/www.instacart.com/assets/domains/product-image/file/large_ba26e00d-2582-485d-8067-9062fb7a0812.jpeg 4x,,,"Monkey Shoulder is a blend of Speyside single malt Scotch whiskies married together for flavor and consistency. The richness and vibrancy combine with fruity aromas and mellow vanilla, making it perfect for mixed drinks and cocktails. Monkey Shoulder casks are former bourbon casks, which add smooth vanilla flavors to this Scotch. It also has no grain whisky whatsoever anywhere in or even near the drink. It's barley all the way, folks.,The name Monkey Shoulder might sound funny, but it has a history in whisky making. The maltmen who used to turn the barley would take long shifts, using their dominant arm significantly while working. At the end of the day, their shoulders would droop on one side, an ailment that became known as ""Monkey Shoulder."" Thankfully, the condition no longer exists, but the name lives on in our whisky.,Monkey Shoulder is made for mixing and stands out most in mixed drinks, given its orange and vanilla flavors with a bit of spice. Refreshingly approachable, try it in easy-to-make cocktails like whisky and soda (“Monkey Splash”), whisky and ginger ale (“Ginger Monkey”), and the “Lazy Old Fashioned.” Check out for the recipes!,Don't be a drunken monkey. Please drink responsibly.,• 100% Malt Whisky Made for Mixing,• Nose: zesty orange, vanilla honey and spiced oak,• Taste: mellow vanilla with spicy hints,• Finish: smooth with lingering notes of fruit and oak,• Refreshingly approachable, perfect for easy-to-make cocktails like whisky and soda (Monkey Splash), whisky and ginger ale (Ginger Monkey), and the Lazy Old Fashioned,• Kosher",Don't be a drunken monkey. Drink responsibly.,"Government Warning: (1) According to the Surgeon General, women should not drink alcoholic beverages during pregnancy because of the risk of birth defects. (2) Consumption of alcoholic beverages impairs your ability to drive a car or operate machinery, and may cause health problems.",,,
"Angel's Envy Bourbon Kentucky, 750 ml",,$52.09," https://www.instacart.com/image-server/272x272/www.instacart.com/assets/domains/product-image/file/large_8916fd1c-29ad-43b0-a8c8-f6fb2caa17a8.jpeg 4x, https://www.instacart.com/image-server/272x272/www.instacart.com/assets/domains/product-image/file/large_2e5b0c62-d119-4dac-b016-f0767a7765d8.jpeg 4x",,,"Angel's Envy Kentucky Straight Bourbon Whiskey is hand blended in batches of eight to 12 barrels at a time, finished in port wine barrels and unlike any bourbon you've ever tried. This Kentucky bourbon whiskey is a gold color laced with reddish amber hues and nearly copper in tone. This Kentucky whiskey liquor features aromatic notes of subtle vanilla, raisins, maple syrup and toasted nuts that lead to flavors of vanilla, ripe fruit, maple syrup, toast and bitter chocolate followed by a clean and lingering sweetness with a hint of Madeira that slowly fades. Every barrel is tasted throughout each stage of the aging process to ensure it meets perfectionist standards. Enjoy it neat in a bourbon glass, chilled, with just a splash of water or in alcohol drinks like an Old Fashioned. With Angel’s Envy, Heaven can wait. Please Drink Responsibly.",{},"WARNING: Drinking distilled spirits, beer, coolers, wine and other alcoholic beverages may increase cancer risk, and, during pregnancy, can cause birth defects. For more information go to www.P65Warnings.ca.gov/alcohol.",Kentucky Straight Bourbon Whiskey.,,
Knob Creek Bourbon Whiskey,$59.59,$62.19," https://www.instacart.com/image-server/272x272/www.instacart.com/assets/domains/product-image/file/large_91b58598-c280-408e-a03e-8fbbd7d0671a.png 4x, https://www.instacart.com/image-server/272x272/www.instacart.com/assets/domains/product-image/file/large_d1adad20-df3e-4b17-99e4-410bd1798ebb.png 4x",,,"Experience the well-earned, full flavor of Knob Creek 100 Proof Kentucky Straight Bourbon Whiskey. Knob Creek 100 Proof Kentucky Straight Bourbon Whiskey is aged nine years to draw out the natural sugars in charred white oak barrels. This full-bodied Kentucky bourbon features an oak aroma, a sweet, woody, almost fruity taste, and a long, rich finish. Enjoy Knob Creek Bourbon Whiskey neat, on the rocks or in your favorite cocktails. This bottle of whiskey is 50% alcohol by volume and should be enjoyed responsibly. Explore the entire Knob Creek Family for yourself and discover what whiskey was meant to be.,• The original Kentucky bourbon whiskey that started it all,• Full-bodied straight bourbon whiskey aged nine years in white oak barrels,• Bourbon whiskey liquor with notes of a sweet, woody, almost fruity taste,• Enjoy sipping Knob Creek whiskey neat, on the rocks or in cocktail drinks,• Knob Creek bourbon whiskey is ideal for making beverages such as an Old Fashioned",{},"Government Warning: (1) According to the Surgeon General, women should not drink alcoholic beverages during pregnancy because of the risk of birth defects. (2) Consumption of alcoholic beverages impairs your ability to drive a car or operate machinery, and may cause health problems.",,,
